"{""follow_request_sent"": false, ""has_extended_profile"": false, ""profile_use_background_image"": false, ""profile_text_color"": ""666666"", ""default_profile_image"": false, ""id"": 21790920, ""profile_background_image_url_https"": ""https://pbs.twimg.com/profile_background_images/46022363/Untitled-1.jpg"", ""verified"": false, ""imported_to_gensim"": false, ""profile_location"": {""full_name"": ""Portland, OR"", ""url"": ""https://api.twitter.com/1.1/geo/id/ac88a4f17a51c7fc.json"", ""country"": """", ""place_type"": ""unknown"", ""bounding_box"": null, ""contained_within"": [], ""country_code"": """", ""attributes"": {}, ""id"": ""ac88a4f17a51c7fc"", ""name"": ""Portland, OR""}, ""profile_image_url_https"": ""https://pbs.twimg.com/profile_images/717126353951174657/0a5Br9CG_normal.jpg"", ""profile_sidebar_fill_color"": ""252429"", ""entities"": {""url"": {""urls"": [{""url"": ""https://t.co/zCVThg62Wp"", ""indices"": [0, 23], ""expanded_url"": ""https://instagram.com/brianlogan"", ""display_url"": ""instagram.com/brianlogan""}]}, ""description"": {""urls"": []}}, ""followers_count"": 473, ""profile_sidebar_border_color"": ""181A1E"", ""id_str"": ""21790920"", ""profile_background_color"": ""000000"", ""listed_count"": 41, ""status"": {""contributors"": null, ""truncated"": false, ""text"": ""RT @johngreen: And here's an awesome @thoughtcafe video on the challenges posed by even the simplest interstellar travel: https://t.co/pFqg\u2026"", ""is_quote_status"": false, ""in_reply_to_status_id"": null, ""id"": 730901434825203712, ""favorite_count"": 0, ""source"": ""<a href=\""http://twitter.com\"" rel=\""nofollow\"">Twitter Web Client</a>"", ""retweeted"": false, ""coordinates"": null, ""entities"": {""symbols"": [], ""user_mentions"": [{""id"": 18055737, ""indices"": [3, 13], ""id_str"": ""18055737"", ""screen_name"": ""johngreen"", ""name"": ""John Green""}, {""id"": 39410338, ""indices"": [37, 49], ""id_str"": ""39410338"", ""screen_name"": ""thoughtcafe"", ""name"": ""Thought Caf\u00e9""}], ""hashtags"": [], ""urls"": [{""url"": ""https://t.co/pFqgYcjxOg"", ""indices"": [122, 140], ""expanded_url"": ""https://www.youtube.com/watch?v=RTn77uCYU_8&feature=youtu.be"", ""display_url"": ""youtube.com/watch?v=RTn77u\u2026""}]}, ""in_reply_to_screen_name"": null, ""in_reply_to_user_id"": null, ""retweet_count"": 57, ""id_str"": ""730901434825203712"", ""favorited"": false, ""retweeted_status"": {""contributors"": null, ""truncated"": false, ""text"": ""And here's an awesome @thoughtcafe video on the challenges posed by even the simplest interstellar travel: https://t.co/pFqgYcjxOg"", ""is_quote_status"": false, ""in_reply_to_status_id"": null, ""id"": 730900402300821504, ""favorite_count"": 364, ""source"": ""<a href=\""http://twitter.com\"" rel=\""nofollow\"">Twitter Web Client</a>"", ""retweeted"": false, ""coordinates"": null, ""entities"": {""symbols"": [], ""user_mentions"": [{""id"": 39410338, ""indices"": [22, 34], ""id_str"": ""39410338"", ""screen_name"": ""thoughtcafe"", ""name"": ""Thought Caf\u00e9""}], ""hashtags"": [], ""urls"": [{""url"": ""https://t.co/pFqgYcjxOg"", ""indices"": [107, 130], ""expanded_url"": ""https://www.youtube.com/watch?v=RTn77uCYU_8&feature=youtu.be"", ""display_url"": ""youtube.com/watch?v=RTn77u\u2026""}]}, ""in_reply_to_screen_name"": null, ""in_reply_to_user_id"": null, ""retweet_count"": 57, ""id_str"": ""730900402300821504"", ""favorited"": false, ""geo"": null, ""in_reply_to_user_id_str"": null, ""possibly_sensitive"": false, ""lang"": ""en"", ""created_at"": ""Thu May 12 23:20:10 +0000 2016"", ""in_reply_to_status_id_str"": null, ""place"": null}, ""geo"": null, ""in_reply_to_user_id_str"": null, ""possibly_sensitive"": false, ""lang"": ""en"", ""created_at"": ""Thu May 12 23:24:16 +0000 2016"", ""in_reply_to_status_id_str"": null, ""place"": null}, ""is_translation_enabled"": false, ""utc_offset"": -25200, ""statuses_count"": 10410, ""description"": ""#Oregon Grown, Rooted in #PDX \u2022 #Artist \u2022 #Advocate \u2022 #Philosopher \u2022 #CannabisEnthusiast \u2022 #Queer AF \u2022  TULU \u2022  VOTE FOR #BERNIE!!! (My Thoughts Are My Own Yo!)"", ""friends_count"": 637, ""location"": ""Portland, OR"", ""profile_link_color"": ""000000"", ""profile_image_url"": ""http://pbs.twimg.com/profile_images/717126353951174657/0a5Br9CG_normal.jpg"", ""following"": false, ""geo_enabled"": false, ""profile_banner_url"": ""https://pbs.twimg.com/profile_banners/21790920/1459911367"", ""profile_background_image_url"": ""http://pbs.twimg.com/profile_background_images/46022363/Untitled-1.jpg"", ""name"": ""Brian logan"", ""lang"": ""en"", ""profile_background_tile"": true, ""favourites_count"": 951, ""screen_name"": ""brianlogan"", ""notifications"": false, ""url"": ""https://t.co/zCVThg62Wp"", ""created_at"": ""Tue Feb 24 20:07:34 +0000 2009"", ""contributors_enabled"": false, ""time_zone"": ""Pacific Time (US & Canada)"", ""protected"": false, ""default_profile"": false, ""is_translator"": false}"
"If #olloclip made a ND filter, I would be so happy."
Poor mans #NDFilter attachment for the #iPhone on these bright sunny #PDX days. 😂 it works so… https://t.co/nJkkoLmsZV
$175 for the #MoonDog #Anamorphic adapter for the iPhone!?  Anyone want to buy a kidney?
Are you peeps ready for #Hyperloop? #Futurism https://t.co/ybjAOcojbs
"Yup, I love the #Filmicpro app. A must have for any #filmmaker. It is definitely worth every dollar."
"Been so MIA lately. Focusing on film, writing and FO4. What you peeps been up to?"
"Did some lighting and shot tests last night, got to say, sliders make things look a million times better."
Do I want Bloodborne for $20 at Bestbuy?
@People4Bernie Just voted today!
"#henandchicks after a shower. Enjoying me some #macrophotography.

#gardenlovers #iphoneography… https://t.co/dTsSUWiQL1"
How are all you twitter peeps doing today? I'm voting here in #oregon right now. #FeelTheBern #pdx
"@LexLeigh it is, but Bethesda always does that for me."
@Joel004 @jakebowen_ 👌🏽👍🏽
"@LexLeigh I rented it and put in 48hrs in 3 days, but still didnt get enough. haha"
"@jakebowen_ for sure, I know Zach and @Joel004 has it too, so should defiantly get some team team play."
"Finally broke down, bought Fallout 4 and the DLC, also saw that Battlefield 4 is only 10$ on #PSN right now, so got that too."
I can't get away from telling stories about the human condition through film. My first love will always be my first love.
"I'm set with #FilmicPro for video, but whats the best #iOS Manual Camera App out there?"
"I need to make a living some how, I hated selling my soul in the world of photography, but I was at least able to live off of it. Hmm"
Looks like I'm getting new strings today... https://t.co/wdoPgkKvgp
@djsacrilicious dropped my condenser mic a couple years ago breaking it and making me make straight electronic music.
"@djsacrilicious Haven't incorporated guitar, but I use violins, cellos, pianos in almost all my electronic tracks one way or another."
"Seeing Steve Caballero still shredding it after all these years. 
https://t.co/JNWKaVkLOk"
"Haven't wrote an electronic track in almost two months, but I've been making acoustic music again.  Me gusta."
@andrewthesmart I'm not sure they are now though haha got some thinking to do still on this one. Thanks for the spark. 👍🏼
@andrewthesmart do you not think we are all at least some what self-conscious about at least one thing?
@andrewthesmart that's really interesting. I wouldn't think you could separate the two. Can you have one without the other?
"@RobRicci1 @cnnbrk I don’t think you understand sarcasm, but thanks for your ad hominem remarks. 👍🏼"
@cnnbrk the horror!! /s
"The only thing that makes sense is what I create, everything else is my own interpretation, though I try to match the current consensus."
@andrewthesmart what’s the difference?
"“If there is a God or some master plan, it must make you wonder why this is your part…” -Echo #Tinder #shortfilms #pdx"
"An ugly truth is that not all will succeed, not all will make it, most will be lost and forgotten, there are few who will not be."
There is no adventure like that of diving into ones self.
Did you lose the fire? Have you set your sail?
Who steals plants? Had some plants stolen from the front lawn.
@LexLeigh hangovers are the worst come downs of any drug. That time works for me. 👍🏼
"@LexLeigh that’s the time you’d be shooting to get up here? Or leave? Also If your headache is killing you, you don’t have to come up."
@LexLeigh why didn’t you text this? What time where you thinking? And you have somewhere to be at 5 right?
"Got my Olloclip in the mail, have to say, I'm super impressed with the CP Lens."
There are some who would drown in the abyss and there are others who fall when they fly to high.
I think I'll take my hand and fold.
Yo #PDX we got a #DankDeal over at #NectarCannabis check it! https://t.co/HFWI03aRuI
"@Brains4Bern @shapsgotyoback Yup, @realDonaldTrump talking about #Peace after saying he's ok way #waterboarding, is straight pandering/game"
"Doing a photo shoot this week, acting in a film next week and filming my short Tinder, again, yay rewrites! Thanks art."
"Across the riverbed laid my soul out to dry, and wonder why I hate it here."
Do we want free will? Or multiple choice?
#Tinder (My Film) is about #FreeWill and #Destiny. It's about #choice and #responsibility. It's about #life and #death.
"""If you are lonely when you're alone, you are in bad company.""-Jean-Paul Sartre"
"How long will ""The Human Species"" last? I do not know, but I may only make it another ""50 years"". Choices are all we have, right?"
Then the joker laughed and drank his gin.
I miss the kinds of conversations I had last night. It been proven rare to find such. Life is very odd.
