"{""follow_request_sent"": false, ""has_extended_profile"": false, ""profile_use_background_image"": true, ""profile_text_color"": ""333333"", ""default_profile_image"": false, ""id"": 11262752, ""profile_background_image_url_https"": ""https://pbs.twimg.com/profile_background_images/624456319702056960/Ugw9yWBp.jpg"", ""verified"": false, ""imported_to_gensim"": false, ""profile_location"": null, ""profile_image_url_https"": ""https://pbs.twimg.com/profile_images/689070121092907008/H-cFcJMO_normal.jpg"", ""profile_sidebar_fill_color"": ""FFFFFF"", ""entities"": {""description"": {""urls"": []}}, ""followers_count"": 1963, ""profile_sidebar_border_color"": ""FFFFFF"", ""id_str"": ""11262752"", ""profile_background_color"": ""3B94D9"", ""listed_count"": 152, ""status"": {""contributors"": null, ""truncated"": false, ""text"": ""RT @banditelli: This is why I'm anti-fork https://t.co/ytcZfAZQvQ"", ""is_quote_status"": true, ""in_reply_to_status_id"": null, ""id"": 731079648839401472, ""favorite_count"": 0, ""source"": ""<a href=\""http://twitter.com\"" rel=\""nofollow\"">Twitter Web Client</a>"", ""quoted_status_id"": 731000581821587456, ""retweeted"": false, ""coordinates"": null, ""entities"": {""symbols"": [], ""user_mentions"": [{""id"": 16397938, ""indices"": [3, 14], ""id_str"": ""16397938"", ""screen_name"": ""banditelli"", ""name"": ""Brett Banditelli""}], ""hashtags"": [], ""urls"": [{""url"": ""https://t.co/ytcZfAZQvQ"", ""indices"": [42, 65], ""expanded_url"": ""https://twitter.com/yvonnecoghill1/status/731000581821587456"", ""display_url"": ""twitter.com/yvonnecoghill1\u2026""}]}, ""in_reply_to_screen_name"": null, ""in_reply_to_user_id"": null, ""retweet_count"": 2, ""id_str"": ""731079648839401472"", ""favorited"": false, ""retweeted_status"": {""contributors"": null, ""truncated"": false, ""text"": ""This is why I'm anti-fork https://t.co/ytcZfAZQvQ"", ""is_quote_status"": true, ""in_reply_to_status_id"": null, ""id"": 731079126036054017, ""favorite_count"": 2, ""source"": ""<a href=\""http://twitter.com/download/android\"" rel=\""nofollow\"">Twitter for Android</a>"", ""quoted_status_id"": 731000581821587456, ""retweeted"": false, ""coordinates"": null, ""entities"": {""symbols"": [], ""user_mentions"": [], ""hashtags"": [], ""urls"": [{""url"": ""https://t.co/ytcZfAZQvQ"", ""indices"": [26, 49], ""expanded_url"": ""https://twitter.com/yvonnecoghill1/status/731000581821587456"", ""display_url"": ""twitter.com/yvonnecoghill1\u2026""}]}, ""in_reply_to_screen_name"": null, ""in_reply_to_user_id"": null, ""retweet_count"": 2, ""id_str"": ""731079126036054017"", ""favorited"": false, ""geo"": null, ""in_reply_to_user_id_str"": null, ""possibly_sensitive"": false, ""lang"": ""en"", ""created_at"": ""Fri May 13 11:10:21 +0000 2016"", ""quoted_status_id_str"": ""731000581821587456"", ""in_reply_to_status_id_str"": null, ""place"": null}, ""geo"": null, ""in_reply_to_user_id_str"": null, ""possibly_sensitive"": false, ""lang"": ""en"", ""created_at"": ""Fri May 13 11:12:25 +0000 2016"", ""quoted_status_id_str"": ""731000581821587456"", ""in_reply_to_status_id_str"": null, ""place"": null}, ""is_translation_enabled"": false, ""utc_offset"": -14400, ""statuses_count"": 18737, ""description"": ""#ThePeopleforBernieSanders2016. \n#EnvironmentalistsForBernie\nLives in a gerrymandered district in Michigan."", ""friends_count"": 923, ""location"": """", ""profile_link_color"": ""93A644"", ""profile_image_url"": ""http://pbs.twimg.com/profile_images/689070121092907008/H-cFcJMO_normal.jpg"", ""following"": false, ""geo_enabled"": true, ""profile_banner_url"": ""https://pbs.twimg.com/profile_banners/11262752/1434439365"", ""profile_background_image_url"": ""http://pbs.twimg.com/profile_background_images/624456319702056960/Ugw9yWBp.jpg"", ""name"": ""Diane Sweet"", ""lang"": ""en"", ""profile_background_tile"": false, ""favourites_count"": 6922, ""screen_name"": ""DianeSweet"", ""notifications"": false, ""url"": null, ""created_at"": ""Mon Dec 17 20:07:34 +0000 2007"", ""contributors_enabled"": false, ""time_zone"": ""Eastern Time (US & Canada)"", ""protected"": false, ""default_profile"": false, ""is_translator"": false}"
"Coast Guard: Shell line leaks 88,200 gallons into the Gulf  https://t.co/6rcNS06PXM"
"""Send us a number, we'll send you the cash!"" Wow.
 https://t.co/Ypt7COzNfy"
Fire that led to Texas fertilizer blast set on purpose @CNN https://t.co/8w3UPm6FJz
No oil and gas leasing in our National Forest -- protect the Wyoming range! https://t.co/XxNZ7wpK52
The hands that work the puppets... https://t.co/jbtMqTIwEE
Thanks to all you Berners in West Virginia! XO  #FeelTheBern https://t.co/jULbDdkeGU
"NRA Convention Sells ""Ex-Girlfriend"" Target That Bleeds When You Shoot It @alternet https://t.co/ubexY0ccR2"
"More on the Enbridge Line 5 leak/Decades after pipeline spill, contamination could remain https://t.co/4rEPxEOQZP #KeepItInTheGround"
Enbridge oil spill in U.P. went unnoticed for 30 years https://t.co/AnHT7C0zSX  #KeepItInTheGround
:( Young father latest victim in more than 20 Detroit shootings over weekend  https://t.co/3bRzsVd1Od
Hillary supporters are realizing that there is no hope with her policies. If only they could just #FeelTheBern ! https://t.co/TyKVqm1FVy
":(  Humans annoy much of the wildlife at Yellowstone, but Scarface? He was very easy-going. RIP old guy. https://t.co/ZzVpK6mVyb"
#FeelTheBern https://t.co/fQllD2RkML
"Trump fans usually hide under rocks most of the time, but he unleashed them in the light of day, God help us. https://t.co/H1EqLKO0FB"
"Happy Friday, everyone!  https://t.co/TemX2ozVag"
"#FF: @Sherry_Reson, @edgery, @nicolesandler, @TenneyNaumer, @ergVT, @daphnewysham, @heatherlibby, @FredClarkson, @jaycarmona"
"Um, no. Just no. https://t.co/OBJfi2lMMi"
"I don't think ""I think that that is a hypothetical that will not happen."" means what @hill thinks it means. https://t.co/axEvqUpbkl"
"@cliffschecter Yeah, those Trump supporters are just so classy."
