"{""follow_request_sent"": false, ""has_extended_profile"": false, ""profile_use_background_image"": true, ""profile_text_color"": ""333333"", ""default_profile_image"": false, ""id"": 32589035, ""profile_background_image_url_https"": ""https://abs.twimg.com/images/themes/theme1/bg.png"", ""verified"": false, ""imported_to_gensim"": false, ""profile_location"": null, ""profile_image_url_https"": ""https://pbs.twimg.com/profile_images/709348272356401153/kSzuNHsM_normal.jpg"", ""profile_sidebar_fill_color"": ""DDEEF6"", ""entities"": {""description"": {""urls"": []}}, ""followers_count"": 280, ""profile_sidebar_border_color"": ""C0DEED"", ""id_str"": ""32589035"", ""profile_background_color"": ""C0DEED"", ""listed_count"": 24, ""status"": {""contributors"": null, ""truncated"": false, ""text"": ""RT @NYSAFLCIO: When @CWAUnion discovered massive @Verizon offshoring in the Philippines the company called in the SWAT team. Story:\u00a0https:/\u2026"", ""is_quote_status"": false, ""in_reply_to_status_id"": null, ""id"": 731170908975583233, ""favorite_count"": 0, ""source"": ""<a href=\""http://twitter.com\"" rel=\""nofollow\"">Twitter Web Client</a>"", ""retweeted"": false, ""coordinates"": null, ""entities"": {""symbols"": [], ""user_mentions"": [{""id"": 485805200, ""indices"": [3, 13], ""id_str"": ""485805200"", ""screen_name"": ""NYSAFLCIO"", ""name"": ""NYSAFLCIO""}, {""id"": 28796289, ""indices"": [20, 29], ""id_str"": ""28796289"", ""screen_name"": ""CWAUnion"", ""name"": ""CWA""}, {""id"": 59889953, ""indices"": [49, 57], ""id_str"": ""59889953"", ""screen_name"": ""verizon"", ""name"": ""Verizon""}], ""hashtags"": [], ""urls"": [{""url"": ""https://t.co/H4ayOMkMjR"", ""indices"": [139, 140], ""expanded_url"": ""http://www.cwa-union.org/news/releases/cwa-uncovers-massive-verizon-offshoring-operation-in-philippines"", ""display_url"": ""cwa-union.org/news/releases/\u2026""}]}, ""in_reply_to_screen_name"": null, ""in_reply_to_user_id"": null, ""retweet_count"": 4, ""id_str"": ""731170908975583233"", ""favorited"": false, ""retweeted_status"": {""contributors"": null, ""truncated"": false, ""text"": ""When @CWAUnion discovered massive @Verizon offshoring in the Philippines the company called in the SWAT team. Story:\u00a0https://t.co/H4ayOMkMjR"", ""is_quote_status"": false, ""in_reply_to_status_id"": null, ""id"": 731169518505103361, ""favorite_count"": 3, ""source"": ""<a href=\""http://twitter.com/download/android\"" rel=\""nofollow\"">Twitter for Android</a>"", ""retweeted"": false, ""coordinates"": null, ""entities"": {""symbols"": [], ""user_mentions"": [{""id"": 28796289, ""indices"": [5, 14], ""id_str"": ""28796289"", ""screen_name"": ""CWAUnion"", ""name"": ""CWA""}, {""id"": 59889953, ""indices"": [34, 42], ""id_str"": ""59889953"", ""screen_name"": ""verizon"", ""name"": ""Verizon""}], ""hashtags"": [], ""urls"": [{""url"": ""https://t.co/H4ayOMkMjR"", ""indices"": [117, 140], ""expanded_url"": ""http://www.cwa-union.org/news/releases/cwa-uncovers-massive-verizon-offshoring-operation-in-philippines"", ""display_url"": ""cwa-union.org/news/releases/\u2026""}]}, ""in_reply_to_screen_name"": null, ""in_reply_to_user_id"": null, ""retweet_count"": 4, ""id_str"": ""731169518505103361"", ""favorited"": false, ""geo"": null, ""in_reply_to_user_id_str"": null, ""possibly_sensitive"": false, ""lang"": ""en"", ""created_at"": ""Fri May 13 17:09:32 +0000 2016"", ""in_reply_to_status_id_str"": null, ""place"": {""full_name"": ""Manhattan, NY"", ""url"": ""https://api.twitter.com/1.1/geo/id/01a9a39529b27f36.json"", ""country"": ""United States"", ""place_type"": ""city"", ""bounding_box"": {""type"": ""Polygon"", ""coordinates"": [[[-74.026675, 40.683935], [-73.910408, 40.683935], [-73.910408, 40.877483], [-74.026675, 40.877483]]]}, ""contained_within"": [], ""country_code"": ""US"", ""attributes"": {}, ""id"": ""01a9a39529b27f36"", ""name"": ""Manhattan""}}, ""geo"": null, ""in_reply_to_user_id_str"": null, ""possibly_sensitive"": false, ""lang"": ""en"", ""created_at"": ""Fri May 13 17:15:03 +0000 2016"", ""in_reply_to_status_id_str"": null, ""place"": null}, ""is_translation_enabled"": false, ""utc_offset"": -14400, ""statuses_count"": 15802, ""description"": ""Belt Parkway insider..."", ""friends_count"": 214, ""location"": ""Brooklyn, NY USA"", ""profile_link_color"": ""0084B4"", ""profile_image_url"": ""http://pbs.twimg.com/profile_images/709348272356401153/kSzuNHsM_normal.jpg"", ""following"": false, ""geo_enabled"": true, ""profile_background_image_url"": ""http://abs.twimg.com/images/themes/theme1/bg.png"", ""name"": ""J. Simone Posner"", ""lang"": ""en"", ""profile_background_tile"": false, ""favourites_count"": 7166, ""screen_name"": ""simoneonphone"", ""notifications"": false, ""url"": null, ""created_at"": ""Fri Apr 17 21:14:44 +0000 2009"", ""contributors_enabled"": false, ""time_zone"": ""Eastern Time (US & Canada)"", ""protected"": false, ""default_profile"": true, ""is_translator"": false}"
Another story about Clifford Moyers #LGBT #RIPCliffordMoyers @stevesilberman https://t.co/sP4YhYpKkH #KOPN #Missourian
Change is hard for them.  Missouri has a bad history with this. @stevesilberman https://t.co/Z3Xqlf0VGG #RIPCliffordMoyers
This looks like #oldschool FUN #RevengeOfTheNerds #Nerds Revenge of the Nerds https://t.co/eQ7HUZxiE1 via @sharethis
"Naples has the right idea. 2KM long pizza. 2tons Flour, 2 tons Mozzarella, etc. I'm looking at you @NewParkPizza https://t.co/rAUt9jicZs"
So who kissed who's ring?  Was it Trump or Ryan? #EndTheTeaParty
#ThingsVillainsDoForFun conspire on inauguration night to undermine POTUS then  shutdown the government. #endtheteaparty #GOPShutDown
#CleanWater is integral to public health policy. #FlintWaterCrisis revisited with 9 important follow up questions. https://t.co/1Xy0qgSJGn
Not unless DQ serves DT a POTATOE #dropTheElikeaBoss #potato @adamjohnsonNYC @AriMelber @TODAYshow
Listen Up #BernieOrBust Trump RTs in my TL cause we mustn't settle for Warren VP slot concession when @TheDemocrats betray #FeelTheBern
In other news @DineshDSouza is still an irrelevant oxygen thief...and by the way THAT IS POLITICALLY CORRECT. https://t.co/oKUXS6ssom
First there was #WhiteWater then there was #PlatteRiver -- HRC is up the creek without a paddle. #GoodByeHillary #DropOutHillary
Is #CrazyBernie just another @CorrectRecord gaffe? #HillNo #GetTheHillOuttaHere #FeelTheBern #BernUpTheDNC #BernUpTheUSA #ImWithHerVictims
Looking back on #BlackLivesMatter &amp; #TransLivesMatter there's no #PC political correctness. https://t.co/JD5r2wmcMU https://t.co/gu7DohLtTl
The kid who did the research is awesome! The story isn't: Long-Lost Mayan City a Teen Found Isn’t Lost or a City https://t.co/lSrHRlX4NA
Nader's advice for @BernieSanders GO after Trump/GOP in public forums irrespective of nomination status.  ABSOLUTELY YES. #FeelTheBern
People really need to be listening to Ralph Nader right now.  2 party system is rigged.  They only way to fight it is to vote against it!
"Here I thought good Christians don't gamble! That's what happens when you have ""cafeteria morality"" #endtheteaparty https://t.co/orB7hjJZAP"
"Again, @BernieSanders proves his ability to stand up to @GOP by taking on those values at the core #AtlanticCity https://t.co/YZMaqE58A2"
The @GOP splits as many republicans with @TheDemocrats back HRC but then that would make the so-called 2 party system a single tyranny!
"How in 2016 @TheDemocrats as a ""party of, by &amp; for the people"" - PAY FOR PLAY AT THE DNC #partymachine https://t.co/nHwuTWkvkH via @nypost"
"So, what were the qualifications of the installers &amp; inspectors of this Spectra #Pipeline #GasExplosion https://t.co/6OJ1xcOPRW #1U #aflcio"
"OR...now, I'm just saying...we COULD vote for the other Jewish POTUS candidate @DrJillStein #ItsInOurHands @jewsforbernie @fight_trump"
"Also thanks to my tweeps for another great week of Favs, RTs &amp; a big welcome to my new follows. Have a great week!"
"Ok Tweeps, let's get back to issues too many references in my TL about someone whose name Rhymes with ""Frump"" #talkabouttheissues"
Here you go Chris Christie horror look behind JARJAR TRUMP #starwarsday https://t.co/ys2SLrzZq3 @MooreResolute
Your picture would be better if it had the horror look of Jabba the Hutt behind him. @MooreResolute https://t.co/hbiNQjd89B
Jedis have blue balls #StarWarsIn4Words
Lando Steals Han's Clothes #StarWarsIn4Words
Go Make mine Dengar #StarWarsIn4Words
Williams rips off Holst #StarWarsIn4Words #Planets
QuiGon was an alcoholic #StarWarsIn4Words
BRING JARJAR BINKS BACK #StarWarsIn4Words
Big evil will prevail when the good minded voter is cowered into voting for the little evil.  #DropOutHillary #GetTheHillOuttaHere
