"{""follow_request_sent"": false, ""has_extended_profile"": false, ""profile_use_background_image"": true, ""profile_text_color"": ""333333"", ""default_profile_image"": true, ""id"": 4923706789, ""profile_background_image_url_https"": null, ""verified"": false, ""imported_to_gensim"": false, ""profile_location"": null, ""profile_image_url_https"": ""https://abs.twimg.com/sticky/default_profile_images/default_profile_1_normal.png"", ""profile_sidebar_fill_color"": ""DDEEF6"", ""entities"": {""description"": {""urls"": []}}, ""followers_count"": 38, ""profile_sidebar_border_color"": ""C0DEED"", ""id_str"": ""4923706789"", ""profile_background_color"": ""F5F8FA"", ""listed_count"": 8, ""status"": {""contributors"": null, ""truncated"": false, ""text"": ""Side with wildlife! Climate action attacked in the courts: https://t.co/zv1vhhC48i via @WildlifeAction"", ""is_quote_status"": false, ""in_reply_to_status_id"": null, ""id"": 731175460910964736, ""favorite_count"": 0, ""source"": ""<a href=\""http://mobile.twitter.com\"" rel=\""nofollow\"">Mobile Web</a>"", ""retweeted"": false, ""coordinates"": null, ""entities"": {""symbols"": [], ""user_mentions"": [{""id"": 22819917, ""indices"": [87, 102], ""id_str"": ""22819917"", ""screen_name"": ""wildlifeaction"", ""name"": ""Wildlife Action""}], ""hashtags"": [], ""urls"": [{""url"": ""https://t.co/zv1vhhC48i"", ""indices"": [59, 82], ""expanded_url"": ""http://bit.ly/1ZFWRCx"", ""display_url"": ""bit.ly/1ZFWRCx""}]}, ""in_reply_to_screen_name"": null, ""in_reply_to_user_id"": null, ""retweet_count"": 0, ""id_str"": ""731175460910964736"", ""favorited"": false, ""geo"": null, ""in_reply_to_user_id_str"": null, ""possibly_sensitive"": false, ""lang"": ""en"", ""created_at"": ""Fri May 13 17:33:09 +0000 2016"", ""in_reply_to_status_id_str"": null, ""place"": null}, ""is_translation_enabled"": false, ""utc_offset"": null, ""statuses_count"": 1170, ""description"": """", ""friends_count"": 127, ""location"": ""Arizona "", ""profile_link_color"": ""2B7BB9"", ""profile_image_url"": ""http://abs.twimg.com/sticky/default_profile_images/default_profile_1_normal.png"", ""following"": false, ""geo_enabled"": false, ""profile_background_image_url"": null, ""name"": ""Jeff Beard"", ""lang"": ""en"", ""profile_background_tile"": false, ""favourites_count"": 597, ""screen_name"": ""zandertheone"", ""notifications"": false, ""url"": null, ""created_at"": ""Thu Feb 18 03:18:20 +0000 2016"", ""contributors_enabled"": false, ""time_zone"": null, ""protected"": false, ""default_profile"": true, ""is_translator"": false}"
Side with wildlife! Climate action attacked in the courts: https://t.co/zv1vhhC48i via @WildlifeAction
Say THANKS to the Obama administration for affirming respect for #transgender youth! @freedom4allusa https://t.co/WCTJAofThT #LGBT
Stop seismic surveys that harm whales! Send your letter to the White House today: https://t.co/sJHxPjAfT8 via @theWCS
Tell @USDOT @SecretaryFoxx to stop anti-Muslim racial profiling on planes https://t.co/StUO7JsvjD via @CREDOMobile #FlyingWhileMuslim
"Wild animal furrier slaughterhouse asks Internet for $20K to fight ""the slander"" https://t.co/QHZv7agbYp via @Change"
Who would most help the middle class? Trump? Clinton? Sanders – vote in poll https://t.co/xxhIZO5RmJ
Urge @GinaEPA to use sound science in methane rules: https://t.co/EydukHClOL #CutMethane #ActOnClimate
President Obama: Free Our Dads! https://t.co/4ItwvSjHGT via @Change
Tell the @EPA: Ban nerve-damaging pesticides harming nearly all endangered species https://t.co/XyVNR532z4 via @CREDOMobile #p2
Save endangered sea turtles from lethal pipelines in Florida https://t.co/V8nbgts877
UK greyhound activists stake out airport to block greyhound shipment to China https://t.co/57Eq80a6fZ via @Change
I just wrote a @theactionnet letter: Tell Congress: Support Safe Staffing Standards. Write one here: https://t.co/RAXLrHUYM3 #AFTNHP
Tell Congress: Stop the federal license to discriminate against #LGBT Americans! @freedom4allusa #StopFADA https://t.co/McJSukeMp3
The Clean Power Plan is under attack in court. Sign @NRDC's petition to protect America's clean energy future: https://t.co/JnoUqiMiBQ
Privacy shouldn’t end where Netflix begins. Tell Netflix: Respect VPNs https://t.co/LwlISFi5hs (via @OpenMediaOrg) #MyNetflixMyPrivacy
#Childcare costs too much $. Urge #Congress to support the Working Families Relief Act to make it more affordable. https://t.co/ysNkq71GWV
"Hey @Walmart, stop destroying our oceans to fill your #GreatValue brand tuna cans! https://t.co/cBLpvaAieN https://t.co/Kgoa0rf4RW"
Justice for Scarface: Tell USFWS No New Hunting in Greater Yellowstone! https://t.co/XAe7uSr00f
Petition update - Wildlife petting zoo turns furrier slaughterhouse when nobody's watching https://t.co/tVexWtpofN via @Change
.@TysonFoods: let your workers take bathroom breaks when they need to! #GiveThemABreak https://t.co/QKk20giya6
Choose Saving the Great Barrier Reef Over Dirty Coal https://t.co/jNlycAUFLD
"This ""Bernie Sanders Glowsticks""  Meme Was Made by Someone Who Wants to Kill You by @jacksmithiv https://t.co/4kbwf2Vvxw via @MicNews"
Five Pacific islands lost to rising seas as climate change hits https://t.co/Zxc3YNRlnB
I just signed a @progressivekick petition: I Agree with Bernie; What Do We Stand For? Sign here: https://t.co/S3iIF87Pve #FeelTheBern
Petition · U.S. Fish and Wildlife Service: Stop US Fish and Wildlife from Killing the Dell Creek Wolf Pack · https://t.co/knfkfyP2f0
Sage-grouse are NOT a threat to national security. Keep wildlife out of the #NDAA  https://t.co/LMfMuil06R
Taking it to the Governor! Please Sign and Post on Your Social Media Pages. https://t.co/VSywQhlbIn via @Change
Tell the US Senate: Repeal the giveaway of holy Native American land to a foreign mining company. Sign the petition: https://t.co/Occd5mbKoN
Remove SuperDelegate Concept from voting process https://t.co/Q8KFUA33eQ @moveon
Petition update - Small Win - Federal program expanding to help small farmers reach local markets https://t.co/gpceHe7EVY via @Change
https://t.co/DkTtjh9dq9 via @youtube #makedonalddrumpfagain
Sign the pledge and promise you #WontVoteHillary! https://t.co/OORQsawjZ4 #DropOutHillary #NeverHillary via @spencerthayer
Ensure Fair Representation on Democratic Platform Committee https://t.co/z1SEPjaqdS @moveon
Ban inhumane veal crates in Florida https://t.co/V5KUcPm0Xc via @Change
"Petition update - Petition Delivered, News Coverage https://t.co/HMpb7E27R7 via @Change"
Stop the Sale of Pesticides Suspected of Harming Endangered Species https://t.co/DBTlERPyMU
U.S. Fish and Wildlife Service: Tell the Fish and Wildlife Service to Help Save The Last Wild Red Wol... https://t.co/YhVSj9H2zP via @Change
"Petition update - See photos of rally in Milan, Italy to #closethecanidrome and stop export of Irish ... https://t.co/34AD1JGIaZ via @Change"
Jo Ellen Darcy : Stop the Dakota Access Pipeline https://t.co/1zUM2DMW7s via @Change
Investigate the Pentagon for Intentionally Misleading the Public About Sexual Assault Cases! https://t.co/D0B0FdNYjC
Tell @NOAAFisheries &amp; @Eileen_NOAAFish - turtles and driftnets don't mix! Sign the @Care2 petition: https://t.co/0zBpsecdo1
The Next Progressive Hope? The Man Trying to Unseat the Democratic Party Chair Debbie Wasserman Schultz https://t.co/lCeFswXERo
Friends of the Earth: The Biggest Jobs on Earth https://t.co/0y7ExKrtGV
Gov. Snyder: Veto the House Detroit Education Bills https://t.co/xXAyu4RN8A @moveon
Petition update - Join Us in Protest https://t.co/OwYMV7xqKf via @Change
.@Darden and @OliveGarden needs to serve more ethical food and pay its employees better  https://t.co/qzlwmbKbG9 via @SumOfUs
Greater sage-grouse and our remaining sage brush steppe at risk in the West! Fight back: https://t.co/WqSQJ7MWRH via @WildlifeAction
"petition: A Big ""NO"" to Captive Dolphins in Arizona!, Scottsdale, AZ https://t.co/vcWcydEPJe"
Exit Poll Expert Proves Election Fraud Against #Bernie - with Richard Ch... https://t.co/HL99JidQ47
Sign the petition: Tell Congress to reject the dangerous House Child Nutrition Reauthorization bill https://t.co/xZpccjvKKb @EdWorkforce
MoveOn Petitions - Impound and audit California's voting machines https://t.co/cvC1v65MSO
Petition update - Public Radio Mentions Our Petition to End Predatory Healthcare Pricing (at 3:26) https://t.co/3eDM9ikQTM via @Change
Yellowstone grizzlies are in trouble - tell the FWS this is no time to delist grizzlies! https://t.co/vJeleEIhGy
Tell Congress: Urge @POTUS to monitor human rights of Palestinian children.  https://t.co/5vRgH78CCm
Tell your members of Congress: Stop efforts to discriminate against #LGBT Americans! @freedom4allusa #StopFADA https://t.co/OFFENitHc2
Facebook: Remove pages that are reported and proven to be fake https://t.co/TjoLs5GZVW via @Change
Sign the petition to the @EximBankUS: Don't finance Big Coal in Bangladesh. https://t.co/0r1luMUOVy
Bernie Sanders fans led by opera singer serenade Clinton supporters at park https://t.co/M9oklp0yX6 via @sdut
See photo of today's rally for Irish greyhounds in London! https://t.co/yZkHNKWGj2 via @Change
"Sign &amp; RT: Let Freeha and Ayan stay in Canada, safe from family violence: https://t.co/libxaKnnxj"
"Leaked Documents On U.S.-E.U. Trade Deal Paint Worrisome Environmental Picture, Greenpeace Says https://t.co/aJRuovr4wm via @climateprogress"
Judge OKs deposition plan in Hillary Clinton email case https://t.co/hImfCLJ6wY
"Reps. Conyers, Yoho: Sending MANPADS to Syria Is Still a Stupid Thing We Shouldn't Do https://t.co/IWsgGgh4rS via @theworldpost"
Support an Endangered Listing for African Elephants: https://t.co/w4ZU9Bci1M (via @HumaneSociety)
Support an Endangered Listing for African Elephants - The Humane Society of the United States https://t.co/ROyDm9LSfd
Protect the pangolin: https://t.co/jp5lIx9Pvp (via @HumaneSociety)
Demand Progress | Tell President Obama: Stop the secret plan to expand NSA data sharing with the FBI! https://t.co/vkBvkgQTKf
Tell Congress: Audit the Pentagon | CREDO Action https://t.co/S2bnfyfMJM
Petition for Dem Debate on TYT after Bernie's win in Indiana &amp; Water To Flint https://t.co/t0HeqMxf73 via @Change
Petition update - Today's Dublin rally for the greyhounds attracts celebrity support! https://t.co/h0EzksI4Df via @Change
A New Tipping Point for the Disappearing Arctic @hakaimagazine https://t.co/PZvi5DkTiy
U.S. Fish and Wildlife Service: Tell the Fish and Wildlife Service to Help Save The Last Wild Red Wol... https://t.co/xN2MrVbbnH via @Change
Tell @BLMNational: Protect @JoshuaTreeNPS from the Eagle Mountain hydropower plant https://t.co/JWZYgKHLnR @Interior @NatlParkService
BBC News - Rescued circus lions from Colombia and Peru flown to South Africa https://t.co/MrR86JhtaL
"Video: Not me, us. Spread it. - #FeelTheBern #UsNotMe https://t.co/cknl2EvfM9"
"Video: Not me, us. Spread it. - https://t.co/cknl2EvfM9"
Some Indiana Counties Closed Two-Thirds Of Their Polling Places Ahead Of Record Turnout Election Day https://t.co/FrNY3az5Cj  @thinkprogress
"Clinton Supporters Mock Iraq: ""Take a Drink"" https://t.co/9acQpyQGpk via @vets4bernie"
Prominent Democratic consultants sign up to defeat single payer in Colorado https://t.co/gVm41zVQAa by @lhfang
Stand w/ @SenWarren: Tell Congress to ignore @TurboTax @Intuit lobbyists &amp; simply tax filings https://t.co/4EZlU91A8k #Taxday
Costco: Stop selling toxic Roundup https://t.co/hVxqhAMpNA via @Change
The E.U.'s forest-for-fuel plan threatens our forests and climate. Tell the E.U. to adopt true clean energy sources: https://t.co/e7FreymXMf
"Urge the NSW Government to Reject the Cull of the Snowy Mountain Brumbies: Catch and Re-home them Instead, Australia https://t.co/kB7Ik6xmH4"
The E.U.'s forest-for-fuel plan threatens our forests and climate. Tell the E.U. to adopt true clean energy sources: https://t.co/klS8hHgdo6
Sign the petition: Tell @SEC_news: Stop letting Wall Street prey on cities https://t.co/Iz5wH8qZBr via @CREDOMobile #p2
State Party Officials Reportedly Displeased with Clinton-DNC 'Laundering' Scheme - https://t.co/Ew09eChbYf
California : Help Protect Wolves in California! - Sign the Petition! https://t.co/5THERSUj9C via @Change
Yellowstone Bears Need Your Help https://t.co/wWElLawE4Z
Orcas are at risk of losing essential protections they need to survive. Join @NRDC and take action now to save them: https://t.co/COLG2t9Gtr
Ringling Bros. Elephants Officially Retired -- Time to Turn the Eye Toward the CEC https://t.co/Tb9gKuhmWe via @Change
Let Elizabeth Colaianni Keep Her Fur Babies https://t.co/8jM9ArdlSh via @Change
Green Party : Unite to create a Progressive Independent Party https://t.co/BDXrPa5IeV via @Change
The Clinton Foundation Only Spent 10 Percent On Charity In 2013: https://t.co/5R5oRqwb04
Clinton Foundation refiles ‘fraudulent financials’ with IRS https://t.co/sJhZhNsUjO via @worldnetdaily
Moralbankruptcy #americanplutocracy #corporatizationofamerica https://t.co/xjEz2ZZXOD via @SlideShare
Why Do We Condemn Republicans And Yet Turn A Blind Eye To Clinton’s Campaign Corruption? https://t.co/Up1cibYvmn via @ringoffireradio
Make being a spectator at dogfights a felony - Sign the Petition! https://t.co/a85319PVcv via @Change
Barack Obama: Protect Threatened Sharks in the Northwestern Hawaiian Islands https://t.co/aZyVptvO0L via @Change
Hillary Clinton's wealthy donors revealed in Panama Papers https://t.co/DeScyLuNF5
"Bernie Sanders supporters hold rally, march in DTLA https://t.co/e9t3dLRnpB via @abc7"
Impound and audit California's voting machines https://t.co/YwhKBpocAI @moveon
Logan Officials Message to Clinton Campaign https://t.co/owFZK6XuCn
Take @BoldProgressive's survey about the 2016 presidential race:  https://t.co/HtjCTJybFQ #stillbernie #bernieorbust
The Election Assistance Commission is engaging in voter suppression | CREDO Action https://t.co/RxXUVbYQtN
Indiana:+Require+all+dogs+and+cats+sold+in+pet+stores+to+come+from+local+shelters+and+rescue+groups https://t.co/3YdjUbZszR
