"{""follow_request_sent"": false, ""has_extended_profile"": false, ""profile_use_background_image"": true, ""profile_text_color"": ""333333"", ""default_profile_image"": false, ""id"": 53070427, ""profile_background_image_url_https"": ""https://abs.twimg.com/images/themes/theme7/bg.gif"", ""verified"": false, ""imported_to_gensim"": false, ""profile_location"": null, ""profile_image_url_https"": ""https://pbs.twimg.com/profile_images/1825465491/face_a-2009_oilPaint_normal.jpg"", ""profile_sidebar_fill_color"": ""F3F3F3"", ""entities"": {""url"": {""urls"": [{""url"": ""http://t.co/TxCoZl49KY"", ""indices"": [0, 22], ""expanded_url"": ""http://www.bxbinc.com"", ""display_url"": ""bxbinc.com""}]}, ""description"": {""urls"": []}}, ""followers_count"": 20, ""profile_sidebar_border_color"": ""DFDFDF"", ""id_str"": ""53070427"", ""profile_background_color"": ""EBEBEB"", ""listed_count"": 0, ""status"": {""contributors"": null, ""truncated"": false, ""text"": ""US ambassador to Bangladesh condemns killing of leading gay rights activist, colleague - BBC News - Breaking News https://t.co/Tv6y7S6O8u"", ""is_quote_status"": false, ""in_reply_to_status_id"": null, ""id"": 724650878167318528, ""favorite_count"": 0, ""source"": ""<a href=\""http://twitter.com/#!/download/ipad\"" rel=\""nofollow\"">Twitter for iPad</a>"", ""retweeted"": false, ""coordinates"": null, ""entities"": {""symbols"": [], ""user_mentions"": [], ""hashtags"": [], ""urls"": [{""url"": ""https://t.co/Tv6y7S6O8u"", ""indices"": [114, 137], ""expanded_url"": ""https://apple.news/ASq-uaJxpMOOor2o_5zzpag"", ""display_url"": ""apple.news/ASq-uaJxpMOOor\u2026""}]}, ""in_reply_to_screen_name"": null, ""in_reply_to_user_id"": null, ""retweet_count"": 0, ""id_str"": ""724650878167318528"", ""favorited"": false, ""geo"": null, ""in_reply_to_user_id_str"": null, ""possibly_sensitive"": false, ""lang"": ""en"", ""created_at"": ""Mon Apr 25 17:26:47 +0000 2016"", ""in_reply_to_status_id_str"": null, ""place"": null}, ""is_translation_enabled"": false, ""utc_offset"": -14400, ""statuses_count"": 158, ""description"": ""Visual Information Specialist. Video & Print Design."", ""friends_count"": 66, ""location"": ""Washington DC"", ""profile_link_color"": ""990000"", ""profile_image_url"": ""http://pbs.twimg.com/profile_images/1825465491/face_a-2009_oilPaint_normal.jpg"", ""following"": false, ""geo_enabled"": true, ""profile_banner_url"": ""https://pbs.twimg.com/profile_banners/53070427/1376027258"", ""profile_background_image_url"": ""http://abs.twimg.com/images/themes/theme7/bg.gif"", ""name"": ""Henry Baker"", ""lang"": ""en"", ""profile_background_tile"": false, ""favourites_count"": 101, ""screen_name"": ""movieguy13"", ""notifications"": false, ""url"": ""http://t.co/TxCoZl49KY"", ""created_at"": ""Thu Jul 02 14:02:56 +0000 2009"", ""contributors_enabled"": false, ""time_zone"": ""Eastern Time (US & Canada)"", ""protected"": false, ""default_profile"": false, ""is_translator"": false}"
"US ambassador to Bangladesh condemns killing of leading gay rights activist, colleague - BBC News - Breaking News https://t.co/Tv6y7S6O8u"
Dionne: What Clinton and Sanders owe progressives - The Salt Lake Tribune https://t.co/YMAS3Iw44z
Trump and Sanders can’t deliver on their promises - Pittsburgh Post-Gazette https://t.co/uboqRjwgoK
Sounding more and more like Sanders is just jealous that Wall Street neither paid him nor cares about his financial views. #DemDebate
"Sanders is a one-trick-pony. ""Vote for me, I'm Robin Hood."" #DemDebate"
"The more Sanders speaks, the more  he sounds like a snake-oil salesman. #DemDebate"
"The case against Bernie Sanders, according to Barney Frank - The Washington Post #HillarySoQualified  https://t.co/B49fTSsNdj"
Sanders is a looser. Just sayin' #HillarySoQualified
Biscuit #doggarland
#DoYourJob WAY past Grassley's time to resign!
@NYC4TRUMP2016 DumpDrumpf we don't need another hater in our government
"@TRUMPforAMERlCA the Pope couldn't stand up to you, but America will. Drumpf goes down."
@TRUMPforAMERlCA Take responsibility for  Drumpf's incitement.
@gaycivilrights Drumpf disavows responsiblity for inciting hate. F-him
@Mikeggibbs @fakedansavage Protest EVERY Drumpf rally!
@realDonaldTrump You reap what you sow. Promoters of hate need to be silenced.
"@HillaryClinton Reagan was complicit in the 100,000+  AIDS  deaths - the White House ignored the issue. Shame on the Reagans &amp; Ms. Clinton."
"@HillaryClinton After years of strong support for Hilary, I'm deeply disturbed by her statement that Reagan helped the AIDS discussion."
Pandora Hates Gay People... http://t.co/umrCOoXctn
NYC Pride 2024 at Elmo #vidaworld2014 http://t.co/lgsBboUvtm
"A refresher for all you outdoorsy types:
How to Remove a Tick: An Illustrated Guide http://t.co/K2zZuNHZO3"
#F*@kYouRush #BringBackOurGirls
Obama Congratulates Michael Sam http://t.co/j3tA4n95sL
"Tell the FCC to protect the open Internet, not undermine #NetNeutrality. http://t.co/HMfFXSotio"
Tom of Finland stamp in Sept.  http://t.co/0Oe0W73OA8
Republicans Will HATE This New Yorker Cover http://t.co/brCuHceM8U
"Congratulations Bill Weber made the NYTimes!

NYTimes: Seeking Eden, They Fled to Far Isle; Hell Followed http://t.co/2248olBaRq"
Chris Christie: Male chauvinist pig http://t.co/xBxEuIzbQx
WeHo Fitness Trainer Jovin Raethz Among GHB-Related Deaths In New York This Week http://t.co/YdVbJshwV1
65F at 7p (Thursday low: 20F) http://t.co/h4PHxRWif3
#itunesfestival at SXSW March 11-15. Check out the lineup &amp; watch free shows.  http://t.co/C7ILxECEx0
"iTunes Festival by iTunes
Free!
Music starts next week 3/11 https://t.co/ALEyJpa2L5"
Chris Christie's Entire Career Apparently Reeks http://t.co/Tx99yAPXBE
5 Simple Rules For Guaranteed Happiness http://t.co/CF1erCCpFT
McDonald's #CheersToSochi Campaign Meets With LGBT Backlash http://t.co/b1kchzoNok
#ARTPOP #ArtHaus http://t.co/RlmZ9eAvpZ
NYTimes: Life Under Russia's 'Gay Propaganda' Ban http://t.co/siGDRzk5wz
Pussy Riot Member Nadezhda Tolokonnikova Calls For Olympics Boycott http://t.co/KBXDfrinUe
Federal Court Denies Motion to Dismiss Challenge to Virginia's Ban on Gay Marriage http://t.co/vmp0ac8D0n
Gay rights activists stage campaign against ‘shocking’ Coca-Cola sponsorship of Sochi Winter Olympics http://t.co/bbzQDDkoxB
Paul Krugman: The GOP’s austerity agenda is winning http://t.co/uopeiIgKqU
"A belated peek at some titillating highlights from D.C. Pride's official party, ""Spandex"" http://t.co/YbTU4MeXJB"
Wait for the animated gif to load. Gifs That Keep On Giving: The Moment Cristiano Ronaldo Realized He Is Gay http://t.co/4AU1j9rziV
"@TomDaley1994 You are amazing, genuine, and brilliant! Thank you so much for enriching our lives and making your own happiness."
"@StarParker Saying things as an uneducated woman, doesn't make you educated."
Happy Hour! http://t.co/h6ze6U39R4
Read this interview btn Dan Savage and Russian journalist. Then email Sally.  http://t.co/TY6sPGyjwj
US skater Jeremy Abbott on Russia- naive and self-serving. Beating gays is not equal to bad decorating. #Sochi2014 http://t.co/8WlLbj5p21
Preview of Sept. 30 http://t.co/g8KlJXQW2N
A Gay Dad’s Open Letter to the International Olympic Committee: Move the Damned Games Already http://t.co/r8WQ3JF78E via @zite
"Two gay men beaten in Chelsea neighborhood of NYC, Christine Quinn and community ""appalled"" by attacks http://t.co/t6lTzEzrnX via @zite"
.@SpeakerBoehner: Today @OFA is giving you a #ClimateDenierAward: http://t.co/5RAzoDcmYi Why do you deny the science on climate change?
@fakedansavage it's time to turn up the outrage focusing on  the IOC and at NBC. No NBC shows in our house!
NWhat I regret most in my life are failures of kindness. NYTimes: George Saunders’s Advice to Graduates http://t.co/Z70ibIZ2xI
NYTimes: Mr. Putin’s War on Gays http://t.co/qrZLtW3U32
@DavidHSanders missing you! Do you have Ken Green email.
NSleep and stay healthy. NYTimes: Cheating Ourselves of Sleep http://t.co/6BISG1LUde
@PiersEarlsCourt that sucks
NYTimes: The Market Speaks http://t.co/Q9ceKkhVO6
Tweet http://t.co/4aqZkbTc
NYTimes: The Blessings of Atheism http://t.co/qQL5AX54
@SlShaf am I tweeting? Merry Christmas Hanukkah !
#downrightnow #netflix
I voted http://t.co/lIuuRd76
NYTimes: Triumph of the Wrong? http://t.co/omN6KM7W
60% off upscale Las Vegas suite http://t.co/nyYv5DbR via @editions
Romney's Death Squad Ties: Bain Launched with Millions from Oligarchs Behind Salvadoran Atrocities http://t.co/qdyouVHh @democracynow
Henry Baker &amp; Barney Brown smile together. #smilesfilm http://t.co/NZhP2lXa
Henry Baker and Barney Brown smile together near the end of life. #smilesfilm http://t.co/8oz9YaKc
Alvin &amp; the Chipmunks http://t.co/Bsm19kSW
Promote your paracosm. NYTimes: The Power of the Particular http://t.co/j1fcQ77w
David &amp; Vong http://t.co/qHYbPy2V
"TV Dinner. Chicken Tarragon Salad, Roasted Corn Salad &amp; Beets on a bed of greens. With a cup of mint pea soup! http://t.co/OINowFrR"
"@skornsays sometimes it will just come up, if you're following that person. #pearl dive"
At the Monroe. http://t.co/6ScPSmrV
"“You are all stardust. You couldn’t be here if stars hadn’t exploded. So forget Jesus. Stars died so you could live."" MC lol"
"Kirk Cameron Is 'Unnatural,' & 'Ultimately Destructive'"
"Monsters GT :the initial ad said 3 weeks free trial, but it is only a 2 weeks trial. Now I have to find time sooner to test drive it."
Jim David rocks on marriage! http://t.co/t5uozaNZ
"Subscribe to: Taku Nakahara, Pureibiza House music Podcast"
@afontici Happy Birthday 9 days late!
End of year energizer: Move! http://t.co/JtXCU1oU
Finally! http://t.co/FqgQoOz
Off to yoga
"BXB, Inc. | Visual Communication http://t.co/mCTNwrD via @daddydesign"
"Check this video out -- President Obama Signs Law Repealing ""Don't Ask Don't Tell"" - 12/22/10 http://t.co/PmEwHNR via @youtube"
5 Ridiculous Things You Probably Believe About Islam  http://huff.to/ed2MQk
RT @alfranken Check out Al's #HuffingtonPost op-ed on breaking news in the #netneutrality fight | #p2 http://bit.ly/e8nK6C
I'm is proud to offer our clients Squarespace Web design and management.
I'm attending Public Service Career and Internship Fair... -- http://bit.ly/14rr1A
