"{""follow_request_sent"": false, ""has_extended_profile"": false, ""profile_use_background_image"": true, ""profile_text_color"": ""590C50"", ""default_profile_image"": false, ""id"": 42334048, ""profile_background_image_url_https"": ""https://pbs.twimg.com/profile_background_images/534049760945000449/bgSL5yTk.jpeg"", ""verified"": false, ""imported_to_gensim"": false, ""profile_location"": null, ""profile_image_url_https"": ""https://pbs.twimg.com/profile_images/378800000313184024/e5faa275a5cf58a211179fbf37920f3c_normal.jpeg"", ""profile_sidebar_fill_color"": ""68E690"", ""entities"": {""url"": {""urls"": [{""url"": ""http://t.co/QyZXotWZCY"", ""indices"": [0, 22], ""expanded_url"": ""http://www.ColeCat.blogspot.com"", ""display_url"": ""ColeCat.blogspot.com""}]}, ""description"": {""urls"": []}}, ""followers_count"": 588, ""profile_sidebar_border_color"": ""FFFFFF"", ""id_str"": ""42334048"", ""profile_background_color"": ""AA3FE8"", ""listed_count"": 14, ""status"": {""contributors"": null, ""truncated"": false, ""text"": ""Protect the Arctic Refuge! https://t.co/fYr9OxCTwX #WeAreTheArctic"", ""is_quote_status"": false, ""in_reply_to_status_id"": null, ""id"": 725433107310989314, ""favorite_count"": 0, ""source"": ""<a href=\""http://twitter.com\"" rel=\""nofollow\"">Twitter Web Client</a>"", ""retweeted"": false, ""coordinates"": null, ""entities"": {""symbols"": [], ""user_mentions"": [], ""hashtags"": [{""indices"": [51, 66], ""text"": ""WeAreTheArctic""}], ""urls"": [{""url"": ""https://t.co/fYr9OxCTwX"", ""indices"": [27, 50], ""expanded_url"": ""http://bit.ly/1lPkme4"", ""display_url"": ""bit.ly/1lPkme4""}]}, ""in_reply_to_screen_name"": null, ""in_reply_to_user_id"": null, ""retweet_count"": 0, ""id_str"": ""725433107310989314"", ""favorited"": false, ""geo"": null, ""in_reply_to_user_id_str"": null, ""possibly_sensitive"": true, ""lang"": ""en"", ""created_at"": ""Wed Apr 27 21:15:05 +0000 2016"", ""in_reply_to_status_id_str"": null, ""place"": null}, ""is_translation_enabled"": false, ""utc_offset"": -14400, ""statuses_count"": 8429, ""description"": ""Lover of history and liberty. Activist.True activism is putting your ass on the line for your beliefs, and being ready to have it handed to you. -me"", ""friends_count"": 1481, ""location"": ""New York, NY"", ""profile_link_color"": ""68F0E5"", ""profile_image_url"": ""http://pbs.twimg.com/profile_images/378800000313184024/e5faa275a5cf58a211179fbf37920f3c_normal.jpeg"", ""following"": false, ""geo_enabled"": true, ""profile_banner_url"": ""https://pbs.twimg.com/profile_banners/42334048/1362357275"", ""profile_background_image_url"": ""http://pbs.twimg.com/profile_background_images/534049760945000449/bgSL5yTk.jpeg"", ""name"": ""Cole Bell"", ""lang"": ""en"", ""profile_background_tile"": true, ""favourites_count"": 180, ""screen_name"": ""reinventingcole"", ""notifications"": false, ""url"": ""http://t.co/QyZXotWZCY"", ""created_at"": ""Mon May 25 02:40:27 +0000 2009"", ""contributors_enabled"": false, ""time_zone"": ""Eastern Time (US & Canada)"", ""protected"": false, ""default_profile"": false, ""is_translator"": false}"
Protect the Arctic Refuge! https://t.co/fYr9OxCTwX #WeAreTheArctic
@HillaryClinton after all these years you still give me goosebumps in a very good way #TeamHillary
@Rigo_Corona @Jdiamondisme tied up in a nasty and groundbreaking lawsuit...look it up
@CutlerX @Cjb946 cool...gotta cross the pond sometime!
@Cjb946 @CutlerX where is THAT bus?
Only in NYC!  #GOTTAHAVESTYLE  https://t.co/yc4ODKEcxV
@gpa70 @SenGillibrand @HillaryClinton as it happens-Bush the 2nd was most recently...
@SenGillibrand @HillaryClinton always with #Hillary
"@HillaryClinton so proud to still be a #HillaryClinton supporter!  Thanks for showing your ""mom side"" to us! #LuvHillary"
I just signed up to volunteer with @HillaryClinton in NY—you should too: https://t.co/fxCPyVYcLN
Have you heard ‘Crave’ by Susie Green on #SoundCloud? #np https://t.co/anRfjoodG8
Have you heard ‘Leave The Light On’ by Susie Green on #SoundCloud? #np https://t.co/FaZvtgRe8g
Just posted a photo @ Brooklyn Ditmas Park https://t.co/Iq4FeyIzEN
A little Halloween decor for the door.    Came down tonight to make way for my Harvest/Thanksgiving… https://t.co/1xJLr9cguO
1705 Dorchester rd
@Andreaevansprod @DWTS_ANT1 @abc BRING ANDREA TO DWTS!!!!!!
@JakeSm75166740 @Andreaevansprod @ABCNetwork @onelifetolive OLTL is something I miss every day-especially when times are tough!
"Hey, have you joined #Hillary2016 yet? I HAVE!  http://t.co/M3IuorySbu https://t.co/i6bwLRg7WE"
"Checking out my vintage style! @ Flatbush - Ditmas Park, Brooklyn, New York https://t.co/bPrUqqQ1AH"
So welcome!
I just supported CF VS. Everest on @ThunderclapIt // @sandyhussain http://t.co/Njvpjr5UW6
@Madonna  nothing better than seeing our Queen on top. #RebelHeart #rEVOLUTIONofLOVE
This is my current vantage point-#StarTrek #CaptainKirk https://t.co/rkCuFCu05D
Apple Watch Present Retailers With More Opportunities For Real-Time Engagement - Retail TouchPoints http://t.co/mGwM9v9stf via @rtouchpoints
I loved using @popmoney the last time I needed to send some cash. It was so easy. Try it yourself. http://t.co/IntTVkAViV #popmoney2015 #Ad
@TFnow Can't wait for WEDNESDAY!
I'm so excited @tfnow
@tfnow I sent you a message on google
True Fashionista Nowtrue fashionista now | . . . . . . . Are you a true fashionista now? http://t.co/yFMVYVV3VB via @tfnow
Gotcha
@PapiYankee4 boo
You're most welcome!
@Bosssharie_ welcome to the team
"Countdown to the #AGACI grand opening in Bay Shore, NY commences!   November 21 is right around the corner, guys!   http://t.co/WggmvNvro5"
"@sunyclass28 greetings, obi-wan.  I am working in Bay Shore now-let's do lunch"
@TFnow have a grand opening for a fashion forward brand new to NY-DM me so i can get you the invite
"I'm at Buffalo Wild Wings - @bwwings in Bay Shore, NY http://t.co/2Ji2FGn5bt"
"I'm at @Westfield South Shore in Bay Shore, NY http://t.co/d135EvulgB"
Bye-bye California!   I'll miss you! (@ San Diego International Airport (SAN)) http://t.co/Ft5zxHcCa1 http://t.co/ggbYynjuKB
"I'm at San Ysidro in San Diego, CA http://t.co/MmLLwzucyf"
"I'm at Centro Tijuana in Tijuana, Baja California http://t.co/0EWwrAXCiV"
"I'm at San Ysidro in San Diego, CA http://t.co/DEcZ2wX3Pr"
"I'm at Holiday Inn Express - @hiexpress in National City, CA http://t.co/t3snZZgxjI"
"I'm at National City, CA in National City, CA http://t.co/EjNnE0IMXs"
"I'm at Holiday Inn Express - @hiexpress in National City, CA http://t.co/LrMj8giACy"
I'm at Hollywood Sign View http://t.co/0gnwO22vrj
"Wow (@ San Andreas Fault - Grapevine in Lebec, CA) http://t.co/vRfbJnsvZY"
"I'm at Tejon Pass in Lebec, CA http://t.co/QXMljaCQjA"
"I'm at Carl's Jr in Gorman, CA http://t.co/ghDcbbC5St"
"I'm at Gorman, CA in Gorman, CA http://t.co/oYE4iqDE1z"
"I'm at Rest Area: Tejon Pass in Lebec, CA http://t.co/6SSCbH1wcL"
"I'm at Holiday Inn Express - @hiexpress in National City, CA http://t.co/Y9riV6uonT"
"This world of wonder... (@ Holiday Inn Express - @hiexpress in National City, CA) http://t.co/fXQ6Vp71pR"
"Paradise found (@ Coronado Island in Coronado, CA) http://t.co/z9jx50MEwn"
"Wow.  Just wow. (@ Black's Beach in La Jolla, CA) http://t.co/nWvARU06RP http://t.co/zR5J0PajvO"
"Wow.  Just wow. (@ Black's Beach in La Jolla, CA) http://t.co/nWvARU06RP http://t.co/9FeJfdB98u"
"I'm at Petco Park - @mlb in San Diego, CA http://t.co/eD9Oi6sU0i"
"Love Anthony's! (@ San Diego Harbor in San Diego, CA) http://t.co/IWPoUccuvb http://t.co/kz4z55YnPE"
"I'm at Holiday Inn Express - @hiexpress in National City, CA http://t.co/pKRwVXTmjc"
"I'm at @Enterprise Rent-A-Car in San Diego, CA http://t.co/rlmh2EHDDb"
Foursquare check-in at 'San Diego International Airport (SAN)': Check-in at San Diego International Airport (SAN) on Foursquare:
"Wow...16 years have passed so quickly... (@ San Diego International Airport (SAN) in San Diego, CA) http://t.co/nOPjR9ERVg"
#Re2pect the legacy! http://t.co/auxMJEW5Vd
"I'm at Washington Dulles International Airport (IAD) - @dulles_airport in Dulles, VA http://t.co/t0ggNRM9gP"
"I'm at Moe’s Grill &amp; Bar - @hmshost in Sterling, VA http://t.co/a8ERXbAQ8H"
"I'm at Washington Dulles International Airport (IAD) - @dulles_airport in Dulles, VA http://t.co/55Nnr5yayg"
"I'm at LaGuardia Airport (LGA) in East Elmhurst, NY http://t.co/cX1pDxSFG9"
"I'm at Deliziosa Pizza in Spring Valley, NY http://t.co/D3Enkz6K4t"
"I'm at Shades Repertory Theater in Haverstraw, NY http://t.co/64Tqocppc8"
"I'm at Costco Wholesale in Nanuet, NY http://t.co/aEvubiCWXb"
"I'm at Candlewood Suites Nanuet - Rockland County in Nanuet, NY http://t.co/kskjC6TVww"
"I'm at @BedBathBeyond in Spring Valley, NY http://t.co/Imu6pufuHi"
"I'm at Costco Wholesale in Nanuet, NY http://t.co/Vz3fep4VV9"
"I'm at Candlewood Suites Nanuet - Rockland County in Nanuet, NY http://t.co/yJOkceLADi"
#wordstoliveby http://t.co/Fu3Pr5bcni
"Wow,  brings it home that the job is far from done. http://t.co/0LkNFtCws9"
"Nite nite (@ Candlewood Suites Nanuet - Rockland County in Nanuet, NY) http://t.co/LHSMOArEEZ"
"I'm at Spring Valley Marketplace in Spring Valley, NY http://t.co/zy79dEeYph"
"I'm at Candlewood Suites Nanuet - Rockland County in Nanuet, NY http://t.co/sT6Vao9JO2"
"I'm at Casa Osorio in Yonkers, NY http://t.co/XL6h9USva5 http://t.co/lzeAekkSPL"
"I'm at Yonkers, NY - @cityofyonkers in Yonkers, NY http://t.co/BP8uO6ud4E"
"I'm at Casa Osorio in Yonkers, NY http://t.co/7H2zhHDMsR"
"I'm at South County Trailway @ Van Cortlandt Park in Yonkers, NY http://t.co/6u8JZPx2L0"
Happy coming out of your mom day @CantcatchCaT
"I'm at The Overlook in Forest Hills, NY http://t.co/VAoMlffwcP"
"I'm at Terminal D (Delta Terminal) in East Elmhurst, NY http://t.co/YBi6JbhnPs"
"I'm at LaGuardia Airport (LGA) in East Elmhurst, NY http://t.co/BlaO4N2E2Z"
"I'm at Detroit Metropolitan Wayne County Airport (DTW) - @dtweetin in Romulus, MI http://t.co/fiYZ7WFLS3"
"I'm at San Antonio International Airport (SAT) - @saairport in San Antonio, TX http://t.co/5RoSmYAfbe"
"I'm at North Star Mall in San Antonio, TX http://t.co/RLJg3BsdpY"
"I'm at Enterprise in San Antonio, TX http://t.co/5lqzVZQxOO"
"I'm at San Antonio International Airport (SAT) - @saairport in San Antonio, TX http://t.co/j3HnoIFVsJ"
"I'm at The Alamo - @officialalamo in San Antonio, TX http://t.co/hdW2VDOCsF http://t.co/r8PoEszdgs"
"I'm at Comfort Suites in San Antonio, TX http://t.co/qhkSRqexE8"
"I'm at Santikos Palladium IMAX in San Antonio, TX http://t.co/HhYIDgph45"
"I'm at @Nordstrom Rack The Rim in San Antonio, TX http://t.co/DYT58Zkzg9"
"I'm at Six Flags Fiesta Texas - @sf_fiestatexas in San Antonio, TX http://t.co/D7P0O0IDX9"
"I'm at @Stone_Werks Big Rock Grille at the Rim in San Antonio, TX http://t.co/s6o5j1DgBN"
"I'm at Comfort Suites in San Antonio, TX http://t.co/wnaUGFrxso"
"I'm at A'GACI LLC HQ in San Antonio, TX http://t.co/JW55T0oAbg"
"I'm at Rosario's in San Antonio, TX http://t.co/4uOJ2GfCMC"
"Training day (@ A'GACI LLC HQ in San Antonio, TX) http://t.co/wlqMf1K0Tv"
"I'm at Comfort Suites in San Antonio, TX http://t.co/v5eojcVKDD"
"I'm at Comfort Suites in San Antonio, TX http://t.co/wYHokdMlAi"
"I'm at San Antonio International Airport (SAT) - @saairport in San Antonio, TX http://t.co/YLcIYBj1Ww"
"I'm at Lambert-St. Louis International Airport (STL) - @flystl in Saint Louis, MO http://t.co/zgR3XOUmL7"
"Southwest to st Louis, then san Antonio... (@ Welcome Center LGA in New York, NY) http://t.co/EKthuMTOuv http://t.co/DpQC2MJ9NB"
"Southwest to st Louis, then san Antonio... (@ Welcome Center LGA in New York, NY) http://t.co/EKthuMTOuv"
"Off to Texas! (@ LaGuardia Airport (LGA) in East Elmhurst, NY) http://t.co/I0xdDUSBbw"
"I'm at Flatbush in Brooklyn, NY http://t.co/orlSxmNMNu"
"I'm at Newkirk Plaza in Brooklyn, NY http://t.co/D7QGJN7S8a"
"I'm at Cole's Apartment in Brooklyn, NY http://t.co/uEbOem3M1v"
"I'm at Flatbush Tompkins Congregational Church in Brooklyn, NY http://t.co/UGdDJwP7rw"
"I'm at Ditmas Park in Brooklyn, NY http://t.co/ctSlbkgC0b"
"I'm at Ditmas Park in Brooklyn, NY http://t.co/PiKn6HeP1r"
"""Something's Coming....Gonna be Great!"""
#MarriageEqualityNow http://t.co/5qd2kT9moa
"I'm at Ditmas Park in Brooklyn, NY http://t.co/dNkIbkWVmF"
"Green Tea ginger ale from Canada dry!   My favorite thing! (@ Met Foods in Brooklyn, NY) http://t.co/vo9tLysmDX"
"I'm at Inwood Hill Park - @nycparks in New York, NY http://t.co/6cA3jxh1CN"
"I'm at Van Cortlandt Park - @nycparks in New York, NY http://t.co/UO0PPDj0m9"
"I love NYC so much sometimes... ""Lion King"" Cast Surprises Subway Riders | NBC New York http://t.co/zcUUTChQLf via @nbcnewyork"
"I'm at Flatbush Tompkins Congregational Church in Brooklyn, NY http://t.co/zVyYUzu2Hi"
"I'm at Ditmas Park in Brooklyn, NY http://t.co/qsQbj4bBZC"
Love it when I spend time with tree huggers! (@ MTA Subway - Cortelyou Rd (B/Q)) http://t.co/BNpJKtcmR0 http://t.co/PZMV68dHP7
"Power walking with Betty (@ Prospect Park Waterfalls in Brooklyn, NY) http://t.co/XvX6zufyJZ http://t.co/d6uCjsbUCu"
@NBCNewYork gotta love the A train
