"{""follow_request_sent"": false, ""has_extended_profile"": true, ""profile_use_background_image"": true, ""profile_text_color"": ""333333"", ""default_profile_image"": false, ""id"": 559605797, ""profile_background_image_url_https"": ""https://abs.twimg.com/images/themes/theme1/bg.png"", ""verified"": false, ""imported_to_gensim"": false, ""profile_location"": {""full_name"": ""New York, NY"", ""url"": ""https://api.twitter.com/1.1/geo/id/27485069891a7938.json"", ""country"": """", ""place_type"": ""unknown"", ""bounding_box"": null, ""contained_within"": [], ""country_code"": """", ""attributes"": {}, ""id"": ""27485069891a7938"", ""name"": ""New York, NY""}, ""profile_image_url_https"": ""https://pbs.twimg.com/profile_images/720427214324527104/UTdi1fEB_normal.jpg"", ""profile_sidebar_fill_color"": ""DDEEF6"", ""entities"": {""description"": {""urls"": []}}, ""followers_count"": 2709, ""profile_sidebar_border_color"": ""C0DEED"", ""id_str"": ""559605797"", ""profile_background_color"": ""C0DEED"", ""listed_count"": 69, ""status"": {""contributors"": null, ""truncated"": false, ""text"": ""RT @HillaryClinton: When we stand together against the other side's hateful words, we all rise.\nhttps://t.co/UagcfYANnR"", ""is_quote_status"": false, ""in_reply_to_status_id"": null, ""id"": 727237806783913991, ""favorite_count"": 0, ""source"": ""<a href=\""https://mobile.twitter.com\"" rel=\""nofollow\"">Mobile Web (M2)</a>"", ""retweeted"": false, ""coordinates"": null, ""entities"": {""symbols"": [], ""user_mentions"": [{""id"": 1339835893, ""indices"": [3, 18], ""id_str"": ""1339835893"", ""screen_name"": ""HillaryClinton"", ""name"": ""Hillary Clinton""}], ""hashtags"": [], ""urls"": [{""url"": ""https://t.co/UagcfYANnR"", ""indices"": [96, 119], ""expanded_url"": ""https://amp.twimg.com/v/c3e5fe7f-45d3-42d9-81b3-8721e9b379d5"", ""display_url"": ""amp.twimg.com/v/c3e5fe7f-45d\u2026""}]}, ""in_reply_to_screen_name"": null, ""in_reply_to_user_id"": null, ""retweet_count"": 711, ""id_str"": ""727237806783913991"", ""favorited"": false, ""retweeted_status"": {""contributors"": null, ""truncated"": false, ""text"": ""When we stand together against the other side's hateful words, we all rise.\nhttps://t.co/UagcfYANnR"", ""is_quote_status"": false, ""in_reply_to_status_id"": null, ""id"": 727226308330029061, ""favorite_count"": 1675, ""source"": ""<a href=\""http://twitter.com\"" rel=\""nofollow\"">Twitter Web Client</a>"", ""retweeted"": false, ""coordinates"": null, ""entities"": {""symbols"": [], ""user_mentions"": [], ""hashtags"": [], ""urls"": [{""url"": ""https://t.co/UagcfYANnR"", ""indices"": [76, 99], ""expanded_url"": ""https://amp.twimg.com/v/c3e5fe7f-45d3-42d9-81b3-8721e9b379d5"", ""display_url"": ""amp.twimg.com/v/c3e5fe7f-45d\u2026""}]}, ""in_reply_to_screen_name"": null, ""in_reply_to_user_id"": null, ""retweet_count"": 711, ""id_str"": ""727226308330029061"", ""favorited"": false, ""geo"": null, ""in_reply_to_user_id_str"": null, ""possibly_sensitive"": false, ""lang"": ""en"", ""created_at"": ""Mon May 02 20:00:37 +0000 2016"", ""in_reply_to_status_id_str"": null, ""place"": null}, ""geo"": null, ""in_reply_to_user_id_str"": null, ""possibly_sensitive"": false, ""lang"": ""en"", ""created_at"": ""Mon May 02 20:46:19 +0000 2016"", ""in_reply_to_status_id_str"": null, ""place"": null}, ""is_translation_enabled"": false, ""utc_offset"": -25200, ""statuses_count"": 15982, ""description"": ""Photographer, Music Expert, Music Promoter, Writer, Social Media Activist"", ""friends_count"": 4967, ""location"": ""New York, NY"", ""profile_link_color"": ""0084B4"", ""profile_image_url"": ""http://pbs.twimg.com/profile_images/720427214324527104/UTdi1fEB_normal.jpg"", ""following"": false, ""geo_enabled"": false, ""profile_banner_url"": ""https://pbs.twimg.com/profile_banners/559605797/1459124904"", ""profile_background_image_url"": ""http://abs.twimg.com/images/themes/theme1/bg.png"", ""name"": ""Rob Pinto"", ""lang"": ""en"", ""profile_background_tile"": false, ""favourites_count"": 6750, ""screen_name"": ""Robthepromoter"", ""notifications"": false, ""url"": null, ""created_at"": ""Sat Apr 21 14:47:51 +0000 2012"", ""contributors_enabled"": false, ""time_zone"": ""Pacific Time (US & Canada)"", ""protected"": false, ""default_profile"": true, ""is_translator"": false}"
At times you have to make decisions for yourself in life.  I would say I feel happiest when I am making my own decisions for my life.
@DaneCook Wow Dane I wish I could have as many friends as you.  You seem to be so lucky.
"@DaneCook Hey Dane, can anyone come to your hollywood parties?  What's your rule on guests bringing guests?"
@DaneCook Dane are you a Democrat or a Republican?
I hope you all had a fantastic day today.  Lets move forward with strength and tenacity.
EXCLUSIVE: Number of homeless families at record levels in NYC https://t.co/RbYF72r0Lt
Good Morning Everyone!  I hope you have a fantastic friday!
Footage Captures Giant Green Fireball As It Streaked Across Southern California Skies « CBS Los Angeles https://t.co/GOqXRsN1vA
"@DaneCook Hey Dane do you get royalties from nesquick, kool aid, and burger king?"
@kimberlymontse1I don't know about you but I would rather have Hillary being President than Donald.  And Bernie Sanders has no chance to win
Best Place to Crack Your Back https://t.co/MEtIXXsc8p via @YouTube
"Hello Everyone.  Check out, read about, sign, and share these petitions.  Sharing petitions with friends makes these petitions successful."
Prince : 1999 https://t.co/b4Xy6GojyY via @YouTube
Tell Republicans: STOP Cutting Environmental Programs to Subsidize Big Oil - Sign the Petition! https://t.co/BsaOkD9jOy via @Change
Ban the chemical that’s killing our bees - Sign the Petition! https://t.co/2zwiLNWMWb via @Change
Dirty money in elections deserves more than a slap on the wrist - Sign the Petition! https://t.co/cFhISHMjGl via @Change
Ratify the Equal Rights Amendment #EqualMeansEqual - Sign the Petition! https://t.co/ckxeSav0Fg via @Change
It's time for a constitutional amendment to overturn Citizens United - Sign the Pledge! https://t.co/fD160Zyik8 via @Change
Pass Keep Our Pension Promises Act (KOPPA) - Sign the Petition! https://t.co/rlnsR2tJbS via @Change
Tell the FDA to Ban Harmful Synthetic Food Dyes - Sign the Petition! https://t.co/xORLqGdGqJ via @Change
Latinos: Tell Microsoft not to sponsor Trump’s bigotry - Sign the Petition! https://t.co/LXrwtdGg05 via @Change
Stand Against Donald Trump - Sign the Pledge! https://t.co/nnok46U5CO via @Change
Support Auto Voter Registration in Every State - Sign the Pledge! https://t.co/jwWuytNIrq via @Change
Ivan's Prayer for Justice - Sign the Petition! https://t.co/pwcns476KF via @Change
Tell KFC to stop serving chicken raised with antibiotics! - Sign the Petition! https://t.co/HkA5nPBtFk via @Change
Take a Stand Against Human Trafficking in the US - Sign the Petition! https://t.co/IuDIWdqagw via @Change
R.I.P Prince - Purple Rain https://t.co/eFPQ6avy6G via @YouTube
Herb Alpert - Rise (HQ Audio) https://t.co/ZqlpHB2ISE via @YouTube
How to Become a Millionaire in 3 Years | Daniel Ally | TEDxBergenCommuni... https://t.co/3axwUPdGzU via @YouTube
The case for optimism on climate change | Al Gore https://t.co/psJq3qczOl via @YouTube #EarthDay #ClimateChange #ClimateAction #Hope #AlGore
"Donald Trump Straight-Up Tells Republican Voter Yes, I Will Deport Your ... https://t.co/mKAZPklKui via @YouTube"
Stand Against Donald Trump - Sign the Pledge! https://t.co/nnok46U5CO via @Change
Latinos: Tell Microsoft not to sponsor Trump’s bigotry - Sign the Petition! https://t.co/LXrwtdGg05 via @Change
Republicans: NO to Donald Trump's candidacy to the Presidency of the United States! #NoTrump - Sign t... https://t.co/mnaVC9bNsm via @Change
NFL: Stop Taking Money From Our Troops - Sign the Petition! https://t.co/dfltP7yD4q via @Change
Tell Republicans: STOP Cutting Environmental Programs to Subsidize Big Oil - Sign the Petition! https://t.co/BsaOkD9jOy via @Change
Congress: Change the law putting a financial strain on many disabled veterans - Sign the Petition! https://t.co/AbmeN5OsJq via @Change
"Wireless Carriers: #AbolishOverages @ATT, @VerizonWireless and @Sprint! - Sign the Petition! https://t.co/NboISvFIgg via @Change"
Defend Elizabeth Warren’s Accomplishments - Sign the Pledge! https://t.co/bUAebVDi7I via @Change
United Nations : Stop the atrocities in Burundi before it's too late. - Sign the Petition! https://t.co/HqnjPNQAxj via @Change
