"{""follow_request_sent"": false, ""has_extended_profile"": false, ""profile_use_background_image"": true, ""profile_text_color"": ""333333"", ""default_profile_image"": false, ""id"": 3013801133, ""profile_background_image_url_https"": ""https://abs.twimg.com/images/themes/theme1/bg.png"", ""verified"": false, ""imported_to_gensim"": false, ""profile_location"": null, ""profile_image_url_https"": ""https://pbs.twimg.com/profile_images/562459428184944640/YOvwk5Nq_normal.jpeg"", ""profile_sidebar_fill_color"": ""DDEEF6"", ""entities"": {""description"": {""urls"": []}}, ""followers_count"": 13, ""profile_sidebar_border_color"": ""C0DEED"", ""id_str"": ""3013801133"", ""profile_background_color"": ""C0DEED"", ""listed_count"": 0, ""status"": {""contributors"": null, ""truncated"": false, ""text"": ""Just posted a photo @ Carnival Cruise Splendor https://t.co/RvpKH380AY"", ""is_quote_status"": false, ""in_reply_to_status_id"": null, ""id"": 718432940661714945, ""favorite_count"": 0, ""source"": ""<a href=\""http://instagram.com\"" rel=\""nofollow\"">Instagram</a>"", ""retweeted"": false, ""coordinates"": {""type"": ""Point"", ""coordinates"": [-73.99863643, 40.76793605]}, ""entities"": {""symbols"": [], ""user_mentions"": [], ""hashtags"": [], ""urls"": [{""url"": ""https://t.co/RvpKH380AY"", ""indices"": [47, 70], ""expanded_url"": ""https://www.instagram.com/p/BD8PVneQstb/"", ""display_url"": ""instagram.com/p/BD8PVneQstb/""}]}, ""in_reply_to_screen_name"": null, ""in_reply_to_user_id"": null, ""retweet_count"": 0, ""id_str"": ""718432940661714945"", ""favorited"": false, ""geo"": {""type"": ""Point"", ""coordinates"": [40.76793605, -73.99863643]}, ""in_reply_to_user_id_str"": null, ""possibly_sensitive"": false, ""lang"": ""en"", ""created_at"": ""Fri Apr 08 13:38:55 +0000 2016"", ""in_reply_to_status_id_str"": null, ""place"": {""full_name"": ""Clinton, Manhattan"", ""url"": ""https://api.twitter.com/1.1/geo/id/4734ece701deea3b.json"", ""country"": ""United States"", ""place_type"": ""neighborhood"", ""bounding_box"": {""type"": ""Polygon"", ""coordinates"": [[[-74.012505, 40.746572], [-73.982405, 40.746572], [-73.982405, 40.775735], [-74.012505, 40.775735]]]}, ""contained_within"": [], ""country_code"": ""US"", ""attributes"": {}, ""id"": ""4734ece701deea3b"", ""name"": ""Clinton""}}, ""is_translation_enabled"": false, ""utc_offset"": null, ""statuses_count"": 17, ""description"": ""Real Estate Investor, Teacher, Retail, Wife, Mom, Sister... optimistic, passionate and an ambitious high achiever..."", ""friends_count"": 31, ""location"": ""Toronto"", ""profile_link_color"": ""0084B4"", ""profile_image_url"": ""http://pbs.twimg.com/profile_images/562459428184944640/YOvwk5Nq_normal.jpeg"", ""following"": false, ""geo_enabled"": true, ""profile_banner_url"": ""https://pbs.twimg.com/profile_banners/3013801133/1422935752"", ""profile_background_image_url"": ""http://abs.twimg.com/images/themes/theme1/bg.png"", ""name"": ""Urscilla Tyagi"", ""lang"": ""en"", ""profile_background_tile"": false, ""favourites_count"": 14, ""screen_name"": ""urscillat"", ""notifications"": false, ""url"": null, ""created_at"": ""Tue Feb 03 03:39:09 +0000 2015"", ""contributors_enabled"": false, ""time_zone"": null, ""protected"": false, ""default_profile"": true, ""is_translator"": false}"
Just posted a photo @ Carnival Cruise Splendor https://t.co/RvpKH380AY
Just posted a photo @ Carnival Cruise Splendor https://t.co/8w40TIJWs8
Just posted a photo https://t.co/aSJ0U9w2W8
Osmington proposes new mall for northwest Brampton https://t.co/9ZozLwncl7 via @Bramptonist
I'm Netflix fan but wondering when we will have exciting movies as we have in US @ Netflix_CA
"Love watching all your shows ,interviews and speeches...simply adore you @Oprah"
@WalmartCanada Nice to see at Mississauga store all carts in proper place.. Good to start ..loonie to get a cart. 👍🏾
So well said 👍🏾 https://t.co/1LNmvM4OsC
@AJKoski16 @HillaryClinton can't wait for her to be President :)
@urscillat
Its so cold out here ..
