"{""follow_request_sent"": false, ""has_extended_profile"": false, ""profile_use_background_image"": true, ""profile_text_color"": ""333333"", ""default_profile_image"": true, ""id"": 57828105, ""profile_background_image_url_https"": ""https://abs.twimg.com/images/themes/theme1/bg.png"", ""verified"": false, ""imported_to_gensim"": false, ""profile_location"": null, ""profile_image_url_https"": ""https://abs.twimg.com/sticky/default_profile_images/default_profile_6_normal.png"", ""profile_sidebar_fill_color"": ""DDEEF6"", ""entities"": {""description"": {""urls"": []}}, ""followers_count"": 1, ""profile_sidebar_border_color"": ""C0DEED"", ""id_str"": ""57828105"", ""profile_background_color"": ""C0DEED"", ""listed_count"": 0, ""status"": {""contributors"": null, ""truncated"": false, ""text"": ""RT @tedcruz: \""It was refreshing to have a level headed candidate, who actually respects the Constitution, come &amp; address voters\""  https://t\u2026"", ""is_quote_status"": false, ""in_reply_to_status_id"": null, ""id"": 719256407904808960, ""favorite_count"": 0, ""source"": ""<a href=\""http://twitter.com/download/android\"" rel=\""nofollow\"">Twitter for Android</a>"", ""retweeted"": false, ""coordinates"": null, ""entities"": {""symbols"": [], ""user_mentions"": [{""id"": 23022687, ""indices"": [3, 11], ""id_str"": ""23022687"", ""screen_name"": ""tedcruz"", ""name"": ""Ted Cruz""}], ""hashtags"": [], ""urls"": [{""url"": ""https://t.co/q3Fd5CmqWq"", ""indices"": [143, 144], ""expanded_url"": ""http://blog.timesunion.com/joy/ted-cruz-a-breath-of-fresh-air-in-upstate-2/2107/2103/"", ""display_url"": ""blog.timesunion.com/joy/ted-cruz-a\u2026""}]}, ""in_reply_to_screen_name"": null, ""in_reply_to_user_id"": null, ""retweet_count"": 691, ""id_str"": ""719256407904808960"", ""favorited"": false, ""retweeted_status"": {""contributors"": null, ""truncated"": false, ""text"": ""\""It was refreshing to have a level headed candidate, who actually respects the Constitution, come &amp; address voters\""  https://t.co/q3Fd5CmqWq"", ""is_quote_status"": false, ""in_reply_to_status_id"": null, ""id"": 718954032782385153, ""favorite_count"": 1588, ""source"": ""<a href=\""https://about.twitter.com/products/tweetdeck\"" rel=\""nofollow\"">TweetDeck</a>"", ""retweeted"": false, ""coordinates"": null, ""entities"": {""symbols"": [], ""user_mentions"": [], ""hashtags"": [], ""urls"": [{""url"": ""https://t.co/q3Fd5CmqWq"", ""indices"": [121, 144], ""expanded_url"": ""http://blog.timesunion.com/joy/ted-cruz-a-breath-of-fresh-air-in-upstate-2/2107/2103/"", ""display_url"": ""blog.timesunion.com/joy/ted-cruz-a\u2026""}]}, ""in_reply_to_screen_name"": null, ""in_reply_to_user_id"": null, ""retweet_count"": 691, ""id_str"": ""718954032782385153"", ""favorited"": false, ""geo"": null, ""in_reply_to_user_id_str"": null, ""possibly_sensitive"": false, ""lang"": ""en"", ""created_at"": ""Sun Apr 10 00:09:33 +0000 2016"", ""in_reply_to_status_id_str"": null, ""place"": null}, ""geo"": null, ""in_reply_to_user_id_str"": null, ""possibly_sensitive"": false, ""lang"": ""en"", ""created_at"": ""Sun Apr 10 20:11:05 +0000 2016"", ""in_reply_to_status_id_str"": null, ""place"": null}, ""is_translation_enabled"": false, ""utc_offset"": null, ""statuses_count"": 9, ""description"": """", ""friends_count"": 3, ""location"": """", ""profile_link_color"": ""0084B4"", ""profile_image_url"": ""http://abs.twimg.com/sticky/default_profile_images/default_profile_6_normal.png"", ""following"": false, ""geo_enabled"": false, ""profile_background_image_url"": ""http://abs.twimg.com/images/themes/theme1/bg.png"", ""name"": ""Ken Benson"", ""lang"": ""en"", ""profile_background_tile"": false, ""favourites_count"": 69, ""screen_name"": ""DaytonaKen333"", ""notifications"": false, ""url"": null, ""created_at"": ""Sat Jul 18 02:23:05 +0000 2009"", ""contributors_enabled"": false, ""time_zone"": null, ""protected"": false, ""default_profile"": true, ""is_translator"": false}"
@tedcruz @YouTube
@CindyYbarreche Love you too. Would love to see you all.
lol. you on fb?@CindyYbarreche
"@shannonbream There are no friends in Syria, leave it alone. The Benghazi victims deserve the energy for it's justice."
Wondering how this works.
