"{""follow_request_sent"": false, ""has_extended_profile"": false, ""profile_use_background_image"": true, ""profile_text_color"": ""333333"", ""default_profile_image"": false, ""id"": 179712835, ""profile_background_image_url_https"": ""https://abs.twimg.com/images/themes/theme1/bg.png"", ""verified"": false, ""imported_to_gensim"": false, ""profile_location"": {""full_name"": ""California, USA"", ""url"": ""https://api.twitter.com/1.1/geo/id/fbd6d2f5a4e4a15e.json"", ""country"": """", ""place_type"": ""unknown"", ""bounding_box"": null, ""contained_within"": [], ""country_code"": """", ""attributes"": {}, ""id"": ""fbd6d2f5a4e4a15e"", ""name"": ""California, USA""}, ""profile_image_url_https"": ""https://pbs.twimg.com/profile_images/668954555153936385/hBR04cdd_normal.png"", ""profile_sidebar_fill_color"": ""DDEEF6"", ""entities"": {""description"": {""urls"": []}}, ""followers_count"": 1244, ""profile_sidebar_border_color"": ""C0DEED"", ""id_str"": ""179712835"", ""profile_background_color"": ""C0DEED"", ""listed_count"": 39, ""status"": {""contributors"": null, ""truncated"": false, ""text"": ""RT @UCitizens: YOU WANT A MEXICAN FLAG FLYING OVER WHITE HOUSE? Vote for anyone but TRUMP. IF NOT VOTE FOR TRUMP\ud83c\uddfa\ud83c\uddf8\ud83c\uddfa\ud83c\uddf8\ud83c\uddfa\ud83c\uddf8\ud83c\uddfa\ud83c\uddf8\ud83c\uddfa\ud83c\uddf8\ud83c\uddfa\ud83c\uddf8\ud83c\uddfa\ud83c\uddf8\ud83c\uddfa\ud83c\uddf8\ud83c\uddfa\ud83c\uddf8\ud83c\uddfa\ud83c\uddf8\ud83c\uddfa\ud83c\uddf8\ud83c\uddfa\ud83c\uddf8\ud83c\uddfa\ud83c\uddf8\u2026"", ""is_quote_status"": false, ""in_reply_to_status_id"": null, ""id"": 727269057389428736, ""favorite_count"": 0, ""source"": ""<a href=\""http://twitter.com/download/android\"" rel=\""nofollow\"">Twitter for Android</a>"", ""retweeted"": false, ""coordinates"": null, ""entities"": {""symbols"": [], ""user_mentions"": [{""id"": 2883453823, ""indices"": [3, 13], ""id_str"": ""2883453823"", ""screen_name"": ""UCitizens"", ""name"": ""U.S. CITIZENS\u231b\ufe0f\u23f3""}], ""hashtags"": [], ""urls"": []}, ""in_reply_to_screen_name"": null, ""in_reply_to_user_id"": null, ""retweet_count"": 4, ""id_str"": ""727269057389428736"", ""favorited"": false, ""retweeted_status"": {""contributors"": null, ""truncated"": false, ""text"": ""YOU WANT A MEXICAN FLAG FLYING OVER WHITE HOUSE? Vote for anyone but TRUMP. IF NOT VOTE FOR TRUMP\ud83c\uddfa\ud83c\uddf8\ud83c\uddfa\ud83c\uddf8\ud83c\uddfa\ud83c\uddf8\ud83c\uddfa\ud83c\uddf8\ud83c\uddfa\ud83c\uddf8\ud83c\uddfa\ud83c\uddf8\ud83c\uddfa\ud83c\uddf8\ud83c\uddfa\ud83c\uddf8\ud83c\uddfa\ud83c\uddf8\ud83c\uddfa\ud83c\uddf8\ud83c\uddfa\ud83c\uddf8\ud83c\uddfa\ud83c\uddf8\ud83c\uddfa\ud83c\uddf8\ud83c\uddfa\ud83c\uddf8\ud83c\uddfa\ud83c\uddf8\ud83c\uddfa\ud83c\uddf8\ud83c\uddfa\ud83c\uddf8\ud83c\uddfa\ud83c\uddf8\ud83c\uddfa\ud83c\uddf8\ud83c\uddfa\ud83c\uddf8\ud83c\uddfa\ud83c\uddf8\ud83d\udc4d"", ""is_quote_status"": false, ""in_reply_to_status_id"": null, ""id"": 727268579930943488, ""favorite_count"": 3, ""source"": ""<a href=\""http://twitter.com/download/iphone\"" rel=\""nofollow\"">Twitter for iPhone</a>"", ""retweeted"": false, ""coordinates"": null, ""entities"": {""symbols"": [], ""user_mentions"": [], ""hashtags"": [], ""urls"": []}, ""in_reply_to_screen_name"": null, ""in_reply_to_user_id"": null, ""retweet_count"": 4, ""id_str"": ""727268579930943488"", ""favorited"": false, ""geo"": null, ""in_reply_to_user_id_str"": null, ""lang"": ""en"", ""created_at"": ""Mon May 02 22:48:36 +0000 2016"", ""in_reply_to_status_id_str"": null, ""place"": null}, ""geo"": null, ""in_reply_to_user_id_str"": null, ""lang"": ""en"", ""created_at"": ""Mon May 02 22:50:29 +0000 2016"", ""in_reply_to_status_id_str"": null, ""place"": null}, ""is_translation_enabled"": false, ""utc_offset"": null, ""statuses_count"": 15321, ""description"": ""Common Sense Conservative, USAF Veteran, NRA, Entrepreneur, Insurance Professional & Opinionated Business Owner. Donald Trump has my vote!"", ""friends_count"": 1302, ""location"": ""California, USA"", ""profile_link_color"": ""0084B4"", ""profile_image_url"": ""http://pbs.twimg.com/profile_images/668954555153936385/hBR04cdd_normal.png"", ""following"": false, ""geo_enabled"": false, ""profile_background_image_url"": ""http://abs.twimg.com/images/themes/theme1/bg.png"", ""name"": ""Steve"", ""lang"": ""en"", ""profile_background_tile"": false, ""favourites_count"": 7695, ""screen_name"": ""A1speaker"", ""notifications"": false, ""url"": null, ""created_at"": ""Tue Aug 17 23:29:23 +0000 2010"", ""contributors_enabled"": false, ""time_zone"": null, ""protected"": false, ""default_profile"": true, ""is_translator"": false}"
Polls are just a guess. ONLY your vote counts. Get up and GO Vote for Trump. Don't leave it to someone else. GO VOTE https://t.co/54ie5VHFxe
"@LrBlancoo @kuorumorg Trump is a ""10""!"
"Don't leave this to chance. Polls are nice, but ONLY YOUR VOTES COUNT! Get Up &amp; GO VOTE 4 Trump in Indiana. Go Vote! https://t.co/T8z8VLfzjJ"
Trump is the right candidate! INDIANA get up and go vote 4 Trump. Trump will be a great President #MAGA. Go vote! https://t.co/bha2LIalKj
Trump is the right candidate. Get up and GO Vote 4 Trump. Indiana we are depending on you to continue the momentum. https://t.co/d30iTsj54c
Don't leave it to chance INDIANA. Polls can make you over confident. YOU must Get Up &amp; GO VOTE 4 Trump. GO VOTE! https://t.co/UXQCjxFZrQ
Benghazi: What Did Bill Clinton Know &amp; When Did He Know It? - Judicial Watch https://t.co/5eyUhRwd5P - Another shoe drops on #CrookedHillary
