"{""follow_request_sent"": false, ""has_extended_profile"": false, ""profile_use_background_image"": true, ""profile_text_color"": ""333333"", ""default_profile_image"": false, ""id"": 705180372598784000, ""profile_background_image_url_https"": null, ""verified"": false, ""imported_to_gensim"": false, ""profile_location"": null, ""profile_image_url_https"": ""https://pbs.twimg.com/profile_images/719344659638722560/jrIT-Bfr_normal.jpg"", ""profile_sidebar_fill_color"": ""DDEEF6"", ""entities"": {""description"": {""urls"": []}}, ""followers_count"": 377, ""profile_sidebar_border_color"": ""C0DEED"", ""id_str"": ""705180372598784000"", ""profile_background_color"": ""F5F8FA"", ""listed_count"": 27, ""status"": {""contributors"": null, ""truncated"": false, ""text"": ""If you own a Ford you helped. https://t.co/T1Xqgobk7r"", ""is_quote_status"": true, ""in_reply_to_status_id"": null, ""id"": 729465555527159808, ""favorite_count"": 0, ""source"": ""<a href=\""http://twitter.com/download/android\"" rel=\""nofollow\"">Twitter for Android</a>"", ""quoted_status_id"": 729461184995463168, ""retweeted"": false, ""coordinates"": null, ""entities"": {""symbols"": [], ""user_mentions"": [], ""hashtags"": [], ""urls"": [{""url"": ""https://t.co/T1Xqgobk7r"", ""indices"": [30, 53], ""expanded_url"": ""https://twitter.com/amrightnow/status/729461184995463168"", ""display_url"": ""twitter.com/amrightnow/sta\u2026""}]}, ""in_reply_to_screen_name"": null, ""in_reply_to_user_id"": null, ""retweet_count"": 0, ""id_str"": ""729465555527159808"", ""favorited"": false, ""geo"": null, ""in_reply_to_user_id_str"": null, ""possibly_sensitive"": false, ""lang"": ""en"", ""created_at"": ""Mon May 09 00:18:35 +0000 2016"", ""quoted_status_id_str"": ""729461184995463168"", ""in_reply_to_status_id_str"": null, ""place"": null}, ""is_translation_enabled"": false, ""utc_offset"": null, ""statuses_count"": 6969, ""description"": """", ""friends_count"": 154, ""location"": """", ""profile_link_color"": ""2B7BB9"", ""profile_image_url"": ""http://pbs.twimg.com/profile_images/719344659638722560/jrIT-Bfr_normal.jpg"", ""following"": false, ""geo_enabled"": false, ""profile_background_image_url"": null, ""name"": ""Gabby"", ""lang"": ""en"", ""profile_background_tile"": false, ""favourites_count"": 7721, ""screen_name"": ""Gabbysings2"", ""notifications"": false, ""url"": null, ""created_at"": ""Wed Mar 02 23:57:57 +0000 2016"", ""contributors_enabled"": false, ""time_zone"": null, ""protected"": false, ""default_profile"": true, ""is_translator"": false}"
If you own a Ford you helped. https://t.co/T1Xqgobk7r
Is hard to imagine they just walked in and took over. https://t.co/jGJUiQR1Kc
"They get it, the people who are supporting them don't care or don't comprehend or will miss their free stuff. https://t.co/O2alzV1WID"
Where is his Christian values.  The man stutters in a downpour. https://t.co/HCaerDAVC9
What is bad is she had to relive it everytime she sees his face.  He for away with it and it imprisoned her. https://t.co/Ry5eNbCUos
Ur compliments ring false Mr Romney. Look how u trashed Mr.Trump after he supported ur campaign &amp; u complimented him https://t.co/KgLDeA86mG
"It's one thing to have freedom to worship your own religion,  another to kill others to conform.  G https://t.co/y49g204heD"
Just shows he has no scrupels. And no limit to what he will do. https://t.co/xLRUkNZZFb
And it won't be monkey business either. https://t.co/RlYlUzFaJm
Shout it loud and clear.  Did they think people would continue to look away while she spouts her crap? https://t.co/jChd98ueAB
This the globalist way of making a multi culture society.  Trump is really going to need some serious help. https://t.co/JVLzEryf2C
What is wrong with these vile creatures? Are they possessed? https://t.co/znsH85CuOC
Are they living on another planet? ! They need a reality check. https://t.co/lAnTVZDWqK
Wow!  Mostly men handing around. Don't they have jobs? https://t.co/rDE7H126D4
Yeah and guess who got Executive Privilege? Just like kilLIARy seems to be getting for Benghazi and email server. https://t.co/73PmeN51wB
His only reason for breaking the pledge to support were conditions put on by the elitists. Trying to blackmail Trump https://t.co/23J3EewlMa
Nothing honest about promising 2 support the gop nominee then coming out w/stipulations.Should've been talked 1st. https://t.co/CwIa74sFRg
I'd laugh but omg....it's a crying shame. https://t.co/TRS9jD0o5E
You're right.  My prayers go out to all who knew him.  I'm so sorry for their loss. Thanking him for his service . https://t.co/MpALMLeAv8
So it took them this long...what's up with that? https://t.co/wlrsvdbH2N
He's just getting started.  Popcorn anyone? https://t.co/6nN1TID7Xi
People need to take back their schools as well as their government.  Folks this isn't going to get better. https://t.co/Gm2hET2bww
A simple question with loaded significance! No Man Left Behind #kilLIARY &amp; #Obama !!! You failed them!! https://t.co/wglpE631lh
My prayers for all of them. https://t.co/oe6uStonAA
"As cruel and dispicable as this sounds,  it's the absolute truth.  And yet she continues to leave a trail. https://t.co/gJfEOh2ypf"
And the ones who stomp on it are without any gratitude and respect. https://t.co/KRhCT90UqC
If he convinces people he won again. https://t.co/iNuuZmy4LS
And he did it with more class and style than these sleeze-balls did with their back stabbing tactics 2 keep him down https://t.co/khxbxLkwea
You captured the essence of them perfectly! https://t.co/yptAZCFcGN
Exactly.  Why doesn't this infuriate more people?! https://t.co/ZxQkB3e8fl
"And that is just for the politicians! Only they don't call it welfare checks &amp; sect8,  they call it a career. https://t.co/XGthtrbKpM"
It's our money. You work for us. You don't get to decide. We're saying no. That's who we are. https://t.co/14odn1kG84
Other words. . the enemy of your enemy is my friend.  It will fall on their shoulders if she gets in. https://t.co/SsfjyL4dcu
When will our officials get a pair and stop this. This isn't in our Constitution for this administration to shred https://t.co/eIRkrBqUfr
She is a real piece of work.  HYPOCRITE# https://t.co/ys10PnzYeV
Huck I'd right! https://t.co/aChTV8QQzn
Does this mean we can now blame her for protestors and mean rhetoric? https://t.co/7AWWybYsHq
It's no secret that sleeze is slimy and that being the case...I feel a need for a shower after listening to that. https://t.co/LixTHXJQsj
Truth! https://t.co/GmejKup4ge
Yep and he doesn't take the fall.  He's got to let the terrorist in. https://t.co/p52y5xVwTj
Because our leaders told them they could. https://t.co/1j2fBpfbvM
I think he matches the gutterspeak they deserve. Lol https://t.co/8OwmooZnJL
Yep! An effort in futility for sure. https://t.co/qHZNWdH81X
Most of us birthers kept telling anyone who would listen who he was. .. no one cared then. https://t.co/pKe3j5eLjR
Anti-trump protesters?   A bunch of people who can't even pass a citizenship test. https://t.co/MnXHhEQUEn
There is no adjective strong enough 2 describe these 2 people and the horror they have wrecked on women and military https://t.co/AF2SBhbkFA
Every legal American citizen R or D should be outraged over these pieces of crap! Where in the  H*** is their pride? https://t.co/DVM7bP8YeF
Thank you!!!! https://t.co/yUlNqV8BNo
Has anyone ever seen his records? https://t.co/2jU92rrpDT
OMG! You said a mouthful. https://t.co/2fFQe3Jqz4
"Fox F &amp; F  just lead with a tease that Romney may make a run?   Seriously?  They seriously want hilLIARy to win, don't they?"
Too funny! https://t.co/R3UkdcTEnf
It says a lot about our education system when we have to truck in foreigner professionals. https://t.co/480UgbRYkR
Once a liar &amp; cheat always a liar &amp; cheat. https://t.co/PJylR4pbQg
@realDonaldTrump.  RTing this.   Hey hilLIARy who is Tim!? https://t.co/1yt9tDTyWn
Yeah it is. So we're to be tolerant though. https://t.co/oZGzVb7vA0
It evidently helped him to be part of a family related to his Iranian counterpart. https://t.co/w2gsuqSuRc
Exactly! https://t.co/fy3XTsOXmv
You weren't invited and you don't know your own history. https://t.co/vJ5LBxShhE
Two people who are the most repulsive liars. https://t.co/RJqddngOz5
