"{""follow_request_sent"": false, ""has_extended_profile"": false, ""profile_use_background_image"": true, ""profile_text_color"": ""362720"", ""default_profile_image"": false, ""id"": 154228382, ""profile_background_image_url_https"": ""https://pbs.twimg.com/profile_background_images/124210723/010.jpg"", ""verified"": false, ""imported_to_gensim"": false, ""profile_location"": null, ""profile_image_url_https"": ""https://pbs.twimg.com/profile_images/711777672930537472/s7TGXsbr_normal.jpg"", ""profile_sidebar_fill_color"": ""E5507E"", ""entities"": {""url"": {""urls"": [{""url"": ""https://t.co/p9MZJECiLq"", ""indices"": [0, 23], ""expanded_url"": ""http://glassy-elegance.com"", ""display_url"": ""glassy-elegance.com""}]}, ""description"": {""urls"": []}}, ""followers_count"": 402, ""profile_sidebar_border_color"": ""CC3366"", ""id_str"": ""154228382"", ""profile_background_color"": ""FF6699"", ""listed_count"": 58, ""status"": {""contributors"": null, ""truncated"": false, ""text"": ""RT @DonaldTrumpInfo: World Leaders Assess a Potential Donald Trump Presidency - Wall Street Journal https://t.co/mM8mFUYWJQ #DonaldTrump ht\u2026"", ""is_quote_status"": false, ""in_reply_to_status_id"": null, ""id"": 729458536267296770, ""favorite_count"": 0, ""source"": ""<a href=\""http://twitter.com/download/iphone\"" rel=\""nofollow\"">Twitter for iPhone</a>"", ""retweeted"": false, ""coordinates"": null, ""entities"": {""symbols"": [], ""user_mentions"": [{""id"": 3131253213, ""indices"": [3, 19], ""id_str"": ""3131253213"", ""screen_name"": ""DonaldTrumpInfo"", ""name"": ""Donald J. Trump""}], ""hashtags"": [{""indices"": [124, 136], ""text"": ""DonaldTrump""}], ""urls"": [{""url"": ""https://t.co/mM8mFUYWJQ"", ""indices"": [100, 123], ""expanded_url"": ""http://news.google.com/news/url?sa=t&fd=R&ct2=us&usg=AFQjCNHb56FNjWkUyoSzbQs3PENT8-qfDw&clid=c3a7d30bb8a4878e06b80cf16b898331&cid=52779102403561&ei=TMUvV4ibBMyV3QHq0LOYBw&url=http://www.wsj.com/articles/world-leaders-assess-a-potential-donald-trump-presidency-1462739253"", ""display_url"": ""news.google.com/news/url?sa=t&\u2026""}], ""media"": [{""source_user_id"": 3131253213, ""source_status_id_str"": ""729446165104758784"", ""expanded_url"": ""http://twitter.com/DonaldTrumpInfo/status/729446165104758784/photo/1"", ""display_url"": ""pic.twitter.com/hMMOYvxFyA"", ""url"": ""https://t.co/hMMOYvxFyA"", ""media_url_https"": ""https://pbs.twimg.com/media/Ch-DbBjWUAE0Slk.jpg"", ""source_user_id_str"": ""3131253213"", ""source_status_id"": 729446165104758784, ""id_str"": ""729446164953714689"", ""sizes"": {""small"": {""h"": 80, ""resize"": ""fit"", ""w"": 80}, ""large"": {""h"": 80, ""resize"": ""fit"", ""w"": 80}, ""medium"": {""h"": 80, ""resize"": ""fit"", ""w"": 80}, ""thumb"": {""h"": 80, ""resize"": ""crop"", ""w"": 80}}, ""indices"": [139, 140], ""type"": ""photo"", ""id"": 729446164953714689, ""media_url"": ""http://pbs.twimg.com/media/Ch-DbBjWUAE0Slk.jpg""}]}, ""in_reply_to_screen_name"": null, ""in_reply_to_user_id"": null, ""retweet_count"": 5, ""id_str"": ""729458536267296770"", ""favorited"": false, ""retweeted_status"": {""contributors"": null, ""truncated"": false, ""text"": ""World Leaders Assess a Potential Donald Trump Presidency - Wall Street Journal https://t.co/mM8mFUYWJQ #DonaldTrump https://t.co/hMMOYvxFyA"", ""is_quote_status"": false, ""in_reply_to_status_id"": null, ""id"": 729446165104758784, ""favorite_count"": 6, ""source"": ""<a href=\""http://ifttt.com\"" rel=\""nofollow\"">IFTTT</a>"", ""retweeted"": false, ""coordinates"": null, ""entities"": {""symbols"": [], ""user_mentions"": [], ""hashtags"": [{""indices"": [103, 115], ""text"": ""DonaldTrump""}], ""urls"": [{""url"": ""https://t.co/mM8mFUYWJQ"", ""indices"": [79, 102], ""expanded_url"": ""http://news.google.com/news/url?sa=t&fd=R&ct2=us&usg=AFQjCNHb56FNjWkUyoSzbQs3PENT8-qfDw&clid=c3a7d30bb8a4878e06b80cf16b898331&cid=52779102403561&ei=TMUvV4ibBMyV3QHq0LOYBw&url=http://www.wsj.com/articles/world-leaders-assess-a-potential-donald-trump-presidency-1462739253"", ""display_url"": ""news.google.com/news/url?sa=t&\u2026""}], ""media"": [{""expanded_url"": ""http://twitter.com/DonaldTrumpInfo/status/729446165104758784/photo/1"", ""display_url"": ""pic.twitter.com/hMMOYvxFyA"", ""url"": ""https://t.co/hMMOYvxFyA"", ""media_url_https"": ""https://pbs.twimg.com/media/Ch-DbBjWUAE0Slk.jpg"", ""id_str"": ""729446164953714689"", ""sizes"": {""small"": {""h"": 80, ""resize"": ""fit"", ""w"": 80}, ""large"": {""h"": 80, ""resize"": ""fit"", ""w"": 80}, ""medium"": {""h"": 80, ""resize"": ""fit"", ""w"": 80}, ""thumb"": {""h"": 80, ""resize"": ""crop"", ""w"": 80}}, ""indices"": [116, 139], ""type"": ""photo"", ""id"": 729446164953714689, ""media_url"": ""http://pbs.twimg.com/media/Ch-DbBjWUAE0Slk.jpg""}]}, ""in_reply_to_screen_name"": null, ""in_reply_to_user_id"": null, ""retweet_count"": 5, ""id_str"": ""729446165104758784"", ""favorited"": false, ""geo"": null, ""in_reply_to_user_id_str"": null, ""possibly_sensitive"": false, ""lang"": ""en"", ""created_at"": ""Sun May 08 23:01:32 +0000 2016"", ""in_reply_to_status_id_str"": null, ""place"": null, ""extended_entities"": {""media"": [{""expanded_url"": ""http://twitter.com/DonaldTrumpInfo/status/729446165104758784/photo/1"", ""display_url"": ""pic.twitter.com/hMMOYvxFyA"", ""url"": ""https://t.co/hMMOYvxFyA"", ""media_url_https"": ""https://pbs.twimg.com/media/Ch-DbBjWUAE0Slk.jpg"", ""id_str"": ""729446164953714689"", ""sizes"": {""small"": {""h"": 80, ""resize"": ""fit"", ""w"": 80}, ""large"": {""h"": 80, ""resize"": ""fit"", ""w"": 80}, ""medium"": {""h"": 80, ""resize"": ""fit"", ""w"": 80}, ""thumb"": {""h"": 80, ""resize"": ""crop"", ""w"": 80}}, ""indices"": [116, 139], ""type"": ""photo"", ""id"": 729446164953714689, ""media_url"": ""http://pbs.twimg.com/media/Ch-DbBjWUAE0Slk.jpg""}]}}, ""geo"": null, ""in_reply_to_user_id_str"": null, ""possibly_sensitive"": false, ""lang"": ""en"", ""created_at"": ""Sun May 08 23:50:42 +0000 2016"", ""in_reply_to_status_id_str"": null, ""place"": null, ""extended_entities"": {""media"": [{""source_user_id"": 3131253213, ""source_status_id_str"": ""729446165104758784"", ""expanded_url"": ""http://twitter.com/DonaldTrumpInfo/status/729446165104758784/photo/1"", ""display_url"": ""pic.twitter.com/hMMOYvxFyA"", ""url"": ""https://t.co/hMMOYvxFyA"", ""media_url_https"": ""https://pbs.twimg.com/media/Ch-DbBjWUAE0Slk.jpg"", ""source_user_id_str"": ""3131253213"", ""source_status_id"": 729446165104758784, ""id_str"": ""729446164953714689"", ""sizes"": {""small"": {""h"": 80, ""resize"": ""fit"", ""w"": 80}, ""large"": {""h"": 80, ""resize"": ""fit"", ""w"": 80}, ""medium"": {""h"": 80, ""resize"": ""fit"", ""w"": 80}, ""thumb"": {""h"": 80, ""resize"": ""crop"", ""w"": 80}}, ""indices"": [139, 140], ""type"": ""photo"", ""id"": 729446164953714689, ""media_url"": ""http://pbs.twimg.com/media/Ch-DbBjWUAE0Slk.jpg""}]}}, ""is_translation_enabled"": false, ""utc_offset"": null, ""statuses_count"": 19195, ""description"": ""Coordinator /owner for craft fair in Woodland Park, Co & jewelry maker."", ""friends_count"": 88, ""location"": ""Florissant, Co"", ""profile_link_color"": ""B40B43"", ""profile_image_url"": ""http://pbs.twimg.com/profile_images/711777672930537472/s7TGXsbr_normal.jpg"", ""following"": false, ""geo_enabled"": true, ""profile_background_image_url"": ""http://pbs.twimg.com/profile_background_images/124210723/010.jpg"", ""name"": ""Mary Nordquist"", ""lang"": ""en"", ""profile_background_tile"": true, ""favourites_count"": 2484, ""screen_name"": ""glassyelegance"", ""notifications"": false, ""url"": ""https://t.co/p9MZJECiLq"", ""created_at"": ""Thu Jun 10 18:16:38 +0000 2010"", ""contributors_enabled"": false, ""time_zone"": null, ""protected"": false, ""default_profile"": false, ""is_translator"": false}"
EXCLUSIVE: Vicente Fox Blames U.S. for Drug War https://t.co/E8gjoh3gth
SARAH PALIN Announces She Will Work to Defeat Paul Ryan in Primary (VIDEO) https://t.co/vm94w7uDoY
Nancy Pelosi Plotting With Mexican President Fox TO STOP DONALD TRUMP https://t.co/p0h74MNz7d
"VIDEO=&gt; #BlackLivesMatter Goon Threatens to Murder Donald Trump, Wife Melania and Daughter Ivanka https://t.co/Sr6thiOo1x"
The Suspicious Suicide Of A Political Blogger » Alex Jones' Infowars: There's a war on for your mind! https://t.co/DAsK0E1kgD
Lame Cherry: The Suicide Party https://t.co/PfoieP54UI
Lame Cherry: What Paul Ryan Wants From Donald Trump https://t.co/6SuYbZhkFG
'Weekly Standard' Editor Bill Kristol Meeting Mitt Romney to Float Third Party Run - Breitbart https://t.co/hsMxHaQ7RX
The Blue Collar Billionaire – Donald Trump Courts Teamsters Union Membership… | The Last Refuge https://t.co/ypNkSpvyI5
The Voting Bloc EVERY Pundit Never Discusses – “The Monster Vote”…. | The Last Refuge https://t.co/dUuE9gQriV
"Trump in Spokane: ""Hillary Clinton Hurt Many Women, the Women Bill Abused"" (VIDEO) https://t.co/zrTsCjZpGW"
FLASHBACK VIDEO=&gt; 'CONSERVATIVE' Donald Trump Interviewed at the 1988 GOP Convention https://t.co/kYdlI7f5q0
