"{""follow_request_sent"": false, ""has_extended_profile"": false, ""profile_use_background_image"": true, ""profile_text_color"": ""3D1957"", ""default_profile_image"": false, ""id"": 60765262, ""profile_background_image_url_https"": ""https://pbs.twimg.com/profile_background_images/378800000097580474/89d057c5c4067411bc364f2ac610a255.jpeg"", ""verified"": false, ""imported_to_gensim"": false, ""profile_location"": null, ""profile_image_url_https"": ""https://pbs.twimg.com/profile_images/378800000746929295/300b5afda5dcc45756125172bafe1bf0_normal.png"", ""profile_sidebar_fill_color"": ""7AC3EE"", ""entities"": {""url"": {""urls"": [{""url"": ""http://t.co/Q6DvFgzOH3"", ""indices"": [0, 22], ""expanded_url"": ""http://iamgodsmoderndaymartyr.blogspot.com/"", ""display_url"": ""iamgodsmoderndaymartyr.blogspot.com""}]}, ""description"": {""urls"": [{""url"": ""http://t.co/xZECCoGurz"", ""indices"": [57, 79], ""expanded_url"": ""http://kettleofeagles.blogspot.com/2011/01/kettle-of-eagles-introduction.html"", ""display_url"": ""kettleofeagles.blogspot.com/2011/01/kettle\u2026""}]}}, ""followers_count"": 821, ""profile_sidebar_border_color"": ""000000"", ""id_str"": ""60765262"", ""profile_background_color"": ""642D8B"", ""listed_count"": 17, ""status"": {""contributors"": null, ""truncated"": false, ""text"": ""RT @Doug_Giles: DEAR OBAMA &amp; HILLARY: How Many Murders In Chicago This Year Were Committed By NRA Members? https://t.co/gF3951SX1V via @Dou\u2026"", ""is_quote_status"": false, ""in_reply_to_status_id"": null, ""id"": 726923998924181505, ""favorite_count"": 0, ""source"": ""<a href=\""http://twitter.com/download/android\"" rel=\""nofollow\"">Twitter for Android</a>"", ""retweeted"": false, ""coordinates"": null, ""entities"": {""symbols"": [], ""user_mentions"": [{""id"": 417390501, ""indices"": [3, 14], ""id_str"": ""417390501"", ""screen_name"": ""Doug_Giles"", ""name"": ""Doug Giles""}, {""id"": 417390501, ""indices"": [139, 144], ""id_str"": ""417390501"", ""screen_name"": ""Doug_Giles"", ""name"": ""Doug Giles""}], ""hashtags"": [], ""urls"": [{""url"": ""https://t.co/gF3951SX1V"", ""indices"": [111, 134], ""expanded_url"": ""http://goo.gl/ScXn8b"", ""display_url"": ""goo.gl/ScXn8b""}]}, ""in_reply_to_screen_name"": null, ""in_reply_to_user_id"": null, ""retweet_count"": 1, ""id_str"": ""726923998924181505"", ""favorited"": false, ""retweeted_status"": {""contributors"": null, ""truncated"": false, ""text"": ""DEAR OBAMA &amp; HILLARY: How Many Murders In Chicago This Year Were Committed By NRA Members? https://t.co/gF3951SX1V via @Doug_Giles"", ""is_quote_status"": false, ""in_reply_to_status_id"": null, ""id"": 726921646502604800, ""favorite_count"": 1, ""source"": ""<a href=\""http://twitter.com\"" rel=\""nofollow\"">Twitter Web Client</a>"", ""retweeted"": false, ""coordinates"": null, ""entities"": {""symbols"": [], ""user_mentions"": [{""id"": 417390501, ""indices"": [123, 134], ""id_str"": ""417390501"", ""screen_name"": ""Doug_Giles"", ""name"": ""Doug Giles""}], ""hashtags"": [], ""urls"": [{""url"": ""https://t.co/gF3951SX1V"", ""indices"": [95, 118], ""expanded_url"": ""http://goo.gl/ScXn8b"", ""display_url"": ""goo.gl/ScXn8b""}]}, ""in_reply_to_screen_name"": null, ""in_reply_to_user_id"": null, ""retweet_count"": 1, ""id_str"": ""726921646502604800"", ""favorited"": false, ""geo"": null, ""in_reply_to_user_id_str"": null, ""possibly_sensitive"": true, ""lang"": ""en"", ""created_at"": ""Sun May 01 23:50:00 +0000 2016"", ""in_reply_to_status_id_str"": null, ""place"": null}, ""geo"": null, ""in_reply_to_user_id_str"": null, ""possibly_sensitive"": false, ""lang"": ""en"", ""created_at"": ""Sun May 01 23:59:21 +0000 2016"", ""in_reply_to_status_id_str"": null, ""place"": null}, ""is_translation_enabled"": false, ""utc_offset"": -14400, ""statuses_count"": 15287, ""description"": ""Radical Conservative Christian follower of Jesus Christ\r\nhttp://t.co/xZECCoGurz #IamCoptic #NRA\r\n#2A #OK #JESUS"", ""friends_count"": 1634, ""location"": ""USA"", ""profile_link_color"": ""4400FF"", ""profile_image_url"": ""http://pbs.twimg.com/profile_images/378800000746929295/300b5afda5dcc45756125172bafe1bf0_normal.png"", ""following"": false, ""geo_enabled"": false, ""profile_banner_url"": ""https://pbs.twimg.com/profile_banners/60765262/1377516016"", ""profile_background_image_url"": ""http://pbs.twimg.com/profile_background_images/378800000097580474/89d057c5c4067411bc364f2ac610a255.jpeg"", ""name"": ""GodsModernDayMartyr"", ""lang"": ""en"", ""profile_background_tile"": true, ""favourites_count"": 13, ""screen_name"": ""GMDMartyr"", ""notifications"": false, ""url"": ""http://t.co/Q6DvFgzOH3"", ""created_at"": ""Tue Jul 28 01:00:32 +0000 2009"", ""contributors_enabled"": false, ""time_zone"": ""Eastern Time (US & Canada)"", ""protected"": false, ""default_profile"": false, ""is_translator"": false}"
"Noah's Ark Sails Again - Breaking Israel News | Israel Latest News, Israel Prophecy News https://t.co/Vy0WjdJCvR via @binalerts"
@WendyDamron BS! Trump did what he did for his company's. He sees destruction coming and stepped up. #GetAClue
"America, Sheep to the Slaughter https://t.co/uPXZQTV7aD via @rightsidenews"
OUTRAGEOUS! National Review's Eliana Johnson Blames TRUMP SUPPORTERS for... https://t.co/sfJIcSpZre via @YouTube
@WendyDamron @28Dave38 No way! That would have been #BarrySoetoro!
"Donald Trump Protester Speaks Out: “I Was Paid $3,500 To Protest Trump’s Rally” https://t.co/C6wQrCr16S via @ABC News"
Obama Bribing Gun Manufacturers To Push “Smart Gun” Technology | American Military News - https://t.co/XwKAWmuHl5
"Obama's ICE Frees 19,000 Illegal Immigrant Criminals To Streets in 2015, Including Murderers, Rapists - Breitbart https://t.co/wGyW27dgNk"
EXACTLY What Democrats Have Created in The USA Under Obama https://t.co/72rORSKHEP
TPP is Treason. WAKE UP! Globalization Goes For Checkmate. (PART ONE) https://t.co/al9nKHfonM #news via @activistpost
News Poll Refutes Mark and Gabby Poll on ‘Terror Watch List’ Gun Ban https://t.co/L1EJtHbYnL via @https://twitter.com/Oathkeepers
'Islamists' Slay US-Employed Bangladeshi Gay-Rights Activist https://t.co/PgYeLSevWq via @clarionproject
Islamic State Hacks Into Michigan Church's Website https://t.co/SLkz9l0efG via @clarionproject
Sign the Boycott Target Pledge! https://t.co/vEnF9ue8i7
From AMN: https://t.co/EwwKX5h6XH
Confederate Memorial Day https://t.co/zSqGNQXaeJ via @fneudecker
Ramirez Cartoon: Maybe We Should Build A Wall… https://t.co/82rIWA9GFz via @fneudecker
Virginia’s McAuliffe Tampers With Vote To Aid Pal Hillary #Oathbreaker https://t.co/QbzUxmbtul via @fneudecker
@cajuncoolbreeze just followed you. Connie from fb.
Billionaire Oil Tycoon Harold Hamm Endorses Donald Trump https://t.co/Y2fBcelvuG via @EUTimesNET
Ron Paul: U.S. Wouldn’t Allow Saudi Threats Over 9/11 ‘Unless D.C. Was Hiding What They’ve Done’ https://t.co/tyvx7hYcR5
Former FDA commissioner Margaret Hamburg named in massive conspiracy and racketeering lawsuit involving Johnson  https://t.co/rxXbgUmMXF
Ticking TimeBomb: Americans In Horrible Financial Shape Just Prior to The Next Crisis - The Dollar Vigilante https://t.co/hB8cnDwyyZ
#WolfInSheepsClothing #Anti2A #Kasich https://t.co/y0Lw6Qcedr
"@heavymetaIovers @realDonaldTrump even though we are yet sinners (haters), God still loves you."
"Seeking A Warmer Welcome, Gun Factory Moves Down South https://t.co/o8oGXWo3yc"
Doctors are Being Killed for Saving Your Children ~ Most Urgent!!! https://t.co/xQJ5eJdB9P via @YouTube
Donald Trump on Karl Rove: 'A Dishonorable Guy' https://t.co/4uUVOGPSJE via @BreitbartNews
House takes immigration fight to Supreme Court https://t.co/mppFlVkDpk via @DCExaminer
64 SHTF Medical tips That Work | The Daily Sheeple https://t.co/oxcJ0INi7l via @sharethis
How to successfully fight Tyranny  https://t.co/4D0i9mWhqD via @youtube
The Market for Liberty https://t.co/qdsfxicizo
Prepare Now to Avoid Panic Later - https://t.co/Lfi8TqOGu3
"Ron Ewart -- Men in Dark Suits, Blue Smoke and Backroom Deals https://t.co/RElDGcSjZx via @sharethis"
The Truth About Cancer:  A Global Quest https://t.co/GJ8t8c9PTk
"Can We Trust the IRS? One Day After Panama Papers Leak, IRS Catches Fire, Closes https://t.co/kXkAZcIVrA"
"‘Islamophobia’ Is Still Not the Problem: In Kansas, Another Case Study https://t.co/9tt6KsIKaJ via @AccuracyInMedia"
Spectators Left Stunned as Chinook Helicopter Attempts Unbelievable Aerial Stunt In Front of Unsuspecting Crowd https://t.co/u4wEEHBC8b
Watch This: A Hillary Clinton Surrogate Embarrassingly Calls Osama Bin Laden “Barack Obama” During Live TV- https://t.co/UWwdqkqKt8
Media Blackout as D.C. Jails Fill with Hundreds Arrested at Capitol Protesting for Fairer Elections https://t.co/CMvS5yKMZL via @sharethis
Janet Yellen Meets With Obama In Emergency Meetings As Crises Erupt Worldwide https://t.co/ZhOzeoihSd via @DollarVigilante
Reddit Quietly Warns Users of Surveillance Request https://t.co/RnNJytaMWV via @fneudecker
Victory! The Arch From The Temple Of Baal Planned For New York City Has Been CANCELED  https://t.co/XgVsuESJe5
Kingdom Purposes https://t.co/cmcrPBJOA3
Senator Charges Obamas Executive Clemency Program with Putting Firearm Offenders on the Streets - https://t.co/rwSVexrtZD @nraila
CDC hiding massive collection of damning scientific evidence proving vaccines are linked to autism https://t.co/pz2Pv9O6t1
The Coming Collapse Will Be Talked About For Centuries… If We Are Even Still Here To Talk About It https://t.co/Xud0JQGLZk
"Tomgram: William Hartung, What a Waste, the U.S. Military | TomDispatch: https://t.co/WAtfvW3zzW via @tomdispatch"
"Nile River ""Turns"" Blood-Red in Biblical Nature Phenomenon -https://t.co/6w8bMRxUTp via @binalerts"
Wells Fargo Just Admits to Robbing US Citizens by Deceiving the Govt &amp; No One Was Charged https://t.co/Vd01BYDUAV #news via @activistpost
The Devil is Coming! Thousands Of Satanic Portals Being Built World Wide https://t.co/Q86VSFHC5F via @EUTimesNET
Ted Cruz wants to increase the H-1B immigration cap by 500% https://t.co/gEx5R4Toz5 via @EUTimesNET
"Wells Fargo ""Admits Deceiving"" U.S. Government, Pays Record $1.2 Billion Settlement https://t.co/Cr0zTuIBUi"
Special Operations airman killed his squadron commander in apparent-murder suicide https://t.co/S6b2mX3U4f
"https://t.co/SbAZEUTm9l Thy sons and thy daughters shall be given unto another people, and thine eyes shall look, and fail with longing...."
US Air Force deploys B-52 bombers in Middle East to combat Islamic State https://t.co/Qkkllx8A8X
"Here Is Rothschild's Primer How To Launder Money In U.S. Real Estate And Avoid ""Blacklists"" https://t.co/8KYrFRnP1a"
Breaking: Mayor's office in Houston shut down Vaxxed https://t.co/mtVEj4oiQb via @wordpressdotcom
https://t.co/MiuD5HUqc2
"Due to High Arsenc Levels, FDA Warns Parents to Avoid Infant Rice Cereal https://t.co/0tmJhx6KTV"
Venezuela is #FeelingTheBern – Murder Capital of the World &amp; Hyperinflation https://t.co/eneLKQQIiK via @DollarVigilante
SHOCK: Massive Gun Store Robbery In Houston Caught On Camera | American Military News - https://t.co/pYWl3OgXfK
Panama Papers: Financial Elite’s Attack on Worldwide Financial Privacy | The Dollar Vigilante https://t.co/kkJS8yqeTZ
Arm Yourself With These Spiritual Weapons for the End Times https://t.co/UHu5Ij8F5V via @charismamag
Five key figures implicated in the 'Panama Papers' scandal https://t.co/Y12jjHBd73
‘Corruption’ as a Propaganda Weapon https://t.co/0a52ype08h
“Mind Blowing”: Die-off in Pacific far worse than anything ever seen before —  https://t.co/2TbSXiefZt
500k food stamp recipients to lose benefits on April 1 https://t.co/Iz3nySABLx via @legitgov
"Google sought overthrow of Syria's Assad, Clinton email reveals https://t.co/nFCl2igZwc via @legitgov"
FEMA to Perform 'Full-Scale Exercise' at Seabrook Nuclear Power Plant https://t.co/RK25fg5jUn via @legitgov
"Times Square evacuated after suspicious truck was left unattended with wires, gas...https://t.co/cqNRrc2OpF via @legitgov"
Conn. governor signs executive order banning state-funded travel to North Carolina https://t.co/Mi8CWzpSNS via @legitgov
CIA left inert explosives on school bus after exercise https://t.co/f5Ud3RgyZ5 via @legitgov
Cyber-Attack on U.S. Water Facility Committed by Hacker Group With Ties to ISIS https://t.co/6syTDGCrSs via @ConstitutionNat
EXPOSED! FOX releases FAKE Wisconsin Poll Showing Trump 10% below Cruz https://t.co/bLbM9JK3sf via @EUTimesNET
Kelleigh Nelson -- GOP Establishment Steals Trump and Cruz Delegates in Tennessee https://t.co/XZWs7XZTaj via @sharethis
The Global Elite Hate Donald Trump And I Like It - Ted Nugent - https://t.co/f1NZZZ5mn2 via @EUTimesNET
Not April Fools — CIA Admittedly Leaves C-4 Expolsives on School Bus Transporting Kids https://t.co/JobemE0Htl
Infiltrated Nation: Malkin: Nuclear Jihad: The Threats Are Inside Our ... https://t.co/o8Bn18tQup
Cities begin to challenge a bedrock of justice: They’re paying criminals not to kill https://t.co/Wk3sdcNbHc
Hold Your Congressmen Accountable With the Latest Freedom Index https://t.co/Mo6X2j3LLu
Prankster With 'Trump Sign' Assaulted by Violent Bernie Supporters https://t.co/809X3Qzpc8 via @EUTimesNET
April 19: Temple Of Baal In New York Is Going Up Same Day The Blood Sacrifice To The Beast Begins  https://t.co/mz1Xq2voc5
6 Ways A Minimum Wage Hike Costs Jobs https://t.co/q0QOroa5YI
Gun dealers around the U.S. say that more seniors are showing up for shooting lessons https://t.co/yNQvb1lSha
Mississippi: Senate Approves NRA-Backed Permitless Carry Expansion - https://t.co/nXnWbfOEA0 @nraila
New York:  Gun Control Bill Defeated in Senate Committee - https://t.co/xF4xqdsVlE @nraila
Why is Obama's Dangerous Ideology Being Ignored? https://t.co/UOsOaxUhc9
Rise Of The Robots - Can We Trust The New AI? https://t.co/OL4MaYsr3F via @po_st
