"{""follow_request_sent"": false, ""has_extended_profile"": false, ""profile_use_background_image"": true, ""profile_text_color"": ""333333"", ""default_profile_image"": false, ""id"": 705563723532890112, ""profile_background_image_url_https"": null, ""verified"": false, ""imported_to_gensim"": false, ""profile_location"": null, ""profile_image_url_https"": ""https://pbs.twimg.com/profile_images/726834636748263424/A8mP-fdo_normal.jpg"", ""profile_sidebar_fill_color"": ""DDEEF6"", ""entities"": {""description"": {""urls"": []}}, ""followers_count"": 31, ""profile_sidebar_border_color"": ""C0DEED"", ""id_str"": ""705563723532890112"", ""profile_background_color"": ""F5F8FA"", ""listed_count"": 0, ""status"": {""contributors"": null, ""truncated"": false, ""text"": ""RT @TrumpTrain8: Retweet if you are 100 PERCENT voting for Donald Trump"", ""is_quote_status"": false, ""in_reply_to_status_id"": null, ""id"": 729464810815954944, ""favorite_count"": 0, ""source"": ""<a href=\""http://twitter.com/#!/download/ipad\"" rel=\""nofollow\"">Twitter for iPad</a>"", ""retweeted"": false, ""coordinates"": null, ""entities"": {""symbols"": [], ""user_mentions"": [{""id"": 3139898299, ""indices"": [3, 15], ""id_str"": ""3139898299"", ""screen_name"": ""TrumpTrain8"", ""name"": ""TrumpTrain""}], ""hashtags"": [], ""urls"": []}, ""in_reply_to_screen_name"": null, ""in_reply_to_user_id"": null, ""retweet_count"": 12661, ""id_str"": ""729464810815954944"", ""favorited"": false, ""retweeted_status"": {""contributors"": null, ""truncated"": false, ""text"": ""Retweet if you are 100 PERCENT voting for Donald Trump"", ""is_quote_status"": false, ""in_reply_to_status_id"": null, ""id"": 663113220081618944, ""favorite_count"": 6730, ""source"": ""<a href=\""http://twitter.com/download/iphone\"" rel=\""nofollow\"">Twitter for iPhone</a>"", ""retweeted"": false, ""coordinates"": null, ""entities"": {""symbols"": [], ""user_mentions"": [], ""hashtags"": [], ""urls"": []}, ""in_reply_to_screen_name"": null, ""in_reply_to_user_id"": null, ""retweet_count"": 12661, ""id_str"": ""663113220081618944"", ""favorited"": false, ""geo"": null, ""in_reply_to_user_id_str"": null, ""lang"": ""en"", ""created_at"": ""Sat Nov 07 21:58:06 +0000 2015"", ""in_reply_to_status_id_str"": null, ""place"": {""full_name"": ""Alabama, USA"", ""url"": ""https://api.twitter.com/1.1/geo/id/288de3df481163e8.json"", ""country"": ""United States"", ""place_type"": ""admin"", ""bounding_box"": {""type"": ""Polygon"", ""coordinates"": [[[-88.473228, 30.144425], [-84.888247, 30.144425], [-84.888247, 35.008029], [-88.473228, 35.008029]]]}, ""contained_within"": [], ""country_code"": ""US"", ""attributes"": {}, ""id"": ""288de3df481163e8"", ""name"": ""Alabama""}}, ""geo"": null, ""in_reply_to_user_id_str"": null, ""lang"": ""en"", ""created_at"": ""Mon May 09 00:15:38 +0000 2016"", ""in_reply_to_status_id_str"": null, ""place"": null}, ""is_translation_enabled"": false, ""utc_offset"": null, ""statuses_count"": 64, ""description"": """", ""friends_count"": 63, ""location"": """", ""profile_link_color"": ""2B7BB9"", ""profile_image_url"": ""http://pbs.twimg.com/profile_images/726834636748263424/A8mP-fdo_normal.jpg"", ""following"": false, ""geo_enabled"": false, ""profile_background_image_url"": null, ""name"": ""Helen Butcher"", ""lang"": ""en"", ""profile_background_tile"": false, ""favourites_count"": 436, ""screen_name"": ""HelenbButcher"", ""notifications"": false, ""url"": null, ""created_at"": ""Fri Mar 04 01:21:15 +0000 2016"", ""contributors_enabled"": false, ""time_zone"": null, ""protected"": false, ""default_profile"": true, ""is_translator"": false}"
People are so cruel  https://t.co/f2f6Ux8x57
@TeamTrumpAZ she wold be the best one for him to pick she is very smart and she tells the truth love watching her.
"She would be great , https://t.co/Cu6WfWVdSF"
No https://t.co/QMJ1qTpQG4
@oreillyfactor we are glad Trump won don't trust the Washington Politicians.
@seanhannity @realDonaldTrump @we are angry they should stand behind Trump.
They should stand behind him  https://t.co/IowfyHi6gZ
Amen  https://t.co/XAIp985ecu
Is Kasich stupid he has just won one state how could he win. https://t.co/sWsEaqWUdR
"You are welcome in WV,,,, https://t.co/1NnH7YLgZm"
Amen https://t.co/S6U16Lq8sU
"Yeah for Trump,Lying Ted and pancake Kasich needs to drop out   https://t.co/kfLlGbDryN"
We want Trump for President we are sick of the Washington Politicians WV doesn't want Hillary
Good luck hope you win  https://t.co/0VJbThM2PD
They have killed WV by getting rid of most of the coal jobs. https://t.co/7WFNnWH1HD
Don't believe nothing she saids she done and said she was going to put miners out of a job  https://t.co/RDHpZ0oHs8
"They don't care about WV, https://t.co/lHQqCh4YiV"
How come Hillary said she would get rid of coal we don't need that kind of help  https://t.co/M6XxiazjUa
"Want to thank God for allowing me to go to Church today,we all need to pray for our Country."
"Glad that Logan County doesn't want Hillary to come to Logan,we are proud of our county  https://t.co/yJ8nvXlN9R"
"Chris Wallace tried every trick question he could think of on you,but it back fired on him. https://t.co/Obzhqqy2LX"
Amen to that https://t.co/KZou9a96Ph
The ones who say they hate America should leave nobody is making them stay who needs them https://t.co/WxynQzuOSv
I think it's time for pancake Kasich and Lying Ted to drop out. https://t.co/yS4wtwPh57
Ted Cruz needs To talk to a Therapist. https://t.co/dlegRqhrgu
"Can't wait to vote for you in West Virginia both me and my husband are for you,Go Trump  https://t.co/oW2NnwvNQM"
@realDonaldTrump congratulations keep on winning
Congratulations Trump
@foxandfriends great news
Yes we are feed up with them all https://t.co/yS4wtwPh57
They both need to drop out  https://t.co/OiErOBNEYF
@realDonaldTrump want do them any good a person don't do wrong and get away with it ?
The one with the most should win hope Trump wins https://t.co/j3YDt1wCwn
Congratulations for the win in New York. https://t.co/I1QCOyVGK8
@realDonaldTrump hope you win all remaining states we need a new beginning
They are all sneaky give it to them show them they can't get by with that  https://t.co/eypAf97Yvb
@greta yes
@greta @MittRomney @tedcruz @realDonaldTrump @FoxNews no it will not hurt him
@realDonaldTrump @megynkelly we don't allow her on our tv or Bret Baier they both make us sick.
@oreillyfactor we watch you all time you have been fair to everyone on your show keep up the good work.
It's about time Fox started being fair again. https://t.co/R8R3FuUx7F
Great congratulations keep on winning. https://t.co/B8NyWWY9Yv
@TeamCavuto Romney is a too time looser who could he help
@foxandfriends we have turn against Romney he had his chance and blew it.
Yes Trump was right for not going
Yes https://t.co/HcaKDjeUyq
