"{""follow_request_sent"": false, ""has_extended_profile"": false, ""profile_use_background_image"": true, ""profile_text_color"": ""333333"", ""default_profile_image"": false, ""id"": 282848539, ""profile_background_image_url_https"": ""https://abs.twimg.com/images/themes/theme1/bg.png"", ""verified"": false, ""imported_to_gensim"": false, ""profile_location"": null, ""profile_image_url_https"": ""https://pbs.twimg.com/profile_images/713903705809154049/41KAmopB_normal.jpg"", ""profile_sidebar_fill_color"": ""DDEEF6"", ""entities"": {""description"": {""urls"": []}}, ""followers_count"": 518, ""profile_sidebar_border_color"": ""C0DEED"", ""id_str"": ""282848539"", ""profile_background_color"": ""C0DEED"", ""listed_count"": 48, ""status"": {""contributors"": null, ""truncated"": false, ""text"": ""RT @LynnePatton: I hope the #Trump family is as proud of this video, as I was to make it. Thank you @DefendingtheUSA @realDonaldTrump https\u2026"", ""is_quote_status"": false, ""in_reply_to_status_id"": null, ""id"": 727280723221204994, ""favorite_count"": 0, ""source"": ""<a href=\""http://twitter.com\"" rel=\""nofollow\"">Twitter Web Client</a>"", ""retweeted"": false, ""coordinates"": null, ""entities"": {""symbols"": [], ""user_mentions"": [{""id"": 25413556, ""indices"": [3, 15], ""id_str"": ""25413556"", ""screen_name"": ""LynnePatton"", ""name"": ""Lynne Patton""}, {""id"": 63228779, ""indices"": [100, 116], ""id_str"": ""63228779"", ""screen_name"": ""DefendingtheUSA"", ""name"": ""The Majority Awakens""}, {""id"": 25073877, ""indices"": [117, 133], ""id_str"": ""25073877"", ""screen_name"": ""realDonaldTrump"", ""name"": ""Donald J. Trump""}], ""hashtags"": [{""indices"": [28, 34], ""text"": ""Trump""}], ""urls"": [{""url"": ""https://t.co/PJrsXNpu3n"", ""indices"": [139, 140], ""expanded_url"": ""https://www.youtube.com/watch?v=lxaKUo5naoY&feature=share"", ""display_url"": ""youtube.com/watch?v=lxaKUo\u2026""}]}, ""in_reply_to_screen_name"": null, ""in_reply_to_user_id"": null, ""retweet_count"": 454, ""id_str"": ""727280723221204994"", ""favorited"": false, ""retweeted_status"": {""contributors"": null, ""truncated"": false, ""text"": ""I hope the #Trump family is as proud of this video, as I was to make it. Thank you @DefendingtheUSA @realDonaldTrump https://t.co/PJrsXNpu3n"", ""is_quote_status"": false, ""in_reply_to_status_id"": null, ""id"": 727244181341626368, ""favorite_count"": 649, ""source"": ""<a href=\""http://twitter.com/download/iphone\"" rel=\""nofollow\"">Twitter for iPhone</a>"", ""retweeted"": false, ""coordinates"": null, ""entities"": {""symbols"": [], ""user_mentions"": [{""id"": 63228779, ""indices"": [83, 99], ""id_str"": ""63228779"", ""screen_name"": ""DefendingtheUSA"", ""name"": ""The Majority Awakens""}, {""id"": 25073877, ""indices"": [100, 116], ""id_str"": ""25073877"", ""screen_name"": ""realDonaldTrump"", ""name"": ""Donald J. Trump""}], ""hashtags"": [{""indices"": [11, 17], ""text"": ""Trump""}], ""urls"": [{""url"": ""https://t.co/PJrsXNpu3n"", ""indices"": [117, 140], ""expanded_url"": ""https://www.youtube.com/watch?v=lxaKUo5naoY&feature=share"", ""display_url"": ""youtube.com/watch?v=lxaKUo\u2026""}]}, ""in_reply_to_screen_name"": null, ""in_reply_to_user_id"": null, ""retweet_count"": 454, ""id_str"": ""727244181341626368"", ""favorited"": false, ""geo"": null, ""in_reply_to_user_id_str"": null, ""possibly_sensitive"": false, ""lang"": ""en"", ""created_at"": ""Mon May 02 21:11:39 +0000 2016"", ""in_reply_to_status_id_str"": null, ""place"": null}, ""geo"": null, ""in_reply_to_user_id_str"": null, ""possibly_sensitive"": false, ""lang"": ""en"", ""created_at"": ""Mon May 02 23:36:51 +0000 2016"", ""in_reply_to_status_id_str"": null, ""place"": null}, ""is_translation_enabled"": false, ""utc_offset"": null, ""statuses_count"": 10558, ""description"": """", ""friends_count"": 487, ""location"": ""dublin, oh"", ""profile_link_color"": ""0084B4"", ""profile_image_url"": ""http://pbs.twimg.com/profile_images/713903705809154049/41KAmopB_normal.jpg"", ""following"": false, ""geo_enabled"": true, ""profile_background_image_url"": ""http://abs.twimg.com/images/themes/theme1/bg.png"", ""name"": ""jenny guo"", ""lang"": ""en"", ""profile_background_tile"": false, ""favourites_count"": 7507, ""screen_name"": ""jennysuolang"", ""notifications"": false, ""url"": null, ""created_at"": ""Sat Apr 16 02:08:23 +0000 2011"", ""contributors_enabled"": false, ""time_zone"": null, ""protected"": false, ""default_profile"": true, ""is_translator"": false}"
Do those people kiss their mothers w those potty mouths? The female ass was as disgusting as their actions.#4Trump https://t.co/XGQKf41GzM
I wonder why he didn't has a living will. He was in critical situation in hospital should be required and asked.  https://t.co/7AYNxs1Bvo
"Victory sign is Trump sigh! Mr.Williamson ""The Hammer"" played for the Oakland Raiders, a funny great actor! ThankU.  https://t.co/IQAlpzPprv"
Do those people kiss their mothers w those potty mouths? The female ass was as disgusting as their actions.#4Trump https://t.co/1cnE5IE5h4
"So boring at LyinTed house dinner. ""Ted is a mess and Ted is a waste."" Dog leaked off peanut butter fr Ted nose.  https://t.co/v17QH2Ilop"
OMG. Zodiac Killer is the only word I could remembered from that stupid WH dinner jokes ( by larry). LyinTedZodiacKi https://t.co/5fg1BDL6V9
Do those people kiss their mothers w those potty mouths? The female ass was as disgusting as their actions.#4Trump https://t.co/XGQKf4jhYm
His parents took the picture not the kid. We will educate them and hope Mr.Trump will clean the mess soon. #TrumpWin https://t.co/1fieTHkcuI
That's how Jake Tapper promoting Cruz to give him enough time making up BS. Just bc Carly became CEO doesn't mean VP https://t.co/RnYby4MMCN
Without the CP cards he wouldn't be in the 2nd turn.  https://t.co/UKl32kXUAj
Feel so good to look at the good numbers! ALL THE WAY PASS 1237 https://t.co/98cYZPIVeb
"Nobody knows this guy, the jokes were poor taste. He even used N word. The END OF OBAMA. https://t.co/tCDNCO1IGd"
"I know, stand behind Georgeeeee and pretend to give him a massage or back rub. lol. Happy Sunday.  https://t.co/mLFObDdXvX"
"This is America! We heard gentleman is sobering,""We love our country."" What about U?Let's work together for the flag https://t.co/wEVPvfF07y"
"I love your voice, deep n powerful. Reminds me the piano singer at NewYork NewYork hotel in Vagus. The good old days https://t.co/mSVAnlaPAj"
"@WDFx2EU @KarenVerreault @CrashnDaPlane Watched the video for 2times. The gentleman name is Christopher, we will not forget n Trump will win"
"Marc, stop racial division. We respect you as always, but please stop labeling people.  https://t.co/ONNeBUoR2R"
He mentioned Burn and made fun of him which is totally ok w me. I am ALL FOR Mr.@realDonaldTrump #AlwaysTrump https://t.co/3J8WzxXrms
This is sad and shame. Obama spent money and time to laugh at Trump tonight with poor jokes. I can't stand that face https://t.co/kWcQ0gf1Eu
@VOTE4TRUMP_2016 @realDonaldTrump @WDFx2EU Is it Indiana winner-take-all? We need win the votes n give them no chance for 2nd ballot.
"@VanJones68 @KatrinaPierson Nice picure! Van, Bfair to make comment on @realDonaldTrump We know u R not #neverTrump, don't like DT is ok"
This is sad and shame. Obama spent money and time to laugh at Trump tonight with poor jokes. I can't stand that face https://t.co/sQ2PTDUW4L
"@Coorsbrew1 check this one, the number is better.  https://t.co/I13t4Eg458"
It was not entertaining until I heard Cruz's new nickname Zodiac Killer.This guy hit everybody including N word.#smh https://t.co/cCKEqicipV
"Yeah, why?Why are so many Zodiac Killer's people? How can we explain big crowd rallies? Am I blind or poor in math? https://t.co/T2tML2LLCz"
@Reince Is this what you saying some people don't understand the system? The governor included? Is it true?  https://t.co/J0YGoIJjJK
"I only remember one word fr his shooting rage ""jokes"": ZODIAC KILLER. Yup, Lyin'Ted got new nickname in May. #4Trump https://t.co/2h1cXfIkAu"
"I only remember one word fr his shooting rage ""jokes"": ZODIAC KILLER. Yup, Lyin'Ted got new nickname in May. #4Trump https://t.co/X4MMVIYrQm"
"@CNN Nobody laughed at his stupid jokes, entire speech is wasting money n time 2embarrass American ppl to make us feel guilty to elected him"
"@CNN #Sara keeps insulting Mr.Trump, saying that just pick up his cabinet fr #MikeTyson ppl.  She is bias to the coming victory 4Trump."
"@CNN @scottienhughes @KatrinaPierson BOTH SUPER HOT TONIGHT. @OMAROSA TO OUR TRUMP GIRLS, HAVE FUN NIGHT. #TrumpGirls"
"Wow, @KatrinaPierson gorgeous today on the red carpet! You are really heading to WH. HAVE FUN TONIGHT. #MAGA.  https://t.co/CfrdwYR2c8"
"@kayleighmcenany You look very pretty tonight. #Mark is smart guy covers too much 4Obama, #Buck became anti-Trump. Your elegant is beyond."
"1. Mr.Trump will get 1237
2. GOPe have to keep the pledge 
3. George Will whoever he is GO TO HELL.  https://t.co/2ItHjTzwoC"
