"{""follow_request_sent"": false, ""has_extended_profile"": false, ""profile_use_background_image"": true, ""profile_text_color"": ""0C3E53"", ""default_profile_image"": false, ""id"": 19887029, ""profile_background_image_url_https"": ""https://abs.twimg.com/images/themes/theme12/bg.gif"", ""verified"": false, ""imported_to_gensim"": false, ""profile_location"": {""full_name"": ""Colorado, USA"", ""url"": ""https://api.twitter.com/1.1/geo/id/e21c8e4914eef2b3.json"", ""country"": """", ""place_type"": ""unknown"", ""bounding_box"": null, ""contained_within"": [], ""country_code"": """", ""attributes"": {}, ""id"": ""e21c8e4914eef2b3"", ""name"": ""Colorado, USA""}, ""profile_image_url_https"": ""https://pbs.twimg.com/profile_images/709398489034174464/1g_4osit_normal.jpg"", ""profile_sidebar_fill_color"": ""FFF7CC"", ""entities"": {""url"": {""urls"": [{""url"": ""https://t.co/7315jUDfMk"", ""indices"": [0, 23], ""expanded_url"": ""http://dealsbyjess.blogspot.com/"", ""display_url"": ""dealsbyjess.blogspot.com""}]}, ""description"": {""urls"": [{""url"": ""https://t.co/Tem2ys7fbR"", ""indices"": [23, 46], ""expanded_url"": ""http://jesskazen.tumblr.com"", ""display_url"": ""jesskazen.tumblr.com""}]}}, ""followers_count"": 340, ""profile_sidebar_border_color"": ""F2E195"", ""id_str"": ""19887029"", ""profile_background_color"": ""BADFCD"", ""listed_count"": 11, ""status"": {""contributors"": null, ""truncated"": false, ""text"": ""Women Experience More Pain, Due to Both Biology and Bias - kind of puts the nonsense notion of equality on its head https://t.co/jPuORA5f6Z"", ""is_quote_status"": false, ""in_reply_to_status_id"": null, ""id"": 725744233005481984, ""favorite_count"": 0, ""source"": ""<a href=\""http://twitter.com\"" rel=\""nofollow\"">Twitter Web Client</a>"", ""retweeted"": false, ""coordinates"": null, ""entities"": {""symbols"": [], ""user_mentions"": [], ""hashtags"": [], ""urls"": [{""url"": ""https://t.co/jPuORA5f6Z"", ""indices"": [116, 139], ""expanded_url"": ""http://bit.ly/1qYDau6"", ""display_url"": ""bit.ly/1qYDau6""}]}, ""in_reply_to_screen_name"": null, ""in_reply_to_user_id"": null, ""retweet_count"": 0, ""id_str"": ""725744233005481984"", ""favorited"": false, ""geo"": null, ""in_reply_to_user_id_str"": null, ""possibly_sensitive"": false, ""lang"": ""en"", ""created_at"": ""Thu Apr 28 17:51:23 +0000 2016"", ""in_reply_to_status_id_str"": null, ""place"": null}, ""is_translation_enabled"": false, ""utc_offset"": -21600, ""statuses_count"": 205, ""description"": ""Instagram:@GlenDanzig\n https://t.co/Tem2ys7fbR"", ""friends_count"": 568, ""location"": ""Colorado, USA"", ""profile_link_color"": ""FF0000"", ""profile_image_url"": ""http://pbs.twimg.com/profile_images/709398489034174464/1g_4osit_normal.jpg"", ""following"": false, ""geo_enabled"": true, ""profile_banner_url"": ""https://pbs.twimg.com/profile_banners/19887029/1396556931"", ""profile_background_image_url"": ""http://abs.twimg.com/images/themes/theme12/bg.gif"", ""name"": ""Jess Kazen"", ""lang"": ""en"", ""profile_background_tile"": false, ""favourites_count"": 2550, ""screen_name"": ""jesskazen"", ""notifications"": false, ""url"": ""https://t.co/7315jUDfMk"", ""created_at"": ""Mon Feb 02 01:23:23 +0000 2009"", ""contributors_enabled"": false, ""time_zone"": ""Mountain Time (US & Canada)"", ""protected"": false, ""default_profile"": false, ""is_translator"": false}"
"Women Experience More Pain, Due to Both Biology and Bias - kind of puts the nonsense notion of equality on its head https://t.co/jPuORA5f6Z"
Didn't they just let one of these degenerates go or something? https://t.co/irHBc54P1h
#lyingTed can't even tell the truth about basketball hoops being called hoops and not rings #basketballring
New York man punched in the face because he 'looks exactly like Shia LaBeouf' https://t.co/LmZBYhh7C0 via @EW
"Hanging out in a group video chat room, come say hey. https://t.co/TttP7Viofh #tinychat"
"https://t.co/1DuY7RmXzw this guy is cool, saw him in a Trump video. Good for him."
https://t.co/a5rjcHXdVx
"Ted Cruz talks about Carrier, bringing jobs back and then announces that Carly Fiorina who destroyed HP as the CEO, will be his choice as VP"
"Hanging out in a group video chat room, come say hey. https://t.co/TttP7Viofh #tinychat"
Come videochat with me at https://t.co/TttP7Viofh #whitepowder666 via @tinychat
"Hanging out in a group video chat room, come say hey. https://t.co/TttP7Viofh #tinychat"
@TrumpTrain8 @tedcruz lolol Ted Cruz is to the presidency what Lance Bass was to space travel
This is very cool for Serbia https://t.co/lUsWLWhBmM
Don't believe #lyingTed https://t.co/4HIYPpXHbi
#lyingted and Kasich want to play games with each other in bathrooms while @realDonaldTrump is actually working to fix the American economy.
"Hanging out in a group video chat room, come say hey. https://t.co/TttP7Viofh #tinychat"
#Trump2016 The Secret Shame of Middle-Class Americans Living Paycheck to Paycheck https://t.co/FighM6aOl5
@Tjsotomayor they are tearing her up in the comments https://t.co/qsLxU7T1k9
"@realDonaldTrump is actually a great guy, and doesn't pander to any special interests. He is the only candidate with integrity."
"@PIX11News I don't have kids and I keep mine high up on a shelf because it's a caustic cleaning agent, how could a parent not do the same?"
@realDonaldTrump  https://t.co/EUpaXm3ksP
@RealBenCarson A great biblical quote for @realDonaldTrump to find solace in right now while facing these snakes that wish to do him harm.
I am not surprised by their deplorable behavior https://t.co/iPz7h9xbEq
they make me sick https://t.co/noUkDCDKZi
Ohio 'Execution Style' Murders Linked to Marijuana Grow https://t.co/jMMzDtNuH9
"Hanging out in a group video chat room, come say hey. https://t.co/TttP7Viofh #tinychat"
"@troylf That is good to hear, it's very scary"
@PuigBobby I have some shit gene that predisposes me to them and apparently intermittent fasting makes it worse lel
I'm back. Just found out I need my gallbladder removed. https://t.co/iQDsMBOKL1
"Join me at https://t.co/TttP7V0MQH
 There are currently 4 people person here with 3 live on camera.
 Sent by Tinychat for Android"
"Can't even keep water down. Best diet of my life, lost 5 lbs in 2 days. https://t.co/9gRvDd3pk6"
Krekorian Calls on L.A. to Cancel Wall Street Journal Subscriptions for Printing Ads Denying the Armenian Genocide https://t.co/rooC4phTO8
"people who do dumb shit die earlier, who knew?! https://t.co/5eTg8hIB18"
Bayer Sold HIV-Risky Meds https://t.co/h0aZaSSXwU
literally dying https://t.co/zwpdZYx21x
"Wow, this is putrid."
"This is deplorable, Check out ""Tricked"" on Netflix
https://t.co/WphES0aUad"
"Hanging out in a group video chat room, come say hey. https://t.co/TttP7Viofh #tinychat"
"@Target can't get any resolution on the phone, why are you mailing things to my old post office?"
"on the phone with @target.com customer service, trying to fix this ridiculous shipping issue. Been hung up on once. Let's see how this goes."
The DEA Just Approved a Way to Smoke Marijuana Legally for the First Time via @FortuneMagazine https://t.co/pXa1mG0DVN
Why Immigration Matters on Earth Day https://t.co/hgCwmeFJIt
"Hanging out in a group video chat room, come say hey. https://t.co/TttP7Viofh #tinychat"
"breakfast, and lunch of champions https://t.co/FeUAitOeel"
"@TrumpTrain8 yeah in a fake sort of way that panders to the most people as possible, unlike @realDonaldTrump, I get what you're saying."
"@TrumpTrain8 since day one she had like 3 opponents, easy for her to say."
I am willing to make a bet that once @realDonaldTrump becomes president and our economy recovers #suicide rates will drop DRAMATICALLY
@Tjsotomayor watch the video!!!! they talk about HAIR ENVY like it somehow started the fight #smh https://t.co/m0FrYXst4K
16-year-old girl beaten to death in high school bathroom in Delaware https://t.co/hMYk9OIC2Q via @fox13now
pimps and I https://t.co/cPAuQbBrff
"@Slate she's overly peppy and fake, I can't stand that show."
"Hanging out in a group video chat room, come say hey. https://t.co/TttP7Viofh #tinychat"
pear goat cheese walnut spinach salad https://t.co/GRdml5ZXZi
strawberry cake https://t.co/OeBD51Tw5v
Michigan woman dies after having 16 teeth removed at dentist https://t.co/HIk0erl86v
"""too drunk to remember what happened"" Seattle nurse dismembered in her home by man she was dating https://t.co/yM9PDBqxVM"
"Ariz. cops find girl, 3, bound and allegedly offered for sex https://t.co/HUJPWpUYgP"
Prince found dead at his Minnesota studio at age 57 https://t.co/tsepXtaxLV
"@tinychat videos not working properly for 2 days, stuck on load screen when you click the youtube button"
"Hanging out in a group video chat room, come say hey. https://t.co/TttP7Viofh #tinychat"
Check out the snapshot I just took in https://t.co/TttP7V0MQH. https://t.co/MgcEVW7kbV
"Hanging out in a group video chat room, come say hey. https://t.co/TttP7Viofh #tinychat"
"Hanging out in a group video chat room, come say hey. https://t.co/TttP7V0MQH #tinychat"
The Silicon Valley of marijuana - https://t.co/PdYqsAYzTV @highcountrynews
#potbrownies #420 https://t.co/7ECCF8e6kH
Police Release New Information in Midlothian Murder Investigation https://t.co/5ZWKUnAAyB via @nbcdfw
"Hanging out in a group video chat room, come say hey. https://t.co/TttP7Viofh #tinychat"
Can you beat my challenge? https://t.co/Z6KKlMcqfT #alphabear https://t.co/YXrQzK0j1F
#uwotm8 https://t.co/59GmCibOyM
"Hanging out in a group video chat room, come say hey. https://t.co/TttP7Viofh #tinychat"
#catsofinstagram https://t.co/T8anBgY3q9
"Hanging out in a group video chat room, come say hey. https://t.co/TttP7Viofh #tinychat"
"Hanging out in a group video chat room, come say hey. https://t.co/TttP7Viofh #tinychat"
Hepatitis B Among Refugees May Become ‘Public Health Concern’ In Germany https://t.co/1sz4PM1EiP via @medicaldaily
"Hanging out in a group video chat room, come say hey. https://t.co/TttP7Viofh #tinychat"
Check out Purlisse Lip Comfort Full Size New In Box #Purlisse https://t.co/5aQQAx8xh5 via @eBay
Check out Blinc Black Lash Primer Jet Black Volume .16 fl oz Full Size Brand New Sealed #blinc https://t.co/4MxaRr4lch via @eBay
Check out New Sealed The Beauty Crop PBJ Smoothie Stick Lip Crayon #TheBeautyCrop https://t.co/MaJWBhqhjr via @eBay
"@lake_hall @kennyhotz @Spenny I compete against myself in my own version of the ""Who Can Smoke More Weed?"" episode every day as an homage."
#trumpny #trump2016 #MAGA  https://t.co/b4GzY2tx8U
@Slate LOL for what reason? HE IS BLOWING #LYINGTED OUT OF THE WATER
I once hit a hooker with an aluminum baseball bat across the sternum
"Hanging out in a group video chat room, come say hey. https://t.co/TttP7Viofh #tinychat"
@kevinolearytv @LoriGreiner @QVC OMG I can't wait
Using a Dyson hand dryer is like setting off a viral bomb in a bathroom https://t.co/JDphscMRON
@Hardware360Wrld @dkocis and then they spread 100% of those viruses to adults
The Post endorses Donald Trump https://t.co/Obb80O6LDz via @nypost
@JohnStossel @FoxBusiness so we're stuck with Hillary no matter what?
@Spenny I saw you kiss @kennyhotz from that window
The decline of the serial killer. https://t.co/yhmSZqQ4Tq via @slate
"@Spenny I was there, in Amsterdam. I saw everything."
.@realDonaldTrump: Let me ask America a question https://t.co/8jMXLWw4Re via @WSJ #MAGA #Trump2016 #TrumpTrain #neverHillary #neverCruz
@Spenny why did he get stretched by a dude and you're jealous?
@RichardWeaving what a slimeball
@lenadunham @AmericaFerrera @Medium #puke #NeverHillary
"Hanging out in a group video chat room, come say hey. https://t.co/TttP7Viofh #tinychat"
"How is shooting a man's wife in the legs twice before you shoot him 7 times in the back, and once in his side self defense? #TanzanikeRuffin"
Why would you shoot a woman in each leg before murdering her husband? #WillSmith https://t.co/tx5hwGsBUV
Lawyer for Will Smith's family reveals timeline of night of his death https://t.co/SuepUrKvf0 via @MailOnline
"https://t.co/fRzmZqvquX Born in Canada to an American mother and a Cuban father - yet somehow, he's a natural born citizen? #neverted"
"Ted Cruz's children are rude. Great behavior from Barron who is raised by Melania+Don, not absentee lawyer parents and nannies.#NeverCruz"
"Just heard the @TODAYshow say @realDonaldTrump is trying to ""catch up to Ted Cruz"". Odd since #Trump HAS MORE DELEGATES THAN #LyingTed"
@chuckwoolery @BreitbartNews it would hilarity if someone tried to force an armed American off of a street or pulled any of this.
"@chuckwoolery honestly it's probably one of the only things they can do, that and beef up the former Yugoslavia's defenses"
#RobertDeNiro Autism has increased because any non verbal person with MR is diagnosed with Autism now #fuckpolio #Ilovevaccines
@Shane106320 @realDonaldTrump ty so much
@chris_moloney27 and many illegal aliens have committed murder and rape against native born citizens and fled to their original home nation
@chris_moloney27 or don't come at all
You're cracked if you think that you look younger or better than them. Can't believe 2 people liked this garbage. https://t.co/GA1HtBYikp
@realDonaldTrump tell me where I have to be at and I will go there
"Hanging out in a group video chat room, come say hey. https://t.co/TttP7Viofh #tinychat"
I added a video to a @YouTube playlist https://t.co/4NPRWbc4rI 12 Steps of AA with Father Martin YouTube WMV V8
