"{""follow_request_sent"": false, ""has_extended_profile"": false, ""profile_use_background_image"": true, ""profile_text_color"": ""333333"", ""default_profile_image"": false, ""id"": 701511379052843008, ""profile_background_image_url_https"": null, ""verified"": false, ""imported_to_gensim"": false, ""profile_location"": {""full_name"": ""South Carolina, USA"", ""url"": ""https://api.twitter.com/1.1/geo/id/6057f1e35bcc6c20.json"", ""country"": """", ""place_type"": ""unknown"", ""bounding_box"": null, ""contained_within"": [], ""country_code"": """", ""attributes"": {}, ""id"": ""6057f1e35bcc6c20"", ""name"": ""South Carolina, USA""}, ""profile_image_url_https"": ""https://pbs.twimg.com/profile_images/701520816396222466/C5hNVN4q_normal.jpg"", ""profile_sidebar_fill_color"": ""DDEEF6"", ""entities"": {""description"": {""urls"": []}}, ""followers_count"": 175, ""profile_sidebar_border_color"": ""C0DEED"", ""id_str"": ""701511379052843008"", ""profile_background_color"": ""F5F8FA"", ""listed_count"": 10, ""status"": {""contributors"": null, ""truncated"": false, ""text"": ""Any GOP who trash talks Trump the voters' choice is making a big mistake. We will vote you out @Reince @MattMooreSC  https://t.co/Vfk4QLus6m"", ""is_quote_status"": true, ""in_reply_to_status_id"": null, ""id"": 729441145374265345, ""favorite_count"": 1, ""source"": ""<a href=\""http://twitter.com/#!/download/ipad\"" rel=\""nofollow\"">Twitter for iPad</a>"", ""quoted_status_id"": 728732115391504384, ""retweeted"": false, ""coordinates"": null, ""entities"": {""symbols"": [], ""user_mentions"": [{""id"": 20733972, ""indices"": [95, 102], ""id_str"": ""20733972"", ""screen_name"": ""Reince"", ""name"": ""Reince Priebus""}, {""id"": 29722241, ""indices"": [103, 115], ""id_str"": ""29722241"", ""screen_name"": ""MattMooreSC"", ""name"": ""Matt Moore""}], ""hashtags"": [], ""urls"": [{""url"": ""https://t.co/Vfk4QLus6m"", ""indices"": [117, 140], ""expanded_url"": ""https://twitter.com/thedonaldnews/status/728732115391504384"", ""display_url"": ""twitter.com/thedonaldnews/\u2026""}]}, ""in_reply_to_screen_name"": null, ""in_reply_to_user_id"": null, ""retweet_count"": 1, ""id_str"": ""729441145374265345"", ""favorited"": false, ""geo"": null, ""in_reply_to_user_id_str"": null, ""possibly_sensitive"": false, ""lang"": ""en"", ""created_at"": ""Sun May 08 22:41:36 +0000 2016"", ""quoted_status_id_str"": ""728732115391504384"", ""in_reply_to_status_id_str"": null, ""place"": null}, ""is_translation_enabled"": false, ""utc_offset"": null, ""statuses_count"": 2355, ""description"": """", ""friends_count"": 66, ""location"": ""South Carolina, USA"", ""profile_link_color"": ""2B7BB9"", ""profile_image_url"": ""http://pbs.twimg.com/profile_images/701520816396222466/C5hNVN4q_normal.jpg"", ""following"": false, ""geo_enabled"": false, ""profile_background_image_url"": null, ""name"": ""Peach Brown"", ""lang"": ""en"", ""profile_background_tile"": false, ""favourites_count"": 2031, ""screen_name"": ""Jnetab"", ""notifications"": false, ""url"": null, ""created_at"": ""Sun Feb 21 20:58:41 +0000 2016"", ""contributors_enabled"": false, ""time_zone"": null, ""protected"": false, ""default_profile"": true, ""is_translator"": false}"
Any GOP who trash talks Trump the voters' choice is making a big mistake. We will vote you out @Reince @MattMooreSC  https://t.co/Vfk4QLus6m
Please read. This poor woman speaks the truth about Hillary @DiamondandSilk @AnnCoulter  @realDonaldTrump @OMAROSA  https://t.co/9AMc9D3pJA
We Will vote them out of office Voters in SC picked Trump by a big margin. GOP belongs to voters not Graham &amp; Haley https://t.co/6vJFRlp1mk
West Virginia and Nebraska we are counting on you to give Trump a victory and help him get 1237 delegates  https://t.co/MG2VsvrZgy
"@MattMooreSC  Trump won in SC. Tell Graham, Haley &amp; any others who are slamming Trump to be quiet. SC voters are furious @DiamondandSilk"
Another corrupt Clinton. She is also part of the Clinton Foundation fiasco https://t.co/ye7ESI0wuy
@Trumpforpotus16 @dovorah001   Thought that was Lindsey Graham's title
A lot of politicians who happily took Trump's money have been totally ungrateful. Voters will remember who they are  https://t.co/kls1xJSxRs
"Hillary sometimes she acts like she is in early stage dementia. Laughs at inappropriate times etc.  Vote Trump,@DiamondandSilk @seanhannity"
So glad to see @SarahPalinUSA is supporting Paul Ryan's opponent. 1 by 1 we will get rid of politicians that disrespect voters @AnnCoulter
"Ok Priebus time to tell Jeb!, Mitt,Sen Graham &amp; Sen McCain to shut up. Hillary is using their comments as talking points. @Reince @GOP"
Another Bill Clinton paramour exposes ‘enabler’ Hillary https://t.co/W8DYB1SNnl via @worldnetdaily. Yet another of Bill's women speaks out
Jindal: Republicans Who Won't Support Trump Only Help Hillary Clinton https://t.co/yUpZnLJ5Gm. Mondale gets it
Hillary takes dirty money but tells voters she is the pro woman candidate. She didn't look out for Bill's victims https://t.co/AOQLTWJ1Yi
"Paul Ryan should be removed as RNC chairman @ convention since he does not endorse Trump, #1 choice of voters @Reince @DiamondandSilk @GOP"
What can we do to boot this traitor Ryan now   I am ready for Ryan to leave @Reince  https://t.co/GHoLlpdwOd
Ryan needs to go. He is dangerous  https://t.co/upliYg1euR
Sure hope we don't bring them here at our tax payers expense https://t.co/gu7vaXyfgZ
If Hillary didn't have Super Delegates she would lose. GOP could not stop voters  We love Trump https://t.co/1DVjsl25Mo
The  women attacked by The Clintons are not being treated fairly by Media @FoxNews @ABC @NBCNews @megynkelly  https://t.co/aQqXHz0lsF
Elizabeth Warren is a total fraud. If she got jobs based on being a Native American others who were denied the jobs should sue @AnnCoulter
I live in SC &amp; will vote out Lindsey Graham at the 1st opportunity.   Bushes are finished &amp; will never be reelected https://t.co/7xwfdjTukw
@dcexaminer @AnnCoulter  If as Kerry says there will be a border less world why do we have to pay taxes
What is wrong with these people. I like borders https://t.co/ahQbvyrrwk
The party is the will of the people &amp; not a handful of GOP despots. We take it back &amp; we Vote Trump https://t.co/A0ApISiqtw
Bill Sex Accusers Back Up Trump Remarks on Hillary The ‘Enabler’ - Breitbart https://t.co/a5HPANJafd via @BreitbartNews.  @DiamondandSilk
Totally agree. We will voteRyan out ASAP.   GOP belongs to the voters &amp; not the Career politicians  https://t.co/lzrfrblbwX
Nikki Haley's Next Move - FITSNews https://t.co/HizE95Sb1V via @po_st
And it puts us all at risk. Why have visas if not enforced? https://t.co/RJk1GksEV1
GOP should understand that no candidate will ever sign a pledge again. Worthless piece of paper @Reince @AnnCoulter  https://t.co/7xwfdjTukw
We are united against Paul Ryan. He caved in to the DEMS &amp; is totally obnoxious to Trump  https://t.co/M63Gd3nfn8
And this is exactly why Voters chose Trump over the other 16 candidates   Vote Trump &amp; put America 1st @seanhannity  https://t.co/BdC9YPckwQ
Hillary cursed &amp; belittled her Secret Service detail while 1st lady. She cursed State Troopers while a Governors wife. @DiamondandSilk
This is the mark of a good leader. Trump always thanks those around him.   I will vote Trump https://t.co/OHK0pO5FTD
Wisconsin we are counting on you to vote him out. Then he won't be Speaker of the House when Trump wins @AnnCoulter  https://t.co/t0kLWOxPJF
@TrumpForVets @tedcruz @JohnKasich @vachilly64 @Gofigureliberty @realDonaldTrump @alyssastew77 @suzost   Watch out for tricks by GOP
Trump puts America first. Finally a candidate that cares about our country &amp; its citizens. Vote Trump @OMAROSA  https://t.co/ajKaUUmFXf
I just don't read that trash. No point in reading their biased rhetoric &amp; downright lies https://t.co/EEghGbKY9Q
Totally agree. He probably gets $$$ from the drug cartels much like our politicians get $$ from Soros &amp; PACS https://t.co/2wMgVTIrqT
Nebraska &amp; WV get out &amp; Vote Trump on Tuesday  https://t.co/pQxUEue7BC
The pledge was only suppose to hold Trump accountable. Well he won &amp; Voters are holding the others accountable https://t.co/w8Bho9WkUI
Obama &amp; Hillary think the rules apply to everyone but themselves https://t.co/F5l1YGzu2h
@JayS2629   Let's fire them as soon as possible. And don't forget Lindsey Graham &amp; Nikki Haley
Why Americans allow a couple of families to dominate our politics is beyond me. Other Americans have a voice too https://t.co/BQ6WP3NZpl
"Was Cicero talking about Jeb!, Mitt, Ryan &amp; Graham when he said ""politicians are not born, they are excreted""  @AnnCoulter @DonaldJTrumpJr"
Good interview. Lynch &amp; DOJ need 2 indict Hillary @DiamondandSilk @MarkGeistSWP @immigrant4trump @TrumpForVets  https://t.co/qItgsBUu7C
That Ryan Ass is willing to spend money on illegals &amp; refugees but not U S citizens. Hope Ryan loses in Wisconsin  https://t.co/OwBjEeys6Z
Another sore loser. Voters never could embrace Mitt. Mitt is disgusting these days https://t.co/obmBhDijnf
Another lying politician. Native Americans should protest Warren co opting their heritage @Indians4Trump  https://t.co/r1shOejuUD
Petty sore loser. The country is better off without a Bush at its helm. Clintons &amp; Bushes = trouble for USA  https://t.co/CKYMt4ovnF
Vote against Paul Ryan in Wisconsin elections. If he loses we can get rid of him as Speaker of the House https://t.co/cCBAT3AVcE
KARMA is a b*tch https://t.co/yHAEWlxlpO
Bunch of sniveling losers. Voters want a winner. We vote Trump https://t.co/H3XLNE1y1Q
The community organizer has destroyed our country https://t.co/ht2klYIeXu
Lindsey got his A F promotions &amp; rank mainly because he was a senator. There have been lots of editorials re this https://t.co/fW6BD995RU
Wisconsin kick Paul Ryan out on ASAP https://t.co/xkXrXh3k6s
I am from SC &amp; I despise Sen Graham   Can't wait 2 vote against him https://t.co/Urskw5TVg7
Clinton Foundation is a 'Charity Fraud' @abc @nbcnews @cbsnews Don't Report https://t.co/BOSh8OSoHf.
I respect @seanhannity even more 4 endorsing Trump He gets it. Trump is who the American GOP voters have picked  https://t.co/OwM1efL9z9
@JudgeMoroz @FiveRights   Let's not forget Hillary's closest aide Huma is a Muslim.
Glad Latinos in L A slam Hillary   Hope to see more around the country   Vote Trump https://t.co/4MRxIiGOGx
"Latinos slam Hillary Clinton for 'obvious,' offensive pandering on Cinco de Mayo https://t.co/xMTH4FDfKV via @TheWeek"
Sure hope Paul Nehlen wins big https://t.co/Wx6I0OEAF3
Scary combination. All US citizens should be very afraid of those 2 https://t.co/MPbBC9HDy3
A lot of Clinton scandals. Why don't the DEMS care? https://t.co/ZV94HZ6WUC
GOP better watch out unless secretly this is what they want. Vote Trump https://t.co/vE9RMyvgBo
Nikki Haley's Next Move - FITSNews https://t.co/Rw6CyN8HYc via @po_st.   Another unpopular SC politician
Donald Trump Rebukes Liberal Lindsey Graham - FITSNews https://t.co/POwznU7grV via @po_st
WSJ's Peggy Noonan Rips #NeverTrump as Doomed 'Private Club' - Breitbart https://t.co/kqZLfp6113 via @BreitbartNews.
"Everyone should read the book by Roger Stone. ""Jeb!and the Bush Crime Family "".  https://t.co/OWtPAVu97R"
@Trumpforpotus16 @IngrahamAngle   Sen Graham needs to switch to the Democratic Party. He's always been that way &amp; why he didn't win in SC
"Teachers need help. Bush's ""no child left behind""  &amp; common core have been a disaster @realDonaldTrump @OMAROSA  https://t.co/yNUFz7DxmV"
Totally agree with Gov Huckabee. He would be a good  VP. Ryan needs to go home we don't want him @GovMikeHuckabee  https://t.co/e69aZpw8we
Obama has not been a friend to our country. We need Trump to straighten it out  https://t.co/McXlevfP66
Judge Nap: Proof of Hacking Would Make It 'Nearly Impossible' Not to Charge Hillary https://t.co/xqTiMJzP4l. Let's us hope So
Graham is coming out of the closet. He has always been a DEM. We thought he was just a RHINO   https://t.co/ELMN3tMemu
GOP is more interested in seeing Trump lose than they are in beating Hillary. Must be a lot of $$ at stake 4 GOP elite  BAD  @DiamondandSilk
@Reince You better reign in Mitt Romney &amp; Lindsey Graham &amp; others or GOP is done. Voters are furious. We voted Trump @realDonaldTrump
@greta @LindseyGrahamSC @realDonaldTrump   Lots of SC do not plan to vote for Lindsey Graham again either. We always thought he was a RHINO
He has opened our eyes to lying media &amp; corrupt GOP too.  Voters trust Trump   Bye bye Barack   Your time is up https://t.co/qGXfegEAYP
I am offended by Islamic terrorist. This is another on story created by corrupt Hillary and liberal media https://t.co/rEp4bQBKvh
Bunch of Liars. DEMS should care. https://t.co/PhHD8PWwj9
Coal miners are the backbone of America. Politicians forget about the real people except for Trump. Trump gets it ! https://t.co/5dCIJn0oPl
Now Hillary is trying to lie her way out of it https://t.co/4AnUa5XgH8
I think the GOP cartel doesn't care. They just want PAC $$$. It's why voters are angry. Vote Trump https://t.co/rutWE7GCk8
Mitt Romney says he hopes 4 a 3rd party candidate What an Ass ! Mitt we didn't like u then &amp; like u less now. We vote Trump @DiamondandSilk
#Hannity  I am furious @ GOP elite/cartel https://t.co/Q56BB6o5BI
@EricTrump Don't let the Media say that women don't like Trump. I have been a Trump supporter since Day 1 &amp; Will proudly vote Trump in Nov
Hillary has  cost a lot of people their lives and has ruined the Middle East which now look to Putin for help https://t.co/RfRzuH5SM8
"We voted Trump but we will never vote Paul  Ryan, Lindsey Graham &amp; others so out of touch with Voters. Vote Trump'16 https://t.co/Hb19qz4pZ8"
Today in 1994 Paula Jones filed a sexual harassment suit against Bill Clinton. Google it if you don't remember @DiamondandSilk
SC voted overwhelmingly for Trump. SC politicians do Not control the party.  Voters do. Politicians need to recognize that @SCGOP @Reince
Sounds like Latinos like Trump to me. Don't believe Hillary &amp; Media  Vote Trump https://t.co/xO3ZLOZvBx
The GOP Establishment does not care about the voters &amp; we know it. It is now time 4 voters 2 take back the party  https://t.co/Fw8fpPaBE3
Bush Family are showing their true colors. Bad sports and they feel entitled https://t.co/KR4UdcsXm0
Does this fool really think we would ever actually vote for him ?  Never vote for Paul Ryan  https://t.co/ycmXnWogkp
Can't wait to vote out Lindsey Graham  https://t.co/UAXVq94HNX
We would have been better off with John Boehner https://t.co/hEBS99Web8
Very important to still vote for Trump so GOP can't stop his nomination https://t.co/ufdctpv981
We the voters control the party not a handful of career politicians.  Let's take it back &amp; put Trump in charge https://t.co/vAJrdI8Vhl
Thank goodness   Our country needs a new approach https://t.co/StYngREnQz
Pretty scary for gun owners across the country. GOP needs to support Trump &amp; Stop Hillary @Guns4Trump @TrumpForVets  https://t.co/xPc2rveIGi
Sorry Sen McCain the Nov election is about who the people want for president not whether it will affect your run for Senate @AnnCoulter
WV needs to vote Trump so he get 1237 delegates or GOP will have brokered convention. Don't let GOP fool you https://t.co/d9jMUWXOJY
Love the Trumps. Great first Family https://t.co/lWXgsG0IG6
Let's make a list &amp; start voting them out. We need a clean sweep in Washington DC  https://t.co/YVlsWIyrQ9
@Reince What's wrong with the GOP. Is it trying to lose 2 Hillary. If you're in charge tell them 2 support Trump or be quiet @AnnCoulter
Hillary says she loves Hispanics but she doesn't love secret service or policemen . She has belittled them and cursed them  @DiamondandSilk
Paul Ryan just go home   We don't need you and we don't like you   @AnnCoulter @JudgeJeanine @DiamondandSilk @Reince @GOP @OMAROSA @greta
@DiamondandSilk @JudgeJeanine @OMAROSA @AnnCoulter @shawgerald4  https://t.co/NwQsWxF93a
I am hearing reports of tricks by GOP. Be sure to vote Trump in upcoming primaries @DiamondandSilk @OMAROSA @CA_woman4Trump @shawgerald4
Hacker Claims He Breached Hillary Clinton’s Email Server - ‘It Was Easy’ - Breitbart https://t.co/SxTQkJ1asY via @BreitbartNews
Ted Cruz's Website Has An Interesting New Look - FITSNews https://t.co/C37gHak8QG via @po_st. Something rotten going on. Watch out voters
Let's quit supporting any celebrity that feels it is ok to slam Trump or make fun of his voters. Vote against them with your pocketbook
Voters don't forget it is important to vote Trump in any primaries. He still needs 1237 delegates @DiamondandSilk  https://t.co/1kigpavmB0
Please vote Trump I. Coming primaries so GOP doesn't screw us https://t.co/bH40R2PgOn
Will never vote for Paul Ryan. Typical Career Politician https://t.co/PrW96z3xMq
What does that mean? GOP needs to support Trump &amp; quit playing games.   https://t.co/UofZoELQWu
Thank goodness. Haley is only out for herself. Media says how great she is but ask those in SC what we think https://t.co/shD6IYuF7P
Just 1of Hillary's many lies @DiamondandSilk @OMAROSA  https://t.co/mu2k9gZKkN
"Piers Morgan: Trump Slaying D.C. Elite, Hillary Shaking “In Her Goldman Sachs-Financed Boots” https://t.co/jlrF1ljCBd via @realalexjones"
American citizens are tired of the both the  Bush &amp; Clinton dynasties  Both caused a lot of problems for our country @OMAROSA @AnnCoulter
Fox is hoping for an invite to Mar a Lago but he has to pay for the wall 1st @CLewandowski_  @DonaldJTrumpJr  https://t.co/b9aRWXfT5n
Maybe Sen McCain should support Trump &amp; show people their opinions matter @AnnCoulter @greta @JudgeJeanine @Reince  https://t.co/QNxzgAYm1F
Our country needs Donald Trump. Hillary is dangerous https://t.co/Cw8KlnfeAz
WV coal miners be sure to give Hillary a warm welcome at Alderson Prison.  It was good enough for Martha Stewart @WV4TRUMP1 @DiamondandSilk
@DiamondandSilk Hillary needs to go to jail to prove that the system treats politicians the same as everyone else &amp; she doesn't get a pass
@DiamondandSilk Lets help Trump win the White House . Trump will be  the People's President 2016
Great looking First Family  https://t.co/flKlknGejI
This is what we need  Not another PC candidate  We need someone who actually is an asset https://t.co/5R7nRGNgrQ
Wonder when Sanders voters will figure out they never had a chance to win with the Super Delegate system  https://t.co/maMcUDqEc1
WV give Trump a Huge win &amp; show Hillary what you think of her rhetoric about coal miners @WV4TRUMP1  https://t.co/eHB1A04p0w
"CA,WV Nebraska, NJ,Oregon etc Please make sure U vote $ Trump so he gets the delegates he needs &amp; GOP can't stop him https://t.co/c01gILj5wK"
Why Americans aren't  totally frightened by Clintons is beyond me. They will stop at nothing. Vote Trump 2016 https://t.co/uCe0Lyr3hP
Never Nikki Hailey  Google scandals attached to her back when she 1st got elected https://t.co/qDQjGMll2r
FBI should look into this ASAP  How can anyone support Crooked Hillary https://t.co/kGIga7zced
Vote Trump in Nov and save the country from Hillary who is the worst candidate ever https://t.co/7WpYIjmlqw
Pay attention to Hillary's lies  She is worse than anyone ever https://t.co/nKOhzTFXpO
This sums up everything that has been wrong in American politics for a long time  We need Trump who isn't owned  https://t.co/iDDa0KdikJ
Mexico should have been helping USA to solve this problem all along  Now Trump will make Mexico help https://t.co/7DiidcjGy1
"@CharlesOrtel I heard that a notorious hacker admitted hack Hillary""s server multiple times  Sounds like a big security breach"
