"{""follow_request_sent"": false, ""has_extended_profile"": false, ""profile_use_background_image"": true, ""profile_text_color"": ""333333"", ""default_profile_image"": false, ""id"": 1922383902, ""profile_background_image_url_https"": ""https://abs.twimg.com/images/themes/theme1/bg.png"", ""verified"": false, ""imported_to_gensim"": false, ""profile_location"": null, ""profile_image_url_https"": ""https://pbs.twimg.com/profile_images/641087555291643904/oukaLLRM_normal.jpg"", ""profile_sidebar_fill_color"": ""DDEEF6"", ""entities"": {""description"": {""urls"": []}}, ""followers_count"": 1682, ""profile_sidebar_border_color"": ""C0DEED"", ""id_str"": ""1922383902"", ""profile_background_color"": ""C0DEED"", ""listed_count"": 48, ""status"": {""contributors"": null, ""truncated"": false, ""text"": ""RT @Trump2016Donald: Mr speaker, trump was not handed the Republican Party, he won it! Please like and share if you agree! #Trump2016 https\u2026"", ""is_quote_status"": false, ""in_reply_to_status_id"": null, ""id"": 729451500464807938, ""favorite_count"": 0, ""source"": ""<a href=\""http://twitter.com/download/iphone\"" rel=\""nofollow\"">Twitter for iPhone</a>"", ""retweeted"": false, ""coordinates"": null, ""entities"": {""symbols"": [], ""user_mentions"": [{""id"": 3385160385, ""indices"": [3, 19], ""id_str"": ""3385160385"", ""screen_name"": ""Trump2016Donald"", ""name"": ""Trump 2016""}], ""hashtags"": [{""indices"": [123, 133], ""text"": ""Trump2016""}], ""urls"": [], ""media"": [{""source_user_id"": 3385160385, ""source_status_id_str"": ""729410913783185409"", ""expanded_url"": ""http://twitter.com/Trump2016Donald/status/729410913783185409/photo/1"", ""display_url"": ""pic.twitter.com/G2ECgJhIbJ"", ""url"": ""https://t.co/G2ECgJhIbJ"", ""media_url_https"": ""https://pbs.twimg.com/media/Ch9jW-mWEAE-REM.jpg"", ""source_user_id_str"": ""3385160385"", ""source_status_id"": 729410913783185409, ""id_str"": ""729410911069409281"", ""sizes"": {""large"": {""h"": 568, ""resize"": ""fit"", ""w"": 750}, ""small"": {""h"": 257, ""resize"": ""fit"", ""w"": 340}, ""medium"": {""h"": 454, ""resize"": ""fit"", ""w"": 600}, ""thumb"": {""h"": 150, ""resize"": ""crop"", ""w"": 150}}, ""indices"": [139, 140], ""type"": ""photo"", ""id"": 729410911069409281, ""media_url"": ""http://pbs.twimg.com/media/Ch9jW-mWEAE-REM.jpg""}]}, ""in_reply_to_screen_name"": null, ""in_reply_to_user_id"": null, ""retweet_count"": 527, ""id_str"": ""729451500464807938"", ""favorited"": false, ""retweeted_status"": {""contributors"": null, ""truncated"": false, ""text"": ""Mr speaker, trump was not handed the Republican Party, he won it! Please like and share if you agree! #Trump2016 https://t.co/G2ECgJhIbJ"", ""is_quote_status"": false, ""in_reply_to_status_id"": null, ""id"": 729410913783185409, ""favorite_count"": 539, ""source"": ""<a href=\""http://twitter.com/download/iphone\"" rel=\""nofollow\"">Twitter for iPhone</a>"", ""retweeted"": false, ""coordinates"": null, ""entities"": {""symbols"": [], ""user_mentions"": [], ""hashtags"": [{""indices"": [102, 112], ""text"": ""Trump2016""}], ""urls"": [], ""media"": [{""expanded_url"": ""http://twitter.com/Trump2016Donald/status/729410913783185409/photo/1"", ""display_url"": ""pic.twitter.com/G2ECgJhIbJ"", ""url"": ""https://t.co/G2ECgJhIbJ"", ""media_url_https"": ""https://pbs.twimg.com/media/Ch9jW-mWEAE-REM.jpg"", ""id_str"": ""729410911069409281"", ""sizes"": {""large"": {""h"": 568, ""resize"": ""fit"", ""w"": 750}, ""small"": {""h"": 257, ""resize"": ""fit"", ""w"": 340}, ""medium"": {""h"": 454, ""resize"": ""fit"", ""w"": 600}, ""thumb"": {""h"": 150, ""resize"": ""crop"", ""w"": 150}}, ""indices"": [113, 136], ""type"": ""photo"", ""id"": 729410911069409281, ""media_url"": ""http://pbs.twimg.com/media/Ch9jW-mWEAE-REM.jpg""}]}, ""in_reply_to_screen_name"": null, ""in_reply_to_user_id"": null, ""retweet_count"": 527, ""id_str"": ""729410913783185409"", ""favorited"": false, ""geo"": null, ""in_reply_to_user_id_str"": null, ""possibly_sensitive"": false, ""lang"": ""en"", ""created_at"": ""Sun May 08 20:41:28 +0000 2016"", ""in_reply_to_status_id_str"": null, ""place"": null, ""extended_entities"": {""media"": [{""expanded_url"": ""http://twitter.com/Trump2016Donald/status/729410913783185409/photo/1"", ""display_url"": ""pic.twitter.com/G2ECgJhIbJ"", ""url"": ""https://t.co/G2ECgJhIbJ"", ""media_url_https"": ""https://pbs.twimg.com/media/Ch9jW-mWEAE-REM.jpg"", ""id_str"": ""729410911069409281"", ""sizes"": {""large"": {""h"": 568, ""resize"": ""fit"", ""w"": 750}, ""small"": {""h"": 257, ""resize"": ""fit"", ""w"": 340}, ""medium"": {""h"": 454, ""resize"": ""fit"", ""w"": 600}, ""thumb"": {""h"": 150, ""resize"": ""crop"", ""w"": 150}}, ""indices"": [113, 136], ""type"": ""photo"", ""id"": 729410911069409281, ""media_url"": ""http://pbs.twimg.com/media/Ch9jW-mWEAE-REM.jpg""}]}}, ""geo"": null, ""in_reply_to_user_id_str"": null, ""possibly_sensitive"": false, ""lang"": ""en"", ""created_at"": ""Sun May 08 23:22:44 +0000 2016"", ""in_reply_to_status_id_str"": null, ""place"": null, ""extended_entities"": {""media"": [{""source_user_id"": 3385160385, ""source_status_id_str"": ""729410913783185409"", ""expanded_url"": ""http://twitter.com/Trump2016Donald/status/729410913783185409/photo/1"", ""display_url"": ""pic.twitter.com/G2ECgJhIbJ"", ""url"": ""https://t.co/G2ECgJhIbJ"", ""media_url_https"": ""https://pbs.twimg.com/media/Ch9jW-mWEAE-REM.jpg"", ""source_user_id_str"": ""3385160385"", ""source_status_id"": 729410913783185409, ""id_str"": ""729410911069409281"", ""sizes"": {""large"": {""h"": 568, ""resize"": ""fit"", ""w"": 750}, ""small"": {""h"": 257, ""resize"": ""fit"", ""w"": 340}, ""medium"": {""h"": 454, ""resize"": ""fit"", ""w"": 600}, ""thumb"": {""h"": 150, ""resize"": ""crop"", ""w"": 150}}, ""indices"": [139, 140], ""type"": ""photo"", ""id"": 729410911069409281, ""media_url"": ""http://pbs.twimg.com/media/Ch9jW-mWEAE-REM.jpg""}]}}, ""is_translation_enabled"": false, ""utc_offset"": null, ""statuses_count"": 9305, ""description"": ""Married, working mother of four, concerned about direction of our country. Christian conservative YUGE Trump supporter. #CCOT #Trump2016 #AlwaysTrump"", ""friends_count"": 2323, ""location"": ""Northern California"", ""profile_link_color"": ""0084B4"", ""profile_image_url"": ""http://pbs.twimg.com/profile_images/641087555291643904/oukaLLRM_normal.jpg"", ""following"": false, ""geo_enabled"": true, ""profile_banner_url"": ""https://pbs.twimg.com/profile_banners/1922383902/1448495735"", ""profile_background_image_url"": ""http://abs.twimg.com/images/themes/theme1/bg.png"", ""name"": ""Renee"", ""lang"": ""en"", ""profile_background_tile"": false, ""favourites_count"": 7793, ""screen_name"": ""lakwita2"", ""notifications"": false, ""url"": null, ""created_at"": ""Tue Oct 01 05:59:41 +0000 2013"", ""contributors_enabled"": false, ""time_zone"": null, ""protected"": false, ""default_profile"": true, ""is_translator"": false}"
Byron York: What does Paul Ryan want from Donald Trump? https://t.co/qQbBWw82gX via DCExaminer #Trump2016
"@MrMikeFaulkner @sullivanradio @SpeakerRyan You could be right, but Cruz's agenda lines up much closer to Trump's than Ryan's.  #Trump2016"
"@sullivanradio If @SpeakerRyan,
the leader of the ""people's"" House, can't support the will of the people, he will be ousted.
We are fed up!"
"Wow @SpeakerRyan poking his finger in the eye of the people...and he's the leader of ""the people's"" House! #Trump https://t.co/q8l01TtkWQ"
"Great article!  Laura is spot on.
#Trump2016  https://t.co/OxU1RH8G3n"
Let's support @realDonaldTrump by making a donation at: https://t.co/fCJV8Fjcda. He's working nonstop for us! Plz RT https://t.co/dNsNWaPOUq
Ryan escalates fight with Trump for control of GOP https://t.co/sYdqUgngAO via DCExaminer #Trump2016
This email goes out under @SpeakerRyan's name yet he can't support Trump. What a crock! @seanhannity @IngrahamAngle  https://t.co/yKARTy1zZw
"@seanhannity @SpeakerRyan @realDonaldTrump You're so right, Sean. Also, the House is supposed to be representing the people!"
"@sullivanradio It's no wonder Cruz is losing. For the last two weeks every other word he says is ""Donald.""  Trump is focused on the country."
"@sullivanradio I'm a devout Christian, voting for Trump. The only evil I see is in the one currently occupying the White House.  #Trump2016"
Gallup: Cruz Image Among Republicans Crashes - Breitbart https://t.co/hR9C9xcO9R via @BreitbartNews #Trump2016
Latino activists vow more Trump protests as tensions heighten https://t.co/HnIua9wXS3 #Trump2016
WSJ-NBC News Poll: Donald Trump Opens Up 15 Point Lead in Indiana https://t.co/f8UKEDuVeR via @gatewaypundit #Trump2016
CRUZ POACHES NEARLY ALL AZ DELEGATES= Former Gov. Jan Brewer Screams “I Got CheaTED!”  https://t.co/q8mFks451i via @gatewaypundit #Trump2016
"Heidi Cruz: 'Ted Is an Immigrant' - Breitbart https://t.co/LyR4ox0wvb via @BreitbartNews
#Trump2016"
'Make America Mexico Again': We Warned You About America-Hating Mobs - Breitbart https://t.co/YwBgq4pwyx via @BreitbartNews #Trump2016
