"{""follow_request_sent"": false, ""has_extended_profile"": true, ""profile_use_background_image"": false, ""profile_text_color"": ""000000"", ""default_profile_image"": false, ""id"": 3589878313, ""profile_background_image_url_https"": ""https://abs.twimg.com/images/themes/theme1/bg.png"", ""verified"": false, ""imported_to_gensim"": false, ""profile_location"": null, ""profile_image_url_https"": ""https://pbs.twimg.com/profile_images/654000285006888960/wQqk79eP_normal.jpg"", ""profile_sidebar_fill_color"": ""000000"", ""entities"": {""url"": {""urls"": [{""url"": ""https://t.co/GerZmUrSDV"", ""indices"": [0, 23], ""expanded_url"": ""http://goo.gl/cTEFYR"", ""display_url"": ""goo.gl/cTEFYR""}]}, ""description"": {""urls"": []}}, ""followers_count"": 2344, ""profile_sidebar_border_color"": ""000000"", ""id_str"": ""3589878313"", ""profile_background_color"": ""000000"", ""listed_count"": 63, ""status"": {""contributors"": null, ""truncated"": false, ""text"": ""@RealMrFranchise @chrgdup1973 @realDonaldTrump\nThey're desperate, they'll do anything 2 keep this liberal government giving them freebies."", ""is_quote_status"": false, ""in_reply_to_status_id"": 729356945392443392, ""id"": 729371883460681728, ""favorite_count"": 0, ""source"": ""<a href=\""http://twitter.com/download/android\"" rel=\""nofollow\"">Twitter for Android</a>"", ""retweeted"": false, ""coordinates"": null, ""entities"": {""symbols"": [], ""user_mentions"": [{""id"": 4819865003, ""indices"": [0, 16], ""id_str"": ""4819865003"", ""screen_name"": ""RealMrFranchise"", ""name"": ""John Lawson""}, {""id"": 740874799, ""indices"": [17, 29], ""id_str"": ""740874799"", ""screen_name"": ""chrgdup1973"", ""name"": ""Michelle""}, {""id"": 25073877, ""indices"": [30, 46], ""id_str"": ""25073877"", ""screen_name"": ""realDonaldTrump"", ""name"": ""Donald J. Trump""}], ""hashtags"": [], ""urls"": []}, ""in_reply_to_screen_name"": ""RealMrFranchise"", ""in_reply_to_user_id"": 4819865003, ""retweet_count"": 0, ""id_str"": ""729371883460681728"", ""favorited"": false, ""geo"": null, ""in_reply_to_user_id_str"": ""4819865003"", ""lang"": ""en"", ""created_at"": ""Sun May 08 18:06:22 +0000 2016"", ""in_reply_to_status_id_str"": ""729356945392443392"", ""place"": {""full_name"": ""Florida, USA"", ""url"": ""https://api.twitter.com/1.1/geo/id/4ec01c9dbc693497.json"", ""country"": ""United States"", ""place_type"": ""admin"", ""bounding_box"": {""type"": ""Polygon"", ""coordinates"": [[[-87.634643, 24.396308], [-79.974307, 24.396308], [-79.974307, 31.001056], [-87.634643, 31.001056]]]}, ""contained_within"": [], ""country_code"": ""US"", ""attributes"": {}, ""id"": ""4ec01c9dbc693497"", ""name"": ""Florida""}}, ""is_translation_enabled"": false, ""utc_offset"": null, ""statuses_count"": 19357, ""description"": ""#MakeAmericaGreatAgain*I'm on Twitter for 1 reason only*To promote Trump*He's not bought & paid for*I only follow Trump Supporters*I block Haters*"", ""friends_count"": 1925, ""location"": ""*TRUMP MAGZN*   *FL Panhandle*"", ""profile_link_color"": ""94D487"", ""profile_image_url"": ""http://pbs.twimg.com/profile_images/654000285006888960/wQqk79eP_normal.jpg"", ""following"": false, ""geo_enabled"": true, ""profile_banner_url"": ""https://pbs.twimg.com/profile_banners/3589878313/1456073283"", ""profile_background_image_url"": ""http://abs.twimg.com/images/themes/theme1/bg.png"", ""name"": ""PoliticallyIncorrect"", ""lang"": ""en"", ""profile_background_tile"": false, ""favourites_count"": 1698, ""screen_name"": ""Politicallyin18"", ""notifications"": false, ""url"": ""https://t.co/GerZmUrSDV"", ""created_at"": ""Thu Sep 17 03:54:13 +0000 2015"", ""contributors_enabled"": false, ""time_zone"": null, ""protected"": false, ""default_profile"": false, ""is_translator"": false}"
"@RealMrFranchise @chrgdup1973 @realDonaldTrump
They're desperate, they'll do anything 2 keep this liberal government giving them freebies."
"@chrgdup1973 @realDonaldTrump
Stay strong Michelle, they r desperate now cuz we r winning.Their days r numbered I'm sorry this happened to u"
Thx 4 bringing this to light. There are millions more ppl on social media paying attention now. I didn't know about. https://t.co/PLEvM5rSZk
@SpeakerRyan u're a closet liberal &amp; u've been exposed. U &amp; @GOP have betrayed OATH OF OFFICE a Treasonable offence. https://t.co/kCfY0vB6GR
"@elizabethforma is a fraud &amp; @realDonaldTrump is exposing her. Once in WH, he will investigate her criminal activity https://t.co/uA2QxTExe5"
"After Trump wins, I'm changing party from Rep 2 Ind. We've been USED &amp; BETRAYED by GOP. They pretend 2b conservative https://t.co/jdmFftewgt"
"@SpreadThe_Word
Thanks for following. Please check out Trump Magazine at @gqforbes to help @realDonaldTrump #MAGA"
"@AJ_Grasso
 Thanks for following. Please check out Trump Magazine at @gqforbes  to help @realDonaldTrump #MAGA"
"@MarkGeistSWP
Thanks for following. And thank you 4 your service to this country &amp; exposing truth.  Trump will get the Justice you deserve."
"@airavatvolvo I guess it's not as bad as a Moslem in the WH running the whole country, but it's not good either. https://t.co/hNn5GGpOwv"
"Yes, GOPe exposed &amp; America IS watching &amp; we WILL ***CLEAN HOUSE***
The GOPe is on notice to support ""WE THE PPL"". https://t.co/iG5jfb0vsH"
"@greta u should have this guy on ur show. Read: like coalminers, News broadcasters could just as easily lose it all. https://t.co/MqPvXUgiLC"
Because feminists with power r not TRUE feminist. They r using the Cause &amp; real feminists to gain &amp; keep $$ &amp; power. https://t.co/AbffekAbah
OMGosh I just can't wait...the anticipation is killing me. https://t.co/s9CpkpnBWG
Yes they are. I'm sure they'll just love being locked up together. https://t.co/qYjY1BljbN
This alone is reason enough to vote for @realDonaldTrump We would get rid of these morons. https://t.co/1P7dRgWtMj
"I know, that's why I'm on Twitter 24/7 it seems like, tweeting 4 Trump &amp; exposing moslem terrorist in WH &amp; invasion. https://t.co/m16MIiMrbO"
"Uh oh killery, I don't think ur going to make primaries. Looks like u might be otherwise engaged. Bills will b free. https://t.co/6919f6eze3"
"#MAGA #VoteTrump2016 #VoteTrumpWV #AlwaysTrump #MakeAmericaGreatAgain @HillaryClinton
U will loose Benghazi Butcher https://t.co/93pzvGf0em"
"@HillaryClinton
Shouldn't these women have been believed too killary, Benghazi butcher &amp;the biggest hypocrite of all https://t.co/PdfOoTMdgQ"
"@elizabethforma
The women torn apart by ur butcher friend killary after being raped &amp; traumatized by Bill. HYPOCRITE https://t.co/PdfOoTMdgQ"
Love this https://t.co/lkbN8WbTGS
"Just like Mr. Trump says, a love fest &amp; ppl c difference between liberals hate of authority &amp; conservatives respect. https://t.co/5ThjKaYT4n"
@SecretService @FBI @FBIWFO @NewYorkFBI @CIA @DRUDGE_REPORT  @MichaelCohen212 @realDonaldTrump @DanScavino  https://t.co/9Mhl0GGnkD
I can &amp; I do. Muhammad was a pedophile that married a 6 year old girl. Anybody calling him a prophet is just as sick https://t.co/CFOWjZQqvK
Not 2 mention gay rights activist ignoring Islamic murder of gays. We should send all hypocrites there.#Trumpe2016   https://t.co/4N7YJt2xCu
"I've seen video of European citizens crying all beat up. They had no idea how evil Islam is, how the Quran approves. https://t.co/16bwC2Puj5"
"They're Busy working 2 pay taxes, raise family no time 2 pay attention 2 their government selling them out 2 Soros. https://t.co/16bwC2Puj5"
"Hve u seen the 100s of posts on Twitter past year. Mostly Germany showing 10s of 1000s men rioting, raping,fighting? https://t.co/16bwC2Puj5"
Does Bill Clinton's sexism make you sick? What about killerys ruthless attacks on the poor WOMEN he raped? HYPOCRITE https://t.co/dpao2qPLsQ
Lol https://t.co/OOIZ7LR1Yr
Love this.... https://t.co/AIzir9L460
Why are they doing this to us. I can't figure it out. Some1 probably Soros is paying them big $$ 2 ruin our country. https://t.co/FeXMBOYzLF
I wouldn't know about that. I'm not one of them. Especially while he's accepting ISLAM. That ideology is so evil. https://t.co/g8P05Z35tM
Fed tax $$ is ours. It doesn't grow on trees. Amer. citizens work 4 that $$ b4 gov takes it 4 head chopping savages. https://t.co/pvbX7X1EyQ
Wow! What an awesome idea. https://t.co/19Mu1EJeUO
It goes 2 show that their leaders r lunatics that don't care about the citizens of London. Bye bye EU tourist $$$$ https://t.co/rmQACnNak0
"Maybe...I never meet either but the Pope, past on hearing translations, sounds like a commie. Very unchristian, IMHO https://t.co/Rts5HoprbX"
RAND PAUL for VP I hope. I'm glad you are man enough to see past the campaign and not take the attacks person. SMART https://t.co/zVdAOlYMuN
"Coming to America, soon. Unless we clean out DC, stop @GOP establishment from rigging election &amp; elect DONALD TRUMP. https://t.co/10tc9MKckq"
Awesome...we want them to squirm. Their greed is destroying America. https://t.co/31R83mudtX
