"{""follow_request_sent"": false, ""has_extended_profile"": false, ""profile_use_background_image"": true, ""profile_text_color"": ""333333"", ""default_profile_image"": false, ""id"": 4692145376, ""profile_background_image_url_https"": null, ""verified"": false, ""imported_to_gensim"": false, ""profile_location"": null, ""profile_image_url_https"": ""https://pbs.twimg.com/profile_images/709860123737456640/siEakcqU_normal.jpg"", ""profile_sidebar_fill_color"": ""DDEEF6"", ""entities"": {""description"": {""urls"": []}}, ""followers_count"": 162, ""profile_sidebar_border_color"": ""C0DEED"", ""id_str"": ""4692145376"", ""profile_background_color"": ""F5F8FA"", ""listed_count"": 3, ""status"": {""contributors"": null, ""truncated"": false, ""text"": ""RT @mitchellvii: Don't overestimate Rubio's appeal.  I mean, he lost his home state by A LOT."", ""is_quote_status"": false, ""in_reply_to_status_id"": null, ""id"": 729409940025151488, ""favorite_count"": 0, ""source"": ""<a href=\""http://twitter.com/download/android\"" rel=\""nofollow\"">Twitter for Android</a>"", ""retweeted"": false, ""coordinates"": null, ""entities"": {""symbols"": [], ""user_mentions"": [{""id"": 17980523, ""indices"": [3, 15], ""id_str"": ""17980523"", ""screen_name"": ""mitchellvii"", ""name"": ""Bill Mitchell""}], ""hashtags"": [], ""urls"": []}, ""in_reply_to_screen_name"": null, ""in_reply_to_user_id"": null, ""retweet_count"": 95, ""id_str"": ""729409940025151488"", ""favorited"": false, ""retweeted_status"": {""contributors"": null, ""truncated"": false, ""text"": ""Don't overestimate Rubio's appeal.  I mean, he lost his home state by A LOT."", ""is_quote_status"": false, ""in_reply_to_status_id"": null, ""id"": 729403939679051778, ""favorite_count"": 243, ""source"": ""<a href=\""https://about.twitter.com/products/tweetdeck\"" rel=\""nofollow\"">TweetDeck</a>"", ""retweeted"": false, ""coordinates"": null, ""entities"": {""symbols"": [], ""user_mentions"": [], ""hashtags"": [], ""urls"": []}, ""in_reply_to_screen_name"": null, ""in_reply_to_user_id"": null, ""retweet_count"": 95, ""id_str"": ""729403939679051778"", ""favorited"": false, ""geo"": null, ""in_reply_to_user_id_str"": null, ""lang"": ""en"", ""created_at"": ""Sun May 08 20:13:45 +0000 2016"", ""in_reply_to_status_id_str"": null, ""place"": null}, ""geo"": null, ""in_reply_to_user_id_str"": null, ""lang"": ""en"", ""created_at"": ""Sun May 08 20:37:36 +0000 2016"", ""in_reply_to_status_id_str"": null, ""place"": null}, ""is_translation_enabled"": false, ""utc_offset"": -14400, ""statuses_count"": 1022, ""description"": """", ""friends_count"": 235, ""location"": """", ""profile_link_color"": ""2B7BB9"", ""profile_image_url"": ""http://pbs.twimg.com/profile_images/709860123737456640/siEakcqU_normal.jpg"", ""following"": false, ""geo_enabled"": false, ""profile_banner_url"": ""https://pbs.twimg.com/profile_banners/4692145376/1458078996"", ""profile_background_image_url"": null, ""name"": ""Rally4Trump"", ""lang"": ""en"", ""profile_background_tile"": false, ""favourites_count"": 448, ""screen_name"": ""Rally4Trump"", ""notifications"": false, ""url"": null, ""created_at"": ""Fri Jan 01 22:30:59 +0000 2016"", ""contributors_enabled"": false, ""time_zone"": ""Eastern Time (US & Canada)"", ""protected"": false, ""default_profile"": true, ""is_translator"": false}"
"Number of illegal immigrant families at southern border surging, data shows | Fox News | https://t.co/iVPKmk9sGH"
"@mitchellvii Thank you Bill, appreciate all of the information you provide."
Injured Trump Supporter Describes Violent California Protest: 'Blood Was Flooding Down My Face' https://t.co/Il0VFhTLr8 via @InsideEdition
How a golf caddie became Trump's campaign confidant @CNNPolitics https://t.co/WT5fnTff2e
Crowd for Cruz rally less than expected https://t.co/BXTkFR3Rd3 via @wane15
@Fox35John Why? Time for Cruz to drop out https://t.co/VHWPrywvBn
"Fake @realDonaldTrump  Foreign Policy speech on Cruz's Facebook page

https://t.co/jcJYXhI9F1"
"@formarrowdbs @mitchellvii Yes we need to keep the momentum,no establishment for VP.  I like Sessions,Carson,Newt,Cain,Huckabee,Brewer,Palin"
