"{""follow_request_sent"": false, ""has_extended_profile"": true, ""profile_use_background_image"": false, ""profile_text_color"": ""000000"", ""default_profile_image"": false, ""id"": 4827698474, ""profile_background_image_url_https"": ""https://abs.twimg.com/images/themes/theme1/bg.png"", ""verified"": false, ""imported_to_gensim"": false, ""profile_location"": {""full_name"": ""Globe, AZ"", ""url"": ""https://api.twitter.com/1.1/geo/id/4fb788c6d5b6b5ec.json"", ""country"": """", ""place_type"": ""unknown"", ""bounding_box"": null, ""contained_within"": [], ""country_code"": """", ""attributes"": {}, ""id"": ""4fb788c6d5b6b5ec"", ""name"": ""Globe, AZ""}, ""profile_image_url_https"": ""https://pbs.twimg.com/profile_images/693839743209992192/JwyUAVgS_normal.jpg"", ""profile_sidebar_fill_color"": ""000000"", ""entities"": {""description"": {""urls"": []}}, ""followers_count"": 2167, ""profile_sidebar_border_color"": ""000000"", ""id_str"": ""4827698474"", ""profile_background_color"": ""000000"", ""listed_count"": 81, ""status"": {""contributors"": null, ""truncated"": false, ""text"": ""RT @FiveRights: London has elected its first Muslim mayor and the most common name for male babies (by far) in UK is now Muhammad. https://\u2026"", ""is_quote_status"": false, ""in_reply_to_status_id"": null, ""id"": 729479384701132800, ""favorite_count"": 0, ""source"": ""<a href=\""http://twitter.com\"" rel=\""nofollow\"">Twitter Web Client</a>"", ""retweeted"": false, ""coordinates"": null, ""entities"": {""symbols"": [], ""user_mentions"": [{""id"": 857001662, ""indices"": [3, 14], ""id_str"": ""857001662"", ""screen_name"": ""FiveRights"", ""name"": ""Philip Schuyler""}], ""hashtags"": [], ""urls"": [], ""media"": [{""source_user_id"": 857001662, ""source_status_id_str"": ""729419610454396929"", ""expanded_url"": ""http://twitter.com/FiveRights/status/729419610454396929/photo/1"", ""display_url"": ""pic.twitter.com/LGDvjkgaf4"", ""url"": ""https://t.co/LGDvjkgaf4"", ""media_url_https"": ""https://pbs.twimg.com/media/Ch9rRT3XIAAgruT.jpg"", ""source_user_id_str"": ""857001662"", ""source_status_id"": 729419610454396929, ""id_str"": ""729419609791733760"", ""sizes"": {""large"": {""h"": 450, ""resize"": ""fit"", ""w"": 600}, ""small"": {""h"": 255, ""resize"": ""fit"", ""w"": 340}, ""medium"": {""h"": 450, ""resize"": ""fit"", ""w"": 600}, ""thumb"": {""h"": 150, ""resize"": ""crop"", ""w"": 150}}, ""indices"": [139, 140], ""type"": ""photo"", ""id"": 729419609791733760, ""media_url"": ""http://pbs.twimg.com/media/Ch9rRT3XIAAgruT.jpg""}]}, ""in_reply_to_screen_name"": null, ""in_reply_to_user_id"": null, ""retweet_count"": 193, ""id_str"": ""729479384701132800"", ""favorited"": false, ""retweeted_status"": {""contributors"": null, ""truncated"": false, ""text"": ""London has elected its first Muslim mayor and the most common name for male babies (by far) in UK is now Muhammad. https://t.co/LGDvjkgaf4"", ""is_quote_status"": false, ""in_reply_to_status_id"": null, ""id"": 729419610454396929, ""favorite_count"": 157, ""source"": ""<a href=\""http://twitter.com\"" rel=\""nofollow\"">Twitter Web Client</a>"", ""retweeted"": false, ""coordinates"": null, ""entities"": {""symbols"": [], ""user_mentions"": [], ""hashtags"": [], ""urls"": [], ""media"": [{""expanded_url"": ""http://twitter.com/FiveRights/status/729419610454396929/photo/1"", ""display_url"": ""pic.twitter.com/LGDvjkgaf4"", ""url"": ""https://t.co/LGDvjkgaf4"", ""media_url_https"": ""https://pbs.twimg.com/media/Ch9rRT3XIAAgruT.jpg"", ""id_str"": ""729419609791733760"", ""sizes"": {""large"": {""h"": 450, ""resize"": ""fit"", ""w"": 600}, ""small"": {""h"": 255, ""resize"": ""fit"", ""w"": 340}, ""medium"": {""h"": 450, ""resize"": ""fit"", ""w"": 600}, ""thumb"": {""h"": 150, ""resize"": ""crop"", ""w"": 150}}, ""indices"": [115, 138], ""type"": ""photo"", ""id"": 729419609791733760, ""media_url"": ""http://pbs.twimg.com/media/Ch9rRT3XIAAgruT.jpg""}]}, ""in_reply_to_screen_name"": null, ""in_reply_to_user_id"": null, ""retweet_count"": 193, ""id_str"": ""729419610454396929"", ""favorited"": false, ""geo"": null, ""in_reply_to_user_id_str"": null, ""possibly_sensitive"": false, ""lang"": ""en"", ""created_at"": ""Sun May 08 21:16:01 +0000 2016"", ""in_reply_to_status_id_str"": null, ""place"": null, ""extended_entities"": {""media"": [{""expanded_url"": ""http://twitter.com/FiveRights/status/729419610454396929/photo/1"", ""display_url"": ""pic.twitter.com/LGDvjkgaf4"", ""url"": ""https://t.co/LGDvjkgaf4"", ""media_url_https"": ""https://pbs.twimg.com/media/Ch9rRT3XIAAgruT.jpg"", ""id_str"": ""729419609791733760"", ""sizes"": {""large"": {""h"": 450, ""resize"": ""fit"", ""w"": 600}, ""small"": {""h"": 255, ""resize"": ""fit"", ""w"": 340}, ""medium"": {""h"": 450, ""resize"": ""fit"", ""w"": 600}, ""thumb"": {""h"": 150, ""resize"": ""crop"", ""w"": 150}}, ""indices"": [115, 138], ""type"": ""photo"", ""id"": 729419609791733760, ""media_url"": ""http://pbs.twimg.com/media/Ch9rRT3XIAAgruT.jpg""}]}}, ""geo"": null, ""in_reply_to_user_id_str"": null, ""possibly_sensitive"": false, ""lang"": ""en"", ""created_at"": ""Mon May 09 01:13:33 +0000 2016"", ""in_reply_to_status_id_str"": null, ""place"": null, ""extended_entities"": {""media"": [{""source_user_id"": 857001662, ""source_status_id_str"": ""729419610454396929"", ""expanded_url"": ""http://twitter.com/FiveRights/status/729419610454396929/photo/1"", ""display_url"": ""pic.twitter.com/LGDvjkgaf4"", ""url"": ""https://t.co/LGDvjkgaf4"", ""media_url_https"": ""https://pbs.twimg.com/media/Ch9rRT3XIAAgruT.jpg"", ""source_user_id_str"": ""857001662"", ""source_status_id"": 729419610454396929, ""id_str"": ""729419609791733760"", ""sizes"": {""large"": {""h"": 450, ""resize"": ""fit"", ""w"": 600}, ""small"": {""h"": 255, ""resize"": ""fit"", ""w"": 340}, ""medium"": {""h"": 450, ""resize"": ""fit"", ""w"": 600}, ""thumb"": {""h"": 150, ""resize"": ""crop"", ""w"": 150}}, ""indices"": [139, 140], ""type"": ""photo"", ""id"": 729419609791733760, ""media_url"": ""http://pbs.twimg.com/media/Ch9rRT3XIAAgruT.jpg""}]}}, ""is_translation_enabled"": false, ""utc_offset"": -25200, ""statuses_count"": 17284, ""description"": ""Lady Farrier, Artist, Hunter, Angler, NRA all the way CCW 357 Ruger PR 4 FNRA  VOTE TRUMP 2016 NOW  I BLOCK HILLARY PUSHERS"", ""friends_count"": 3151, ""location"": ""Globe, AZ"", ""profile_link_color"": ""89C9FA"", ""profile_image_url"": ""http://pbs.twimg.com/profile_images/693839743209992192/JwyUAVgS_normal.jpg"", ""following"": false, ""geo_enabled"": false, ""profile_banner_url"": ""https://pbs.twimg.com/profile_banners/4827698474/1454260690"", ""profile_background_image_url"": ""http://abs.twimg.com/images/themes/theme1/bg.png"", ""name"": ""Wendy Baughman"", ""lang"": ""en"", ""profile_background_tile"": false, ""favourites_count"": 10946, ""screen_name"": ""wendyfarrier1"", ""notifications"": false, ""url"": null, ""created_at"": ""Thu Jan 28 23:34:31 +0000 2016"", ""contributors_enabled"": false, ""time_zone"": ""Pacific Time (US & Canada)"", ""protected"": false, ""default_profile"": false, ""is_translator"": false}"
Sounds like Soro wants 2 repeat his old history-has Clintons-Obama-Ryan-Romney-long list N his pocket @VoteTrumpUSA  https://t.co/3plLzraRdy
Bill knows ugly look @Hillary Inside &amp; Out-ashamed 2 call her woman-women R a Hell of a lot smarter @USAforTrump2016 https://t.co/grSiP8AyuZ
Wake up America lock n load-extra ammo-I am woman will blow them away they can keep their knives B proud @trump2021  https://t.co/VNZ57jWGc9
@rothfarms NeverTrump is owned by SORO another baby killer Jews-Clintons owned by him-lock n load @realDonaldTrump NRA stands w/USA wont U 2
She wont win no 1 will take Americans guns away from us we must protect ourselves so just vote 4 @realDonaldTrump !  https://t.co/xkDdavRBt7
FLASH Isis cuts off heads-don't scare Americans-Hillary/Obama want them-lock n load we'll blow em away @Always_Trump https://t.co/PtN3pcdusw
Graphic must C turn UR stomach &amp; this is what Obama/Clintons/Ryan/Soro wants 2 bring here USA VOTE @realDonaldTrump  https://t.co/sfZ6BKSrtx
WORLDWIDE SHARIA-COMPLIANT MEDIA exploit and omit certain pictures in order create sympathy for Islam (Graphic Images) http://www.barenakedi
I'd like 2 take that finger of hers &amp; stick it where the sun don't rise-whoops someone else probably did that yuck   https://t.co/jLWpluXpR5
Yep lock n load back up ammo if @realDonaldTrump looses we're going 2 get a lot of target practice N-protect family  https://t.co/dIWJFVF7JR
Look up George Soro Google is will scare the hell out of U &amp; he loves Clintons-Romney-Bushes'-Ryan-he's a German Holocaust murder humans $$$
The Milo Yiannopoulos Show: Sheriff Joe Arpaio Discusses Sanctuary Cities and Trump's Big Heart - Breitbart https://t.co/Rh9wDDMGwN
Ann Coulter Annihilates Hillary ➠ This Woman Has A Very Low IQ ➠ The Evi... https://t.co/phqD9KBONX via @YouTube
Ann Coulter Annihilates Hillary ➠ This Woman Has A Very Low IQ ➠ The Evidence Is In! - https://t.co/8bBWSzY6cI via @BarracudaMama
Army Captain Sues Obama; Says He Lacks Proper Authority To Fight ISIS - https://t.co/56PKx6A6vO via @BarracudaMama
Obama Holding North Carolina Children Hostage - https://t.co/bGq9hOA9M8 via @BarracudaMama
Top U.S. Intel Official: ISIS Can Stage Europe-Style Attacks In U.S. - https://t.co/ve0m0U1poW via @BarracudaMama
WH Denies Obama Drinking Flint Water Was A Publicity Stunt: “The Man Was Just Thirsty” - https://t.co/N2kUzA8dFd via @BarracudaMama
"Tom Hanks: America's ""Going To Be Fine"" If Trump Gets The GOP Nomination (Video) - https://t.co/OHk7ACgqyZ via @BarracudaMama"
NASTY Anti-Trump Super PAC: Will Continue To Bash Donald Trump - https://t.co/bGWJpetJNj via @BarracudaMama
Hillary Gets THUMPED In Indiana... Then Starts Begging For MoneyTo Beat Trump - https://t.co/Aw0SOJBhGj via @BarracudaMama
Social Media Gives Scathing Response To Paul Ryan On Trump - https://t.co/Ss73Ar9MUv via @BarracudaMama
Trump Wants More Than 3 Presidential Debates With Hillary - https://t.co/dmXiA7tapU via @BarracudaMama
Where Is America Going?  Are You Following The Right Path? https://t.co/82KmqU5D1T via @wordpressdotcom
Obama's LA Trip For Tv Show Will Cost You $2 Million - https://t.co/9r1USKkhKh via @BarracudaMama
Greta ➠ Shame On The Obamas ➠ Taking 2 Planes To LA ➠ Ripping Off Taxpayers! - https://t.co/bstKRmn4y0 via @BarracudaMama
Ted Nugent donated guitar 2 our NRA Banquet signed raised $ @realDonaldTrump is a real NRA member will protect 2nd A https://t.co/VAVsRO9x6m
@shuff1138 @Boomerjeff @_HankRearden U tell em sugar they R blind sided w/lies @realDonaldTrump has worked hard 4 American Citizens R THEY ?
@_HankRearden @GCDUNHAM1 @Boomerjeff  Sugar so sick &amp; tired of ppl like media only saying or hearing what they want 2 hear @realDonaldTrump
Trump Willing to 'Sell a Building' to Pump $1 Billion Into Campaign https://t.co/tLWNUiZPtW #Newsmax via @Newsmax_Media
Trump: Romney is ungrateful for my help in 2012 https://t.co/amsZLPa19P
Trump https://t.co/3NuYujcapZ
McCain: It would be https://t.co/L65oVEbR8b
@realDonaldTrump is our choice McCain NO VOTE AZ so he'd best stand up called &amp; told him so done nothing 4 AZ border https://t.co/W7j72cc625
McCain called wanted our support told him we donated $ 2 him B 4 NO AZ Vote NOT until he stood by @realDonaldTrump   https://t.co/dLWn6CyK5r
Hey @MittRomney we voted 4 U &amp; U cheated us so why don't U give back $ @realDonaldTrump supported U back since U R trying 2 destroy our DT
'Weekly Standard' Editor Bill Kristol Meeting Mitt Romney to Float Third Party Run - Breitbart https://t.co/Fd86pP6PZX via @BreitbartNews
